timestamp,revid,parentid,sock,user,page,message
2017-06-08T14:55:46+00:00,784476556,756004385,0,Magic links bot,Evangelical Lutheran Church of Papua New Guinea,Replace [[Help:Magic links|magic links]] with templates per [[Special:Permalink/772743896#Future of magic links|local RfC]] and [[:mw:Requests for comment/Future of magic links|MediaWiki RfC]]
2017-01-31T16:39:32+00:00,762953506,749530326,0,97.127.86.35,Evangelical Lutheran Synod,/* Education ministries and missions */
2015-06-19T17:44:44+00:00,667657489,664857253,0,Juvrud,Evangelical Lutheran Synod,
2016-04-15T15:41:04+00:00,715404319,713785415,0,Randy Kryn,Evangelical Lutheran Synod,/* Hymnal */ add italics
2016-07-02T02:14:34+00:00,727924568,724225562,0,Dolotta,Evangelical Lutheran Synod,/* Education ministries and missions */
2015-11-25T01:23:24+00:00,692343008,683168564,0,Sugarcube73,Evangelical Presbyterian Church (United States),/* History */ Update number of congregations.
2017-05-05T02:22:14+00:00,778757625,768980154,0,2606:A000:894C:DA00:A085:2268:5128:898D,Evangelical Presbyterian Church (United States),
2016-07-21T17:59:38+00:00,730911224,719529853,0,InternetArchiveBot,Evangelical Presbyterian Church in South Africa,Rescuing 1 sources and tagging 0 as dead. #IABot (v1.1)
2015-08-15T08:24:33+00:00,676187007,676046500,0,Yobot,Evangelical Presbyterian Church in South Africa,[[:en:WP:CLEANER|WPCleaner]] v1.36b - [[WP:WCW]] project (Duplicate arguments in template calls)
2016-09-18T04:05:25+00:00,739952341,710813432,0,Nathan B2,Evangelical Presbyterian Church of Ivory Coast,Double link
2016-09-18T04:06:19+00:00,739952406,738638079,0,Nathan B2,"Evangelical Presbyterian Church, Ghana",Double link
2016-01-21T06:43:53+00:00,700888423,685704167,0,Cyberbot II,"Evangelical Presbyterian Church, Ghana","Rescuing 1 sources, flagging 0 as dead, and archiving 13 sources. #IABot"
2017-09-25T13:01:30+00:00,802323814,795040122,0,InternetArchiveBot,Evangelical Presbyterian Church of Togo,Rescuing 2 sources and tagging 0 as dead. #IABot (v1.5.3)
2015-03-24T00:56:24+00:00,653238787,609261350,0,98.186.164.219,Evangelical Reformed Church in Angola,added category Evangelical denominations as the name identifies it as evangelical
2015-03-26T00:18:22+00:00,653535293,616477060,0,70.167.61.26,Evangelical Presbyterian Church of Togo,added category Evangelical denominations as the name identifies it as evangelical
2015-08-13T20:45:52+00:00,675964267,665537438,0,Hebrides,Evangelical Presbyterian Church of Ivory Coast,"fill out references, [[WP:AWB/T|typo(s) fixed]]: Abidjan based → Abidjan-based using [[Project:AWB|AWB]]"
2015-03-22T11:34:40+00:00,652999897,642709080,0,Marcocapelle,Evangelical-Lutheran Church in Hungary,more specific categorisation
2016-11-23T22:19:25+00:00,751184558,751184521,0,Finnusertop,Evangelical-Lutheran Church in Hungary,/* External links */
2015-10-28T17:41:03+00:00,687951071,687950772,0,Zerubbabel,Fellowship of Independent Evangelical Churches,"Updated number of members to 39,000 to reflect the latest published figures."
2015-05-11T06:18:03+00:00,661802452,628838849,0,Marcocapelle,Fellowship of Independent Evangelical Churches,removed grandparent category of Evangelicalism
2017-07-04T03:20:20+00:00,788893523,788893439,0,2001:E68:6BC5:C801:29EB:A88C:B7BB:87F1,Foursquare Church,
2017-04-24T11:56:10+00:00,776960775,776877738,0,StAnselm,Free Church of Scotland (since 1900),added wikilink
2016-10-11T16:33:01+00:00,743849558,743481946,0,198.109.194.200,Free Methodist Church,/* Beliefs and practices */
2017-04-11T17:56:07+00:00,774949073,770785577,0,InternetArchiveBot,Foursquare Church,Rescuing 1 sources and tagging 0 as dead. #IABot (v1.3beta5)
2015-06-22T01:38:32+00:00,668031907,665654950,0,Gaia Octavia Agrippa,Free Church of Scotland (since 1900),/* top */ sp
2017-02-05T19:02:49+00:00,763875781,759156069,0,50.48.213.218,Free Methodist Church,Worldwide membership is now over 1 million. \nhttp://fmcusa.org/blog/2012/10/23/free-methodist-membership-passes-1-million/
2015-02-21T09:25:07+00:00,648163921,641325910,0,Magioladitis,Great Commission church movement,clean up / infobox standardisation using [[Project:AWB|AWB]] (10833)
2017-06-27T11:25:22+00:00,787762175,773974792,0,Bender the Bot,Great Commission church movement,"/* Widmar v. Vincent */HTTP&rarr;HTTPS for [[SCOTUS]], [[Oyez Project]] and [[Cornell Law]], per [[Wikipedia:Bots/Requests for approval/Bender the Bot 8|BRFA 8]] using [[Project:AWB|AWB]]"
2015-07-13T22:40:29+00:00,671319755,669959926,0,Libertpaulian,Homosexuality and Baptist churches,/* Conservative position */
2016-06-23T03:45:54+00:00,726591711,709957753,0,Indyguy,Gutnius Lutheran Church,Added infobox
2016-03-14T03:04:19+00:00,709957753,678090627,0,Sesel,Gutnius Lutheran Church,
2016-06-26T20:18:18+00:00,727117431,723511602,0,Nathan B2,Homosexuality and Baptist churches,Form
2016-06-12T17:17:09+00:00,724955334,724692430,0,SeminarianJohn,Homosexuality and the Anglican Communion,/* Anglican Church of Southern Africa */ Archbishop Desmond Tutu was able to bless the union of his daughter
2017-03-03T19:46:30+00:00,768434607,727117431,0,Adarkhairedone,Homosexuality and Baptist churches,/* References */ {{Religion and LGBT people}}
2016-03-04T08:42:12+00:00,708213222,708212896,0,SeminarianJohn,Homosexuality and Baptist churches,The previous link was no longer active and the information has changed. The CBF does now allow churches the choice to fund gay advocacy groups if they so choose.
2016-09-28T13:02:11+00:00,741589641,616476128,0,LittleWink,Igreja Presbiteriana de Moçambique,Disambiguating links to [[Swiss]] (link changed to [[Swiss people]]; link changed to [[Swiss people]]) using [[User:Qwertyytrewqqwerty/DisamAssist|DisamAssist]].
2016-10-26T07:35:16+00:00,746257077,746256541,0,SeminarianJohn,Homosexuality and the Anglican Communion,"/* Anglican Church of Australia */ date correction, the article was published in October but the ceremony occurred in April"
2015-07-21T15:51:08+00:00,672444822,669053093,0,KasparBot,Independent Evangelical-Lutheran Church,embed {{Authority control}} with Wikidata information
2016-08-27T12:49:02+00:00,736430826,717742174,0,Dexbot,Indonesian Christian Church Synod,Bot: Using official website template
2014-10-10T08:17:18+00:00,629027492,629027392,0,Reinaldo Christopher,Indonesian Christian Church Synod,
2017-04-30T21:46:49+00:00,778055740,774771277,0,I dream of horses,Indonesian Protestant Church in Buol Toli-Toli,"clean up, removed underlinked tag using [[Project:AWB|AWB]]"
2014-06-06T01:41:00+00:00,611762699,556467903,0,FrescoBot,Indonesian Protestant Church in Buol Toli-Toli,Bot: [[User:FrescoBot/Links|link syntax]]
2017-02-18T05:08:39+00:00,766092042,765881823,0,A Werewolf,Indonesian Protestant Church in Gorontalo,{{Calvinism-stub}}
2015-06-09T00:34:24+00:00,666117052,660267493,0,Sesamehoneytart,Indonesian Protestant Church in Gorontalo,removed rotted link
2015-04-21T12:30:24+00:00,657473353,599324704,0,76.92.73.74,Independent Presbyterian Church of Brazil,
2015-02-26T22:21:11+00:00,649002859,648861931,0,98.186.164.219,International Pentecostal Holiness Church,added category Holiness denpminations as the name identifies it as holiness
2016-09-13T10:02:21+00:00,739198792,737551770,0,68.102.109.246,International Churches of Christ,added category Evangelical denominations in North America as the article describes it as restorationist evangelicalism
2016-08-02T10:12:47+00:00,732651437,722703545,0,Ewen,International Churches of Christ,
2016-09-21T22:23:15+00:00,740571278,739952731,0,Mistico,Independent Evangelical-Lutheran Church,
2015-04-12T11:07:20+00:00,656105225,600504930,0,Dawynn,Javanese Christian Church,[[Wikipedia:WikiProject Stub sorting|stub tagging]] using [[Project:AWB|AWB]]
2016-07-02T02:48:07+00:00,727929574,713275572,0,Cyberbot II,Karo Batak Protestant Church,Rescuing 1 sources and tagging 0 as dead. #IABot
2014-08-27T08:58:20+00:00,622997531,604503828,0,CR85747,Korean Presbyterian Church Abroad,
2017-05-28T12:48:40+00:00,782673172,779252322,0,Eumolpo,Korean Presbyterian Church Abroad,orthographic
2016-06-25T04:16:21+00:00,726893792,720792250,0,Johnpacklambert,Kosin Presbyterian Church in Korea,added [[Category:1952 establishments in South Korea]] using [[WP:HC|HotCat]]
2017-08-21T18:23:54+00:00,796564346,796562969,0,Derek R Bullamore,Lesotho Evangelical Church in Southern Africa,Filled in 3 bare reference(s) with [[:en:WP:REFILL|reFill]] ()
2017-03-02T19:45:40+00:00,768262466,768262145,0,Arjayay,Kosin Presbyterian Church in Korea,Undid revision 768262145 by [[Special:Contributions/24.197.145.109|24.197.145.109]] ([[User talk:24.197.145.109|talk]]) [[WP:ENGVAR]]
2015-06-14T19:38:13+00:00,666946404,666669685,0,Ernio48,List of Christian denominations,/* Protestantism */
2016-08-11T01:47:49+00:00,733935492,733358970,0,SeminarianJohn,List of Christian denominations affirming LGBT people,/* Africa */ added the Presbyterian Church in South Africa which allows each minister to decide whether to marry same-sex couples according to its church court
2015-09-09T08:18:29+00:00,680188638,680188615,0,104.158.33.164,List of religious organizations,/* Atheist organizations= */
2017-03-28T17:42:30+00:00,772675195,768419751,0,75.128.148.94,List of parachurch organizations,"Added ""Spring Vale Christian School"" as a parachurch ministry in the United States"
2015-10-08T22:06:53+00:00,684809690,684809646,0,Sjlloyd1987,List of Christian denominations affirming LGBT people,/* Africa */
2016-10-21T00:43:51+00:00,745417745,744595232,0,184.227.53.202,List of Christian denominations,/* Quakers */
2016-08-16T20:55:51+00:00,734805999,721686250,0,Marcocapelle,List of parachurch organizations,removed [[Category:Christianity-related lists]]; added [[Category:Lists of Christian organizations]] using [[WP:HC|HotCat]]
2017-03-09T15:44:17+00:00,769441818,768456849,0,Rajkumar 1 02,List of religious organizations,/* Islamic organizations */
2017-06-01T09:48:47+00:00,783290014,783137565,0,RMCD bot,List of the largest Protestant denominations,Removing notice of move discussion
2017-03-25T19:33:34+00:00,772176642,772164940,0,PPEMES,List of the largest Protestant denominations,removed [[Category:Religion-related lists of superlatives]]; added [[Category:Christianity-related lists of superlatives]] using [[WP:HC|HotCat]]
2016-06-18T16:57:35+00:00,725905492,714279572,0,Asuros,List of the largest Protestant denominations,
2015-09-21T17:27:17+00:00,682118514,681492839,0,Nick Number,Lutheran Church in the Philippines,Undid revision 681492839 by [[Special:Contributions/Lutheran Philippines|Lutheran Philippines]] ([[User talk:Lutheran Philippines|talk]]) - copypaste from http://lutheranschurches.blogspot.com/
2015-07-03T13:21:37+00:00,669778622,667104357,0,Ernio48,List of the largest Protestant denominations,/* See also */
2017-06-27T12:54:04+00:00,787772013,782606582,0,85.76.11.235,Lutheran Church of Australia,
2016-03-15T00:55:18+00:00,710109861,680666599,0,Paul foord,Lutheran Church of Australia,/* Role in education */ main|List of Lutheran schools in Australia
2015-03-22T01:04:47+00:00,652952419,616658340,0,98.186.164.219,Lutheran Church of Central Africa,added category Evangelical denominations as it is a member of Confessional Evangelical Lutheran Conference
2016-05-15T00:10:31+00:00,720300355,709262641,0,BG19bot,Lutheran Church of Christ in Nigeria,Remove blank line(s) between list items per [[WP:LISTGAP]] to fix an accessibility issue for users of [[screen reader]]s. Do [[WP:GENFIXES]] and cleanup if needed. Discuss this at [[Wikipedia talk:WikiProject Accessibility#LISTGAP]]
2016-09-18T04:13:35+00:00,739952983,652952419,0,Nathan B2,Lutheran Church of Central Africa,Double link
2017-08-25T08:42:20+00:00,797160495,759819135,0,85.76.51.169,Lutheran Church – Canada,
2016-09-02T09:16:16+00:00,737369341,720300355,0,Dexbot,Lutheran Church of Christ in Nigeria,Bot: Using official website template
2016-10-14T04:36:00+00:00,744264473,744262691,0,207.161.217.209,Lutheran Church – Canada,Those stats are not in the document cited
2017-06-01T00:13:27+00:00,783237252,732764703,0,InternetArchiveBot,Manipur Baptist Convention,Rescuing 3 sources and tagging 0 as dead. #IABot (v1.3.2.4)
2016-01-29T03:17:50+00:00,702205872,702202769,0,Indyguy,Lutheran Church – Missouri Synod,"Undid revision 702202769 by [[Special:Contributions/Sjun9725|Sjun9725]] ([[User talk:Sjun9725|talk]]) Evangelical in the sense of Protestant/Lutheran, not modern Evangelicalism"
2014-11-18T19:33:27+00:00,634418193,634398395,0,Indyguy,Malagasy Lutheran Church,Copy edit
2017-12-07T05:07:16+00:00,814157213,814122794,0,Rjensen,Lutheran Church – Missouri Synod,cite
2016-12-03T04:56:47+00:00,752765797,730729150,0,Nyttend,Maohi Protestant Church,/* External links */ That's an independent congregation in Hawaii: nothing like this denomination
2017-09-08T00:55:58+00:00,799487058,799235377,0,146.115.73.58,Maohi Protestant Church,
2017-06-07T21:44:15+00:00,784355309,770459161,0,Jgefd,Malagasy Lutheran Church,added link
2016-10-27T07:24:26+00:00,746412985,746400405,0,Kokkarani,Mar Thoma Syrian Church,Reverted to revision 746349662 by [[Special:Contributions/Kokkarani|Kokkarani]] ([[User talk:Kokkarani|talk]]): Reverted to original. ([[WP:TW|TW]])
2017-03-05T15:39:00+00:00,768748200,767853452,0,AnomieBOT,Methodist Church Ghana,"Rescuing orphaned refs (""UMCofWB"" from [[Methodism]]; ""UVa-John Wesley"" from [[United Methodist Church]])"
2017-06-09T03:08:40+00:00,784590806,768748200,0,InternetArchiveBot,Methodist Church Ghana,Rescuing 2 sources and tagging 0 as dead. #IABot (v1.4beta)
2015-08-14T09:44:56+00:00,676047698,664948665,0,Magioladitis,Methodist Church Ghana,"clean up, replaced: imagealttext → alt using [[Project:AWB|AWB]] (11374)"
2016-08-08T10:15:40+00:00,733514627,733514312,0,Iravikorthanan,Mar Thoma Syrian Church,/* Marthoma Metropolitans of Malankara
2015-08-14T09:44:57+00:00,676047701,674315099,0,Magioladitis,Methodist Church in Indonesia,"clean up, replaced: imagealttext → alt using [[Project:AWB|AWB]] (11374)"
2016-10-25T06:27:46+00:00,746094374,736131127,0,117.197.51.158,Methodist Church in India,/* Chandigarh */
2016-12-29T15:14:40+00:00,757229965,676047703,0,60.52.117.91,Methodist Church in Malaysia,
2016-02-15T13:00:08+00:00,705090567,691034375,0,Sid Blue,Methodist Church of Fiji and Rotuma,/* The 2006 coup d'état */
2016-12-10T18:32:34+00:00,754073091,754057744,0,Kipala,Moravian Church,/* Provinces */
2016-11-09T01:02:37+00:00,748586859,734101551,0,99.197.47.140,Missionary Church,/* Core Values */
2016-08-15T14:24:20+00:00,734609749,728724668,0,Je suis Nigérian,Moravian Church,/* Present */ fixd el
2015-02-26T22:28:42+00:00,649003897,645093493,0,98.186.164.219,Missionary Church,added category Evangelical denominations in North America as it is a member of the National Association of Evangelicals
2016-06-14T16:11:18+00:00,725267161,725267122,0,Freda Martial,"National Baptist Convention of America International, Inc.",
2015-09-17T17:47:25+00:00,681516099,680250323,0,Bdebbarma,Myanmar Baptist Convention,/* External links */
2016-12-06T01:04:13+00:00,753244527,744936017,0,Hugo999,Myanmar Baptist Convention,removed [[Category:1865 establishments]]; added [[Category:1865 establishments in Burma]] using [[WP:HC|HotCat]]
2015-11-11T14:11:21+00:00,690130755,688970513,0,Meher Mansion,Methodist Church in India,Category:Affiliated institutions of the National Council of Churches in India
2017-06-24T20:17:06+00:00,787334406,786001597,0,PrimeBOT,"National Baptist Convention, USA, Inc.",Replace [[Help:Magic_links|magic links]] with templates per [[Special:PermaLink/772743896#Future_of_magic_links|local RfC]] - [[User:PrimeBOT/13|BRFA]]
2016-03-20T22:46:28+00:00,711105787,710801546,0,Magioladitis,"National Baptist Convention, USA, Inc.",[[WP:CHECKWIKI]] error fixes using [[Project:AWB|AWB]] (11974)
2017-01-19T03:36:20+00:00,760798271,753645949,0,GreenC bot,National Evangelical Presbyterian Church of Guatemala,Rescued 1 archive link. [[User:Green Cardamom/WaybackMedic_2.1|Wayback Medic 2.1]]
2017-01-20T04:09:36+00:00,760977784,756328103,0,Inter&anthro,National Presbyterian Church in Mexico,It does not say this anywhere in the source that was provided for this statement
2015-10-10T17:25:39+00:00,685078306,680386926,0,AuroralColibri,National Presbyterian Church in Mexico,/* External links */ template
2016-08-21T02:31:28+00:00,735487885,735438396,0,2600:1:E100:E1EE:8539:7F86:A48A:96B1,New Apostolic Church,"/* Bible */Added a citation needed annotation after an uncited quote in the ""Bible"" section."
2016-07-07T14:10:57+00:00,728766069,727771583,0,Lotje,New Apostolic Church,([[c:GR|GR]]) [[c:COM:FR|File renamed]]: [[File:Schwartz1.jpg]] → [[File:Friedrich Wilhelm Schwarz.jpg]] #3
2013-12-24T15:32:07+00:00,587522475,579264216,0,FrescoBot,North Bank Baptist Christian Association,Bot: [[Wikipedia:Manual of Style/Layout#Standard appendices and footers|standard sections headers]]
2015-11-09T01:14:35+00:00,689725775,689707715,0,Indyguy,North American Lutheran Church,Added ILC info with a reference
2015-02-27T00:03:05+00:00,649014744,649014674,0,98.186.164.219,Open Bible Churches,
2017-04-17T02:25:07+00:00,775783179,767992129,0,Mistico,North American Lutheran Church,
2016-06-28T18:19:23+00:00,727395326,727393536,0,Sally Jo Shelton,Open Bible Churches,/* History */
2016-02-21T14:06:09+00:00,706108609,706108555,0,RevelationDirect,Orissa Baptist Evangelistic Crusade,removed [[Category:Christian denominations in India]] using [[WP:HC|HotCat]] Already in more specific subcategory
2016-12-22T06:08:04+00:00,756135433,756135281,0,49.181.217.228,Orthodox Presbyterian Church,/* American Politics */
2016-08-02T22:17:33+00:00,732735343,732734673,0,StAnselm,Orthodox Presbyterian Church,"Reverted 1 edit by [[Special:Contributions/41.45.208.67|41.45.208.67]] ([[User talk:41.45.208.67|talk]]): Well, even if that's the case - please find a source before you add it back in. ([[WP:TW|TW]])"
2016-07-21T07:17:18+00:00,730808243,722664198,0,InternetArchiveBot,Pasundan Christian Church,Rescuing 1 sources and tagging 0 as dead. #IABot (v1.1)
2016-04-14T02:02:25+00:00,715158543,649609088,0,Just a guy from the KP,National Evangelical Presbyterian Church of Guatemala,indigeous → indigenous
2017-08-10T13:45:31+00:00,794862617,794862035,0,155.220.248.90,Pentecostal Church of God,/* Organization */
2015-09-11T03:36:45+00:00,680482735,680131328,0,Jpmeisinger,Pentecostal Church of God,/* Beliefs */Fixed typo
2015-06-11T08:21:51+00:00,666455407,666455380,0,196.21.74.34,People's Church of Africa,/* Origin */
2017-02-01T19:44:51+00:00,763183802,746207293,0,Jacobclark512,Postdenominationalism,"Changed the link for ""non-denominational"" from a generic non-denominational article about all religions to one pertaining specifically to non-denominational Christianity."
2015-11-03T16:58:01+00:00,688883972,688883817,0,Jarsonic,Presbyterian Church in America,/* Adherents and population penetration */
2015-05-25T06:30:21+00:00,663912544,662354966,0,46.139.246.240,Postdenominationalism,Fixed grammar
2016-11-22T16:32:30+00:00,750975668,750975640,0,Favonian,Presbyterian Church in America,Reverted edits by [[Special:Contribs/91.82.186.222|91.82.186.222]] ([[User talk:91.82.186.222|talk]]) to last version by 73.214.67.49
2016-07-31T19:25:00+00:00,732403658,730685356,0,Adrukker,Presbyterian Church in America,
2015-06-10T16:40:37+00:00,666357781,663152361,0,Goldnpuppy,Presbyterian Church in Canada,Added edit tag; edited references and grammar
2015-06-26T17:46:02+00:00,668789578,668774690,0,AnomieBOT,Presbyterian Church in America,"Rescuing orphaned refs (""pcaac.org"" from rev 668591636)"
2015-05-19T01:51:00+00:00,663020766,662914777,0,BattyBot,Presbyterian Church in Cameroon,"[[WP:AWB/GF|General fixes]], removed deadend tag using [[Project:AWB|AWB]]"
2017-10-22T11:03:00+00:00,806491445,782597830,0,Noyster,Presbyterian Church in Cameroon,"add lead, refs, merge content from [[Presbyterian Church of Cameroon]]"
2016-05-25T11:03:24+00:00,722004182,713497992,0,86.170.86.147,Presbyterian Church in Ireland,/* History */
2017-01-04T01:49:15+00:00,758202279,757634727,0,Nihiltres,Presbyterian Church in Ireland,/* Logo and motto */ Integrated nonstandard hatnote into prose by removing it and adding a normal wikilink in its place
2015-09-16T03:40:22+00:00,681254349,681253000,0,Sawol,Presbyterian Church in Korea (BaekSeok),
2015-09-16T03:17:14+00:00,681252336,603483363,0,Sawol,Presbyterian Church in Korea (Daeshin),
2015-08-19T18:22:45+00:00,676875400,676229368,0,Timrollpickering,Presbyterian Church in Myanmar,"/* References */update stub template, replaced: {{burma- → {{Myanmar- using [[Project:AWB|AWB]]"
2016-05-09T13:17:13+00:00,719401163,713519299,0,Warairarepano&Guaicaipuro,Presbyterian Church in Rwanda,removed [[Category:Churches in Rwanda]]; added [[Category:Christianity in Rwanda]] using [[WP:HC|HotCat]]
2016-08-14T12:53:27+00:00,734453640,734451847,0,AnomieBOT,Presbyterian Church in Taiwan,Dating maintenance tags: {{Clarify}}
2015-06-25T09:09:00+00:00,668591275,616476230,0,Hebrides,Presbyterian Church in Sudan,fill out references using [[Project:AWB|AWB]]
2016-07-10T22:08:20+00:00,729241587,623073610,0,JAS Calvin Augustine,Presbyterian Church of Africa,grammar fixes
2017-02-12T03:22:17+00:00,765001886,765001775,0,Schwede66,Presbyterian Church of Aotearoa New Zealand,"fixed [[MOS:DASH|dashes]] using a [[User:GregU/dashes.js|script]], date formats per [[MOS:DATEFORMAT]] by [[WP:MOSNUMscript|script]]"
2015-06-25T09:24:04+00:00,668592415,666534050,0,Hebrides,Presbyterian Church of Angola,"fill out references, tidy links per [[WP:OVERLINK]], non-breaking space per [[WP:NBSP]] using [[Project:AWB|AWB]]"
2015-06-11T20:44:28+00:00,666534050,663630006,0,LilHelpa,Presbyterian Church of Angola,it's → its
2015-10-28T03:25:49+00:00,687850785,662411413,0,68.173.146.231,Presbyterian Church in Taiwan,
2014-08-27T19:16:33+00:00,623073610,616476251,0,John of Reading,Presbyterian Church of Africa,"Typo/[[WP:AWB/GF|general]] fixing, replaced: one the oldest → one of the oldest using [[Project:AWB|AWB]]"
2016-09-18T04:16:06+00:00,739953186,737902702,0,Nathan B2,Presbyterian Church of Australia,Double link
2016-11-14T21:53:27+00:00,749543283,723150991,0,GreenC bot,Presbyterian Church of Aotearoa New Zealand,1 archive template merged to {{[[template:webarchive|webarchive]]}} ([[User:Green_Cardamom/Webarchive_template_merge|WAM]])
2017-08-18T05:40:12+00:00,796056804,795772641,0,Whats new?,Presbyterian Church of Australia,/* See also */ Remove link to marriage survey as not heavily related
2016-09-18T04:16:22+00:00,739953214,730307341,0,Nathan B2,Presbyterian Church of Brazil,Double link
2016-07-18T05:03:19+00:00,730307341,712942482,0,Lotje,Presbyterian Church of Brazil,Filled in 14 bare reference(s) with [[:en:WP:REFILL|reFill]] ()
2017-04-07T12:29:03+00:00,774283781,774283724,0,Leutha,Presbyterian Church of East Africa,/* Beginning */
2015-12-15T10:35:50+00:00,695339247,695339198,0,86.134.223.170,Presbyterian Church of East Africa,/* Structure */
2015-09-11T16:31:28+00:00,680555211,680551244,0,80.87.71.18,Presbyterian Church of Ghana,
2017-08-09T00:57:49+00:00,794612818,791376812,0,84.226.133.74,Presbyterian Church of Ghana,
2016-03-26T11:34:17+00:00,712020359,698788697,0,AnomieBOT,Presbyterian Church of India,Moving refs out of templates
2016-12-14T20:00:30+00:00,754838475,738338110,0,Icensnow42,Presbyterian Church of India,spelling correction
2016-07-01T17:14:04+00:00,727853581,723193448,0,Caorongjin,Presbyterian Church of Korea (TongHap),Update link to [[Seo Sang-ryun]]
2015-09-17T11:18:52+00:00,681465675,681450317,0,Sawol,Presbyterian Church of Korea (TongHap),Sawol moved page [[Presbyterian Church in Korea (TongHap)]] to [[Presbyterian Church of Korea (TongHap)]]
2015-09-04T08:16:48+00:00,679392002,664291364,0,197.211.52.13,Presbyterian Church of Nigeria,Current moderator of the General Assembly.
2017-03-30T02:03:37+00:00,772906488,761199352,0,Leetonpc,Presbyterian Church of Nigeria,
2015-08-31T06:39:44+00:00,678722035,668930870,0,39.54.163.60,Presbyterian Church of Pakistan,/* External links */
2017-02-09T17:48:26+00:00,764568074,764567766,0,190.213.102.137,Presbyterian Church of Trinidad and Tobago,/* See also */
2016-02-26T14:06:50+00:00,707006843,692476865,0,Cyberbot II,Presbyterian Church of Trinidad and Tobago,Rescuing 1 sources. #IABot
2016-01-28T17:32:27+00:00,702133756,695955732,0,2601:182:C401:3F70:8410:A6E3:F4E3:9CD3,Presbyterian Church of Pakistan,
2016-05-28T17:05:40+00:00,722515763,707005236,0,GreenC bot,Presbyterian Church of Vanuatu,[[User:Green Cardamom/WaybackMedic|WaybackMedic]] using [[Project:AWB|AWB]]
2017-10-22T04:23:18+00:00,806458052,793947997,0,Enhancer 2017,Presbyterian Church of Trinidad and Tobago,
2015-05-19T19:57:58+00:00,663137699,663137518,0,Derek R Bullamore,Presbyterian Church of Vanuatu,Filling in 4 references using [[WP:REFLINKS|Reflinks]]
2015-11-11T05:42:07+00:00,690088307,688841068,0,122.3.155.141,Presbyterian Church of the Philippines,/* Further reading */
2016-11-08T05:18:53+00:00,748437658,748437032,0,112.202.24.192,Presbyterian Church of the Philippines,/* External links */
2015-08-14T15:03:52+00:00,676079810,597651016,0,Bohemian Baltimore,Presbyterian Reformed Church of Mexico,removed [[Category:Christianity in Mexico]]; added [[Category:Protestantism in Mexico]] using [[WP:HC|HotCat]]
2016-05-15T18:45:18+00:00,720411347,720411277,0,Rathfelder,Protestant Christian Church in Bali,added [[Category:Religious organizations based in Indonesia]] using [[WP:HC|HotCat]]
2017-02-18T05:27:38+00:00,766093986,766093957,0,A Werewolf,Protestant Christian Church in Bali,
2017-02-16T23:51:44+00:00,765885216,760798288,0,A Werewolf,Protestant Church in Indonesia,
2014-06-06T19:30:26+00:00,611860644,600505242,0,Hebrides,Protestant Church in Indonesia,"/* Member churches */clean up, fill out reference, non-breaking space per [[WP:NBSP]] using [[Project:AWB|AWB]]"
