timestamp,revid,parentid,sock,user,page,message
2022-10-09T18:32:53+00:00,1115078907,1115054468,1,Mikewoodall7553,Conspicuous Gallantry Cross,
2022-10-09T20:08:46+00:00,1115095847,1115095194,1,Williamdouglass7553,Conspicuous Gallantry Cross,"Ask what you want, the truth is the truth."
2022-10-09T19:57:39+00:00,1115093877,1115086216,1,Williamdouglass7553,Conspicuous Gallantry Cross,Truth.  The truth is important Tony.
2022-10-09T19:15:21+00:00,1115086216,1115086084,0,Arado Ar 196,Conspicuous Gallantry Cross,Reverting edit(s) by [[Special:Contributions/94.3.69.122|94.3.69.122]] ([[User_talk:94.3.69.122|talk]]) to rev. 1115085481 by Tk4y06: No reliable source ([[w:en:WP:UV|UV 0.1.3]])
2022-10-09T20:05:12+00:00,1115095194,1115093877,0,Tk4y06,Conspicuous Gallantry Cross,Unsure why name has been repeatedly changed. I'm going to request to stick with this name as it is the only one with applicable references.
