timestamp,revid,parentid,sock,user,page,message
2019-01-07T22:00:03+00:00,877310207,860497681,1,Anythingworx23,User talk:Anythingworx23,
2019-01-01T04:32:43+00:00,876253688,875949488,1,Anythingworx23,ISouljaBoyTellem,
2018-12-30T03:38:08+00:00,875949488,874409285,1,Anythingworx23,ISouljaBoyTellem,The sidebar proves mixed reviews rather than negative.
2018-12-14T03:13:13+00:00,873630025,873574447,1,Anythingworx23,Lil Pump (album),"Undid revision 873574447 by [[Special:Contributions/2601:C8:200:77E:F888:153E:CC21:DCAD|2601:C8:200:77E:F888:153E:CC21:DCAD]] ([[User talk:2601:C8:200:77E:F888:153E:CC21:DCAD|talk]]) Stop your disruptive editing, you will be blocked from editing on Wikipedia if your vandalism does not stop. This song does not exist."
2018-12-12T20:17:31+00:00,873375468,873240927,1,Anythingworx23,Lil Pump (album),"Stop your disruptive editing, this song does not exist, and I have checked Apple Music, Spotify, iTunes, YouTube, Tidal, Genius, and the general web."
2018-12-11T08:16:26+00:00,873130435,873129860,1,Anythingworx23,"TLC: Tables, Ladders & Chairs (2018)","This was kayfabe, and shouldn't be read as legitimate."
2018-12-08T05:26:39+00:00,872629335,871917337,1,Anythingworx23,Crown Jewel (2018),Better to describe why these matches were poorly received.
2018-12-05T23:35:47+00:00,872221929,872221814,1,Anythingworx23,Braun Strowman,"Undid revision 872221326 by [[Special:Contributions/2601:248:8380:4F4D:D55F:8334:A5B4:865D|2601:248:8380:4F4D:D55F:8334:A5B4:865D]] ([[User talk:2601:248:8380:4F4D:D55F:8334:A5B4:865D|talk]]) Again, cut it out"
2018-12-05T23:34:43+00:00,872221814,872221326,1,Anythingworx23,Braun Strowman,"Undid revision 872221111 by [[Special:Contributions/2601:248:8380:4F4D:D55F:8334:A5B4:865D|2601:248:8380:4F4D:D55F:8334:A5B4:865D]] ([[User talk:2601:248:8380:4F4D:D55F:8334:A5B4:865D|talk]]) Stop it, get some help."
2018-12-04T02:44:46+00:00,871895899,871729183,1,Anythingworx23,Kamikaze (Eminem album),Undid revision 871729183 by [[Special:Contributions/EditAvenger|EditAvenger]] ([[User talk:EditAvenger|talk]]) Unsourced
2018-12-02T20:07:13+00:00,871685833,871625882,1,Anythingworx23,Revival (Eminem album),"Undid revision 871584790 by [[Special:Contributions/83.71.69.255|83.71.69.255]] ([[User talk:83.71.69.255|talk]]) Cut this shit out, it is SOURCED information that should be listed to the viewers, and it's also stated in the summary and the singles sections of this article, so not only are you vandalizing this page, you are also being lazy. You WILL be blocked from wikipedia if this continues."
2018-12-02T20:03:45+00:00,871685360,871685033,1,Anythingworx23,Lucky You (Eminem song),Fixed more of what should be seen
2018-12-02T20:01:16+00:00,871685033,871494889,1,Anythingworx23,Lucky You (Eminem song),"Nothing has been sourced to prove that this song is a single from the album. And, no, a music video doesn't count."
2018-12-02T20:00:16+00:00,871684891,871490139,1,Anythingworx23,Kamikaze (Eminem album),"Undid revision 871490139 by [[Special:Contributions/Rainerpasca|Rainerpasca]] ([[User talk:Rainerpasca|talk]]) It shouldn't be, it's unsourced."
2018-11-29T04:12:02+00:00,871134121,871134010,1,Anythingworx23,The Beautiful & Damned (album),Wikipedia's visuals make this look better in terms of what the actual album rating was.
2018-11-29T04:10:51+00:00,871134010,870582111,1,Anythingworx23,The Beautiful & Damned (album),"Fixed two typos, both of which were my own mistakes."
2018-11-27T02:16:19+00:00,870799284,870793655,1,Anythingworx23,Kamikaze (Eminem album),Undid revision 870793655 by [[Special:Contributions/173.11.94.33|173.11.94.33]] ([[User talk:173.11.94.33|talk]]) That's not how this works.
2018-11-24T20:24:41+00:00,870437912,869923968,1,Anythingworx23,Super Mario Party,"Stop with incorrect information, Metacritic says ""Generally favorable reviews""."
2018-11-24T20:19:24+00:00,870437293,870409557,1,Anythingworx23,Revival (Eminem album),"Undid revision 870409557 by [[Special:Contributions/83.71.105.234|83.71.105.234]] ([[User talk:83.71.105.234|talk]]) First of all, stop your disruptive editing, this information is sourced. Secondly, you screwed up the infobox, check how it works, next time."
2018-11-23T08:18:11+00:00,870220659,870220329,1,Anythingworx23,Ryback,Undid revision 870220329 by [[Special:Contributions/2A02:C7D:BF47:2B00:9098:F3D8:1159:F983|2A02:C7D:BF47:2B00:9098:F3D8:1159:F983]] ([[User talk:2A02:C7D:BF47:2B00:9098:F3D8:1159:F983|talk]]) What happened?
2018-11-23T07:58:16+00:00,870219221,869650384,1,Anythingworx23,The Beautiful & Damned (album),"Good God, this section needed a freaking clean up, changed the reviews to the ones listed on Metacritic, and added the info box."
2018-11-23T07:30:40+00:00,870217068,867660290,1,Anythingworx23,Handwritten (Shawn Mendes album),Made an edit to better reflect how the album was received.
2018-11-19T02:14:13+00:00,869510180,869510085,1,Anythingworx23,Kamikaze (Eminem album),Undid revision 869496734 by [[Special:Contributions/Israelsrealm|Israelsrealm]] ([[User talk:Israelsrealm|talk]]) The respective section for this information says otherwise in terms of how the album was received.
2018-11-19T02:13:15+00:00,869510085,869496885,1,Anythingworx23,Kamikaze (Eminem album),"Undid revision 869496885 by [[Special:Contributions/Israelsrealm|Israelsrealm]] ([[User talk:Israelsrealm|talk]]) This information is incorrect, source your edits."
2018-11-13T22:35:59+00:00,868706837,868585417,1,Anythingworx23,Encore (Eminem album),"In the ""Critical Reception"" section, there's a part where Eminem explains that some songs were created to fill in the album, as part of it was leaked."
2018-11-10T18:34:12+00:00,868208424,867953374,1,Anythingworx23,Revival (Eminem album),"Undid revision 867927472 by [[Special:Contributions/80.233.34.116|80.233.34.116]] ([[User talk:80.233.34.116|talk]]) This is SOURCED content STATED in the article itself, please stop this disruptive editing."
2018-11-10T14:33:08+00:00,868179526,868033996,1,Anythingworx23,Encore (Eminem album),"Cleaned up more of the article, the censorship section has a different structure to make more sense in the way it's presented, as well as having the ""notes"" section to not include unnecessary or incorrect. information."
2018-11-10T14:25:56+00:00,868178718,867647331,1,Anythingworx23,The Marshall Mathers LP,"Undid revision 867362885 by [[Special:Contributions/Robvanvee|Robvanvee]] ([[User talk:Robvanvee|talk]]) Very clearly you have a problem with me and when I edit, even when information is sourced in the article, you want to source my edits, even though it's already sourced elsewhere, either way, it would make more sense to keep the 1998 first, rather than to put it last, that just makes common sense."
2018-11-07T01:45:47+00:00,867641665,867641544,1,Anythingworx23,Just Lose It,Undid revision 848140077 by [[Special:Contributions/Richhoncho|Richhoncho]] ([[User talk:Richhoncho|talk]])
2018-11-07T01:44:15+00:00,867641544,867504557,1,Anythingworx23,Just Lose It,"Not only is this blatantly untrue for one of the songs, it charted high anyways."
2018-11-05T04:44:35+00:00,867354391,866376167,1,Anythingworx23,The Slim Shady LP,"If the album has sold at least 5 million physical copies, then it's 5x platnium"
2018-11-05T03:55:43+00:00,867348345,867326914,1,Anythingworx23,Nine Track Mind,"It was never worded that way... anyways, it needed to cleaned up for grammatical issues."
2018-11-05T03:47:57+00:00,867347560,867340890,1,Anythingworx23,Encore (Eminem album),"Heavily cleaned up the ""Censorship"" section of the article, and added info to the summary, as well as Eminem's updated look on ""Encore""."
2018-11-05T03:03:37+00:00,867340890,867340456,1,Anythingworx23,Encore (Eminem album),"""We as Americans"" was never extensively censored, rather, ""dead"" was just reversed."
2018-11-05T03:01:05+00:00,867340456,867269378,1,Anythingworx23,Encore (Eminem album),Critical Reception does not belong in the section talking about Commercial performance whatsoever.
2018-11-05T00:20:24+00:00,867316199,867149056,1,Anythingworx23,Bitch Please II,Changed the summary to more accurately define that the song was a single.
2018-11-05T00:17:12+00:00,867315812,867247306,1,Anythingworx23,The Marshall Mathers LP,In this case put 1998 for the start that the album was recorded.
2018-11-04T00:14:29+00:00,867149056,857680165,1,Anythingworx23,Bitch Please II,The song was released as a single on Vinyl.
2018-11-04T00:13:47+00:00,867148952,867148788,1,Anythingworx23,The Marshall Mathers LP,Source reference is unnecessary under the infobox.
2018-11-04T00:12:35+00:00,867148788,867118592,1,Anythingworx23,The Marshall Mathers LP,"The source reference was unnecessary under the infobox, and ""Kill You"" being a single is unsourced."
2018-11-01T02:29:36+00:00,866716518,862972351,1,Anythingworx23,Take Me to Church,Just no.
2018-10-29T23:45:37+00:00,866375834,866297320,1,Anythingworx23,Revival (Eminem album),Undid revision 866129172 by [[Special:Contributions/80.233.45.47|80.233.45.47]] ([[User talk:80.233.45.47|talk]]) Stated in the article
2018-10-28T04:47:50+00:00,866087061,865881934,1,Anythingworx23,Encore (Eminem album),"Undid revision 865473420 by [[Special:Contributions/Ringerfan23|Ringerfan23]] ([[User talk:Ringerfan23|talk]]) We're not going to sit here and say that this is unsourced when the album is made by a hip-hop aritist, has hip-hop features, etc."
2018-10-26T02:24:03+00:00,865776927,865776892,1,Anythingworx23,Revival (Eminem album),Undid revision 865579997 by [[Special:Contributions/Haydenforbesvevo|Haydenforbesvevo]] ([[User talk:Haydenforbesvevo|talk]]) Unsourced
2018-10-26T02:23:43+00:00,865776892,865579997,1,Anythingworx23,Revival (Eminem album),"Undid revision 865579802 by [[Special:Contributions/Haydenforbesvevo|Haydenforbesvevo]] ([[User talk:Haydenforbesvevo|talk]]) That's not how this works, if you can read the annotation, it very explicitly says NOT to include ""Framed"" as a single, because it was not."
2018-10-21T18:30:43+00:00,865098970,862772478,1,Anythingworx23,Beautiful (Eminem song),"Changed the previous single to ""3 a.m."", as ""Old Time's Sake was not released as a single, rather, as a promotional single."
2018-10-21T18:27:53+00:00,865098635,865098575,1,Anythingworx23,3 a.m. (Eminem song),
2018-10-21T18:27:18+00:00,865098575,865098306,1,Anythingworx23,3 a.m. (Eminem song),Fixed typo
2018-10-21T18:24:48+00:00,865098306,865097850,1,Anythingworx23,3 a.m. (Eminem song),"Changed the next single to ""Beautiful"", as ""Old Time's Sake"" wasn't a single, rather, a promotional single."
2018-10-21T18:20:41+00:00,865097850,854614714,1,Anythingworx23,3 a.m. (Eminem song),"Changed the next single to ""Beautiful, as ""Old Time's Sake"" wasn't a single, rather as a promotional single."
2018-10-21T18:18:27+00:00,865097593,864874033,1,Anythingworx23,Old Time's Sake,"Fixed some info to reflect the fact that this song wasn't released as an official single, rather, as a Promotional Single."
2018-10-21T18:09:17+00:00,865096585,865096503,1,Anythingworx23,Relapse (Eminem album),Removed subjective information.
2018-10-21T18:08:22+00:00,865096503,861138566,1,Anythingworx23,Relapse (Eminem album),Changed information to more accurately reflect how the album's reception has changed.
2018-10-20T20:21:58+00:00,864970447,864436634,1,Anythingworx23,Business (song),Undid revision 864436634 by [[Special:Contributions/Robvanvee|Robvanvee]] ([[User talk:Robvanvee|talk]]) Stated in the Album's article.
2018-10-17T02:11:59+00:00,864415967,864415736,1,Anythingworx23,Fall (Eminem song),
2018-10-17T02:09:30+00:00,864415736,864304277,1,Anythingworx23,Fall (Eminem song),
2018-09-25T22:03:55+00:00,861215080,861215041,1,Anythingworx23,Encore (Eminem album),Undid revision 861215041 by [[Special:Contributions/Anythingworx23|Anythingworx23]] ([[User talk:Anythingworx23|talk]])
2018-09-25T22:03:29+00:00,861215041,861215023,1,Anythingworx23,Encore (Eminem album),"Undid revision 860969169 by [[Special:Contributions/Robvanvee|Robvanvee]] ([[User talk:Robvanvee|talk]]) Most critics tend to agree that the middle of the album was lackluster, and Wikipedia should be giving information that is most accurately defined for the reader."
2018-09-25T22:03:19+00:00,861215023,861138482,1,Anythingworx23,Encore (Eminem album),"Undid revision 860969169 by [[Special:Contributions/Robvanvee|Robvanvee]] ([[User talk:Robvanvee|talk]]) Most critics tend to agree that the middle of the album was lackluster, and Wikipedia should be giving information that is most accurately defined for the reader."
2018-09-24T00:32:36+00:00,860923462,860887417,1,Anythingworx23,Encore (Eminem album),"Changed the beginning of the ""critical reception"" section to better fit the album's overall reception."
2018-09-21T02:10:09+00:00,860497555,859734638,1,Anythingworx23,The Slim Shady LP,"Undid revision 859478798 by [[Special:Contributions/174.199.19.95|174.199.19.95]] ([[User talk:174.199.19.95|talk]]) ""Just Don't Give a Fuck"" was a single before the album released, and included on the album, making it an official single."
2018-09-21T02:06:57+00:00,860497248,860456829,1,Anythingworx23,Recovery (Eminem album),"Restated the beginning of the ""critical reception"" section to better suit the album's reception."
2018-09-21T02:04:15+00:00,860496950,860496841,1,Anythingworx23,Kamikaze (Eminem album),No singles have been released or announced for the album.
2018-09-21T02:03:20+00:00,860496841,860482086,1,Anythingworx23,Kamikaze (Eminem album),Fixed unsourced information with a more legitimate claim.
2018-09-13T23:55:08+00:00,859424682,859424188,1,Anythingworx23,Kamikaze (Eminem album),"Undid revision 859424188 by [[Special:Contributions/ClueBot NG|ClueBot NG]] ([[User talk:ClueBot NG|talk]]): The album's ""critical reception"" section supports this claim."
2018-09-13T23:51:22+00:00,859424406,859353319,1,Anythingworx23,Revival (Eminem album),"Edited the summary for ""Remind Me"" to be included in where the singles were released, as well as edited apart of the reception area of the summary."
2018-09-13T23:48:08+00:00,859424172,859418959,1,Anythingworx23,Kamikaze (Eminem album),Edited the summary to accurately reflect how the album was received.
2018-09-13T02:35:10+00:00,859292416,859261607,1,Anythingworx23,Revival (Eminem album),"Changed grammatical error at the end of the ""critical"" reception section."
2018-09-13T02:32:19+00:00,859292180,859281550,1,Anythingworx23,Kamikaze (Eminem album),"Changed the beginning of the ""critical reception"" section to better fit the critical reception."
2018-09-10T21:13:09+00:00,858971633,858956328,1,Anythingworx23,Relapse (Eminem album),Changed grammatical errors in the summary
2018-09-01T17:50:42+00:00,857588487,857571565,1,Anythingworx23,Relapse (Eminem album),Fixed grammar issue in the summary
2018-08-28T02:42:26+00:00,856874246,856744788,1,Anythingworx23,Revival (Eminem album),"Added ""AllMusic's"" review in the ""Critical Reception"" area along with ""The Irish Times"" and ""Consequence of Sound's"""
2018-08-27T20:26:47+00:00,856834112,856607052,1,Anythingworx23,User talk:Robvanvee,"/* Response to ""Remind Me"" as a single */ new section"
2018-08-27T00:23:25+00:00,856696977,856696853,1,Anythingworx23,Revival (Eminem album),"Eminem announced ""Remind Me"" as a single during a concert in Italy, and said that it would be released the following Friday."
2018-08-27T00:22:30+00:00,856696853,856635669,1,Anythingworx23,Revival (Eminem album),"Eminem announced the release of ""Remind Me"" as a single during a concert in Italy and that it would be released the upcoming Friday."
2018-08-24T20:27:54+00:00,856386500,854003773,1,Anythingworx23,Recovery (Eminem album),Added more specification to the critical reception area to better explain what the album was praised for.
2018-08-22T11:41:38+00:00,856029471,853651775,1,Anythingworx23,Nowhere Fast (Eminem song),"Added a new ""background"" section for the song."
2018-08-22T11:29:59+00:00,856028093,855738320,1,Anythingworx23,Revival (Eminem album),Changed the album's run time to make it more clear to viewers
2018-08-22T09:40:03+00:00,856016933,855782086,1,Anythingworx23,Red Pill Blues,Changed part of the critical reception section to better fit the review.
2018-08-21T23:09:24+00:00,855953360,855953342,1,Anythingworx23,Slim Shady EP,
2018-08-21T23:09:14+00:00,855953342,855953293,1,Anythingworx23,Slim Shady EP,
2018-08-21T23:08:41+00:00,855953293,853552364,1,Anythingworx23,Slim Shady EP,"Added a ""singles"" section for the EP."
2018-08-21T23:04:07+00:00,855952895,855464698,1,Anythingworx23,The Slim Shady LP,"Changed the first single to ""Just Don't Give a Fuck"" as the song was released as a single before the album's release."
2018-08-21T21:58:54+00:00,855946130,852198702,1,Anythingworx23,The Marshall Mathers LP,"Added ""I'm Back"" as a single, as it was released as an unsuccessful single, and Eminem's Single Discography even has it as a listed single on the page. I am also in hopes ""I'm Back"" will receive its own page."
2018-08-20T12:25:25+00:00,855728012,855679127,1,Anythingworx23,Red Pill Blues,"Changed the summary to fit what ""Girls Like You's"" single placement was."
2018-08-20T12:12:52+00:00,855726895,855656359,1,Anythingworx23,Relapse (Eminem album),"Changed the summary to better fit the singles, as well as changing the songs that were singles, as ""Old Time's Sake"" wasn't actually a single, rather, just a promotional one."
2018-08-20T12:04:57+00:00,855726167,840919887,1,Anythingworx23,Old Time's Sake,
2018-08-20T05:52:20+00:00,855697325,855543846,1,Anythingworx23,Nine Track Mind,
2018-08-20T02:12:32+00:00,855679127,855539868,1,Anythingworx23,Red Pill Blues,
2018-08-19T22:38:44+00:00,855656686,854042950,1,Anythingworx23,Encore (Eminem album),Better explained as to what the critics felt on the album
2018-08-19T22:35:56+00:00,855656359,854742372,1,Anythingworx23,Relapse (Eminem album),Better defined as to why critics gave the album mixed reviews.
2018-08-19T19:53:13+00:00,855638884,855637881,1,Anythingworx23,Revival (Eminem album),"Added links to ""Remind Me"" in hopes that a page will be created for the single, as singles usually have their own dedicated page."
2018-08-19T19:44:25+00:00,855637881,855253445,1,Anythingworx23,Revival (Eminem album),"Added links to some of the words, as well as describing more of what the album was criticized/praised for."
2018-08-19T02:42:27+00:00,855543846,847761869,1,Anythingworx23,Nine Track Mind,"Updated the singles in the summary to better suit the information, as well as adding the release date for Dangerously's music video."
2018-08-19T01:58:17+00:00,855539868,855539746,1,Anythingworx23,Red Pill Blues,
2018-08-19T01:57:05+00:00,855539746,855158872,1,Anythingworx23,Red Pill Blues,"Changed what the singles of the album were to better fit their respective pages, this page and to have the correct information provided."
2018-08-17T00:11:00+00:00,855253445,855253235,1,Anythingworx23,Revival (Eminem album),"Changed the summary to better suit the ""Critical Reception"" section."
2018-08-17T00:08:16+00:00,855253217,855164730,1,Anythingworx23,Revival (Eminem album),
2018-08-07T06:29:51+00:00,853831046,853826321,1,Anythingworx23,Revival (Eminem album),"Changed the summary to better fit the ""critical reception"" section."
2018-08-07T06:26:16+00:00,853830789,853825964,1,Anythingworx23,User talk:TheDragonFire300,/* Thank You */ new section
2018-08-07T02:59:12+00:00,853808482,853803008,1,Anythingworx23,User talk:TheDragonFire300,"/* Response to the ""critical reception"" of ""Revival"" */ new section"
2018-08-07T01:00:24+00:00,853793249,853792970,1,Anythingworx23,User talk:TheDragonFire300,/* About Revival's critical reception */
2018-08-07T00:58:28+00:00,853792970,852618828,1,Anythingworx23,User talk:TheDragonFire300,/* About Revival's critical reception */ new section
2018-08-07T00:44:45+00:00,853791233,853790240,1,Anythingworx23,Revival (Eminem album),"Shaped up the ""Critical Reception"" area to better fit how to the album was reacted to."
2018-08-07T00:36:41+00:00,853790240,853428183,1,Anythingworx23,Revival (Eminem album),
2018-08-07T00:34:01+00:00,853789927,853672022,1,Anythingworx23,The Beautiful & Damned (album),
2019-01-04T02:31:21+00:00,876726499,876726211,1,BigChungus12,Encore (Eminem album),Undid revision 876726211 by [[Special:Contributions/Gaelan|Gaelan]] ([[User talk:Gaelan|talk]]) It is best that the viewers of this page get the most accurate information.
2019-01-04T02:27:28+00:00,876726143,876583113,1,BigChungus12,Encore (Eminem album),Undid revision 876583113 by [[Special:Contributions/Abelmoschus Esculentus|Abelmoschus Esculentus]] ([[User talk:Abelmoschus Esculentus|talk]]) Yeetmus had a point.
2019-01-07T04:16:20+00:00,877191774,877191514,1,Smartguy273,Encore (Eminem album),"Undid revision 877191514 by [[Special:Contributions/Gaelan|Gaelan]] ([[User talk:Gaelan|talk]]) You should at least give a good explanation for your edit, as the other guys did."
2019-01-07T04:13:21+00:00,877191375,876726975,1,Smartguy273,Encore (Eminem album),Undid revision 876726975 I mean...
2019-01-03T05:25:00+00:00,876583094,876583034,1,Yeetmus,Encore (Eminem album),"Undid revision 876583034 by [[Special:Contributions/Abelmoschus Esculentus|Abelmoschus Esculentus]] ([[User talk:Abelmoschus Esculentus|talk]]) You may be blocked from editing without further warning the next time you vandalize Wikipedia by deliberately introducing incorrect information, as you did at Encore (Eminem album)."
2019-01-03T05:23:03+00:00,876582935,876582821,1,Yeetmus,Encore (Eminem album),"Undid revision 876582821 by [[Special:Contributions/Abelmoschus Esculentus|Abelmoschus Esculentus]] ([[User talk:Abelmoschus Esculentus|talk]]) Wikipedia's about accuracy, and we need to give it to the people viewing the article."
2019-01-03T05:21:08+00:00,876582774,876582642,1,Yeetmus,Encore (Eminem album),"Undid revision 876582642 by [[Special:Contributions/Robvanvee|Robvanvee]] ([[User talk:Robvanvee|talk]])You may be blocked from editing without further warning the next time you vandalize Wikipedia by deliberately introducing incorrect information, as you did at Encore (Eminem album)."
2019-01-03T05:18:12+00:00,876582489,876581847,1,Yeetmus,Encore (Eminem album),Undid revision 876581847 by [[Special:Contributions/Robvanvee|Robvanvee]] ([[User talk:Robvanvee|talk]]) People need correct information
2019-01-03T05:11:38+00:00,876581711,876294105,1,Yeetmus,Encore (Eminem album),Fixed some MAJOR typos
2018-08-12T16:40:22+00:00,854614714,850714242,0,Neateditor123,3 a.m. (Eminem song),/* Travis Barker remix */ Changing the link here since the other one was dead.
2018-10-23T16:44:31+00:00,865386556,865368207,0,Red Jay,Braun Strowman,"Reverted 1 pending edit by [[Special:Contributions/49.150.89.131|49.150.89.131]] to revision 865320278 by 180.217.223.163: Unclear, unsourced sentence"
2018-11-20T20:17:21+00:00,869853695,867730987,0,Zackmann08,Bitch Please II,fixing deprecated params
2018-11-10T22:54:41+00:00,868239399,867637108,0,Telescopegenius,Braun Strowman,/* Universal Championship pursuits (2017–present) */  Fixed typo (woudl to would)
2018-12-23T19:44:47+00:00,875095369,875040030,0,HHH Pedrigree,Braun Strowman,/* Professional wrestling */
2018-09-02T09:09:33+00:00,857680165,857680120,0,Ss112,Bitch Please II,
2018-12-20T04:33:29+00:00,874577354,874426386,0,I Am Awesome 061796,Braun Strowman,
2018-12-24T21:50:03+00:00,875243164,871532342,0,Forbearance,Beautiful (Eminem song),
2018-11-20T19:22:46+00:00,869846404,869834552,0,Zackmann08,Beautiful (Eminem song),fixing deprecated params
2018-07-17T16:47:27+00:00,850714242,834411201,0,Mr. Guye,3 a.m. (Eminem song),Rescuing 3 sources and tagging 0 as dead. #IABot (v2.0beta2)
2018-10-16T22:02:04+00:00,864390374,864384882,0,Mandarax,Crown Jewel (2018),/* Controversy */ Fix typo
2018-12-24T18:59:43+00:00,875226672,875019549,0,41.113.51.62,Crown Jewel (2018),
2018-10-19T01:30:49+00:00,864723909,861323993,0,Mkim27226,Encore (Eminem album),/* Censorship */
2018-09-23T18:53:13+00:00,860887417,860142801,0,69.11.116.72,Encore (Eminem album),
2018-09-02T15:37:42+00:00,857718979,857677794,0,49.189.19.26,Encore (Eminem album),
2018-09-05T15:31:43+00:00,858172945,858172724,0,Unreal7,Encore (Eminem album),/* Certifications */
2018-12-03T04:36:45+00:00,871747081,871710243,0,Robvanvee,Encore (Eminem album),Reverted 1 edit by [[Special:Contributions/96.59.214.185|96.59.214.185]] ([[User talk:96.59.214.185|talk]]) to last revision by Unreal7. ([[WP:TW|TW]])
2018-11-18T07:14:16+00:00,869383468,869322199,0,Robvanvee,Encore (Eminem album),Reverted 1 edit by [[Special:Contributions/2601:C8:C000:830:C53A:C4D:683A:C6B9|2601:C8:C000:830:C53A:C4D:683A:C6B9]] ([[User talk:2601:C8:C000:830:C53A:C4D:683A:C6B9|talk]]) to last revision by Robvanvee. ([[WP:TW|TW]])
2018-09-26T16:34:09+00:00,861323993,861215080,0,Robvanvee,Encore (Eminem album),Reverted 3 edits by [[Special:Contributions/Anythingworx23|Anythingworx23]] ([[User talk:Anythingworx23|talk]]): That is not what the BBC review says. Source your edits! ([[WP:TW|TW]])
2018-10-28T05:23:14+00:00,866090233,866087061,0,Robvanvee,Encore (Eminem album),Reverted 1 edit by [[Special:Contributions/Anythingworx23|Anythingworx23]] ([[User talk:Anythingworx23|talk]]): Not good enough . ([[WP:TW|TW]])
2018-08-08T15:37:04+00:00,854042950,852647432,0,5.110.146.203,Encore (Eminem album),
2018-12-01T15:19:15+00:00,871507116,871506925,0,Unreal7,Encore (Eminem album),
2018-12-26T04:37:05+00:00,875384283,875356118,0,Robvanvee,Encore (Eminem album),Reverted 1 edit by [[Special:Contributions/100.4.116.80|100.4.116.80]] ([[User talk:100.4.116.80|talk]]): Unsourced . ([[WP:TW|TW]])
2018-09-18T16:15:49+00:00,860142801,860140714,0,Robvanvee,Encore (Eminem album),Reverted 1 edit by [[Special:Contributions/184.71.183.114|184.71.183.114]] ([[User talk:184.71.183.114|talk]]) to last revision by 88.157.171.18. ([[WP:TW|TW]])
