timestamp,revid,parentid,sock,user,page,message
2018-03-20T03:56:50+00:00,831350768,0,1,Forceian,User talk:Forceian,/* Md Sakil Ahmed */ new section
2018-03-20T18:57:07+00:00,831465271,0,1,Forcian2,User:Forcian2,I've added a page to wiki about a rising celebrety of BD as a blogger Md Sakil Ahmed
2018-03-20T06:43:54+00:00,831368411,831359514,1,Forcian2,User talk:Forcian2,/* About Removing Deletion Tag From the Page Md Sakil Ahmed */ new section
2018-03-20T07:41:52+00:00,831374500,831372807,0,Cahk,User talk:Forcian2,Final warning: Removing speedy deletion tags. ([[WP:TW|TW]])
2018-03-20T07:24:50+00:00,831372806,831361991,0,Cahk,User talk:Forceian,Notifying about suspicion of sockpuppeteering. ([[WP:TW|TW]])
2018-03-20T15:17:43+00:00,831427811,831421033,0,GreenMeansGo,User talk:Forceian,/* Speedy deletion nomination of Md. Sakil Ahmed */ new section
2018-03-20T05:42:36+00:00,831361991,831353143,0,Renamed user cdb78c3737e6b7f6ba7e28cedcc6608711202eee,User talk:Forceian,Caution: Removing speedy deletion tags on [[:MD Sakil Ahmed]]. ([[WP:TW|TW]])
2018-03-20T04:18:35+00:00,831353143,831350768,0,Renamed user cdb78c3737e6b7f6ba7e28cedcc6608711202eee,User talk:Forceian,Notification: speedy deletion nomination of [[:MD Sakil Ahmed]]. ([[WP:TW|TW]])
