timestamp,revid,parentid,sock,user,page,message
2018-10-23T20:48:47+00:00,865420023,824108290,1,Arrow_Nande,User talk:Arrow Nande,/* Unblock Arrow Nande  */ new section
2018-02-05T10:02:23+00:00,824104241,823953244,1,Arrow_Nande,User talk:Arrow Nande,/* Arrow Nande */ new section
2018-02-03T12:38:09+00:00,823791496,823266043,1,Arrow_Nande,Cassper Nyovest,It was containing wrong information
2018-02-25T05:31:22+00:00,827521709,0,1,Nande_Xotyeni,User:Nande Xotyeni,This is information about Arrow Nande
2018-02-03T12:38:13+00:00,823791503,823791496,0,ClueBot NG,Cassper Nyovest,"Reverting possible vandalism by [[Special:Contribs/Arrow Nande|Arrow Nande]] to version by Julietdeltalima. [[WP:CBFP|Report False Positive?]] Thanks, [[WP:CBNG|ClueBot NG]]. (3271094) (Bot)"
2018-02-05T10:50:09+00:00,824108290,824104241,0,Melcous,User talk:Arrow Nande,/* Arrow Nande */ remove self promotion; add warning
2018-09-10T12:41:36+00:00,858907222,857437098,0,DumbBOT,Cassper Nyovest,removing a protection template from a non-protected page ([[User:DumbBOT/Protection|info]])
2018-02-25T18:39:01+00:00,827608099,827521709,0,GeneralizationsAreBad,User:Nande Xotyeni,Adding sockpuppetry tag per [[Wikipedia:Sockpuppet investigations/Arrow Nande]]
2018-06-05T19:21:41+00:00,844575000,844574815,0,Goitse2015,Cassper Nyovest,
2018-03-24T07:11:34+00:00,832167528,832051126,0,41.113.124.242,Cassper Nyovest,Record Lable He's Currently signed  to
