timestamp,revid,parentid,sock,user,page,message
2020-04-03T15:27:18+00:00,948882087,948878876,1,Nehalsharma472,Neha Sharma,Nehal sharma
2020-04-03T15:10:12+00:00,948878876,945148542,1,Nehalsharma472,Neha Sharma,Nehal Sharma experimental researcher
2020-04-03T15:04:31+00:00,948877799,948869653,1,Nehalsharma472,Nehal,Nehal Sharma Experimental researcher
2020-04-03T14:20:00+00:00,948869653,943525788,1,Nehalsharma472,Nehal,Nehal Sharma Experimental researcher
2020-04-03T13:52:24+00:00,948865917,948431642,1,Nehalsharma472,Pendleton Round-Up and Happy Canyon Hall of Fame,Nehal Sharma Experimental researcher
2020-03-02T10:20:45+00:00,943525788,937824380,0,103.46.242.53,Nehal,
2020-03-12T03:01:57+00:00,945148542,945068980,0,Steam5,Neha Sharma,
2020-04-03T15:10:28+00:00,948878924,948877799,0,MusikBot,Nehal,Removing protection templates from unprotected page ([[User:MusikBot/FixPP/FAQ|more info]])
