timestamp,revid,parentid,sock,user,page,message
2019-06-05T13:58:35+00:00,900411156,897557129,1,Timmy96,Ewerthon,"Expand Information on Ewerthon's article. However, I haven't finished it yet because I am editing this article somewhere else instead of my house.I am editing an article that I requested to expand an article. Now, I am the one who's expanding the article of Ewerthon."
2019-06-03T08:29:59+00:00,900077873,875885706,1,Timmy96,Dean Winnard,Expand Information on Dean Winnard's article
2019-05-27T16:12:00+00:00,899055901,898929193,1,Timmy96,Welliton,Minor Change again
2019-05-27T16:01:56+00:00,899054416,898888292,1,Timmy96,Astrit Ajdarević,Update Information on Astrit Ajdarević's article
2019-05-26T16:54:16+00:00,898898937,897485111,1,Timmy96,Welliton,Expand and Update Information on Welliton's article.
2019-05-18T21:00:39+00:00,897708581,892186531,1,Timmy96,Joe Devera,Expand Information on Joe Devera's article
2019-05-10T22:42:04+00:00,896504144,885644653,1,Timmy96,Tommie Hoban,Expand Information on Tommie Hoban's article
2019-04-06T21:17:21+00:00,891273074,884784427,1,Timmy96,Sébastien Bassong,Expand information on Sebastien Bassong's article
2019-03-29T07:50:01+00:00,889987090,887388036,1,Timmy96,Serdar Tasci,Updating Information of Serdar Tasci's article
2019-03-23T22:57:55+00:00,889167300,887651300,1,Timmy96,Tyias Browning,Expand Information on Tyias Browning's article
2019-03-17T22:17:16+00:00,888247099,886441651,1,Timmy96,Jeroen Zoet,Update Information on Jeroen Zoet's article
2019-03-09T23:44:02+00:00,887002873,854891533,1,Timmy96,Darren Powell,Expand information on Darren Powell's article
2019-02-28T21:05:41+00:00,885567615,884401200,1,Timmy96,Jonathan Reis,Expand Information on Jonathan Reis' article
2019-02-21T18:18:38+00:00,884447994,884085261,1,Timmy96,André Bahia,Minor Change again
2019-02-19T12:38:48+00:00,884085261,883741915,1,Timmy96,André Bahia,/* Shonan Bellmare */  - Amended the error about his teammates. His teammates never joined Shonan Bellmore. My mistake.
2019-02-16T20:53:30+00:00,883667745,881425438,1,Timmy96,André Bahia,Expand and Update Information on André Bahia's article
2019-01-31T21:48:11+00:00,881170151,881048130,1,Timmy96,Gregory van der Wiel,Update the latest information on Gregory van der Wiel's article
2019-01-31T20:11:01+00:00,881155514,878748505,1,Timmy96,"Guilherme (footballer, born May 1991)","Expand Information on Guilherme Costa Marques' article. Yes, I expanded the information, as I am aware that I edited footballers, who played in Spain or Portugal, which shorten the article. But keep the references that is very useful. It took me weeks to finish editing his article."
2019-01-19T14:56:39+00:00,879172896,878362783,1,Timmy96,Emmanuel Culio,"Expand Information on Emmanuel Culio's article. Yes, I expanded the information, as I am aware that I edited footballers, who played in Spain or Portugal, which shorten the article. But keep the references that is very useful. It took me weeks to finish editing his article."
2018-12-31T03:13:23+00:00,876091757,876091133,1,Timmy96,User talk:Timmy96,/* December 2018 */  - Forgot to add [[Michael Woods (footballer)|Michael Woods]] (I edited his article in 2014)
2018-12-31T03:08:20+00:00,876091133,876089961,1,Timmy96,User talk:Timmy96,/* December 2018 */ - Add [[Erwin Mulder]] to the 2016 section. Forget that I edited his article that year.
2018-12-31T02:58:43+00:00,876089961,869709084,1,Timmy96,User talk:Timmy96,Updating my User Talk Page. I will be editing soon now that I am back from my holiday.
2018-12-10T08:14:18+00:00,872956957,868164678,1,Timmy96,Jung Sung-ryong,Expand Information on Jung Sung-Ryong article.
2018-11-30T21:29:26+00:00,871409270,861979692,1,Timmy96,Yassin Fortuné,Update Information on Yassin Fortuné's article
2018-11-28T22:00:28+00:00,871094294,865238996,1,Timmy96,Jamie Hopcutt,Expand Information on Jamie Hopcutt's article
2018-11-20T17:03:51+00:00,869828271,868447483,1,Timmy96,Kévin Boli,Expand Information on Kévin Boli's article
2018-11-17T14:28:57+00:00,869267114,860817955,1,Timmy96,Curtis Edwards,Expand Information on Curtis Edwards' article
2018-11-10T21:28:43+00:00,868229858,863835483,1,Timmy96,Dean Whitehead,Expand Information on Dean Whitehead's article
2018-10-30T19:19:16+00:00,866507035,848431998,1,Timmy96,Hernán Losada,Expand Information on Hernán Losada's article
2018-10-06T18:53:25+00:00,862795673,861063122,1,Timmy96,Rohan Ince,Expand Information on Rohan Ince's article
2018-09-25T19:33:46+00:00,861196552,860756485,1,Timmy96,DC Studios,Reverting the Undid revision 860756485 by [[Special:Contributions/JKLoling|JKLoling]] ([[User talk:JKLoling|talk]]). This criticism in this section of the DC Films article is fair and doesn't deserve to be removed.
2018-09-23T20:18:05+00:00,860896828,857354342,1,Timmy96,William Vainqueur,"Expand Information on William Vainqueuer's article. rom now, I will be editing Wikipedia occassionally, as I still suffer a lot of time constraint in my life."
2018-09-13T17:53:09+00:00,859381001,858965340,1,Timmy96,Quincy Promes,Update Information on Quincy Promes' article
2018-09-13T15:52:24+00:00,859366907,857835468,1,Timmy96,Kayden Jackson,Expand Information on Kayden Jackson's article
2018-09-08T14:47:33+00:00,858626369,854591401,1,Timmy96,Josh Ginnelly,Expand Information on Josh Ginnelly's article
2018-09-06T20:38:28+00:00,858388626,858384559,1,Timmy96,Miles Addison,Change Date from 7 September 2018 to 6 September 2018
2018-09-06T20:01:05+00:00,858384559,857394623,1,Timmy96,Miles Addison,Expand Information on Miles Addison's article
2018-09-05T14:11:41+00:00,858164222,857992583,1,Timmy96,Robert Tesche,Expand Information on Robert Tesche's article
2018-08-31T21:16:30+00:00,857466295,853821844,1,Timmy96,Paul Garita,Expand Information on Paul Garita's article
2018-08-31T12:39:28+00:00,857397458,853308165,1,Timmy96,Anastasios Donis,Expand Information on Anastasios Donis' article
2018-08-30T18:45:15+00:00,857282145,856984527,1,Timmy96,Joe Quigley,Expand Information on Joe Quigley's article
2018-08-30T15:05:03+00:00,857254564,855012809,1,Timmy96,Baily Cargill,Update Information on Baily Cargill's article
2018-08-29T19:39:46+00:00,857133347,856469583,1,Timmy96,Christian Clemens,Update Information on Christian Clemens' article
2018-08-29T14:08:01+00:00,857090073,856189712,1,Timmy96,Abdoulay Diaby,Expand Information on Abdoulay Diaby's article
2018-08-25T22:00:27+00:00,856531017,852374540,1,Timmy96,Rodney Kongolo,Expand Information on Rodney Kongolo's article
2018-08-24T16:14:44+00:00,856351539,855860419,1,Timmy96,MJ Williams,Expand Information on Jordan Williams' article
2018-08-23T20:35:24+00:00,856238416,855007835,1,Timmy96,Eiji Kawashima,Expand Information on Eiji Kawashima's article. I wanted to make a lot of improvements on his article because it was a mess before and I was determined to make amends when I mess it up. I made a lot of corrections and revamp the whole thing.
2018-08-18T16:07:21+00:00,855477410,853847208,1,Timmy96,Felipe Gutiérrez,Update on Felipe Gutiérrez's article
2018-08-17T21:49:23+00:00,855382390,854165083,1,Timmy96,Jordan Flores,Expand Information on Jordan Flores' article
2018-08-11T21:34:35+00:00,854507913,847909796,1,Timmy96,Calum Dyson,Expand Information on Calum Dyson's article
2018-08-11T20:23:48+00:00,854500627,846182592,1,Timmy96,Liam Walsh (footballer),"Changed words on ""scored"" to ""set up two goals"", as well as, updating information on his article"
2018-08-09T21:09:56+00:00,854232272,853844558,1,Timmy96,Diego Fabbrini,Expand Information on Diego Fabbrini's article
2018-08-06T15:13:02+00:00,853717540,852212370,1,Timmy96,Thomas Meunier,Update Information on Thomas Meunier's article
2018-08-03T22:33:28+00:00,853320441,844687065,1,Timmy96,Renaud Emond,Expand Information on Renaud Emond's article
2018-07-31T21:39:11+00:00,852862143,852378830,1,Timmy96,Greg Leigh,Update Information on Greg Leigh's article
2018-07-31T14:59:22+00:00,852814133,852297467,1,Timmy96,Kris Twardek,Expand Information on Kris Twardek's article
2018-07-28T17:09:21+00:00,852388810,852388722,1,Timmy96,Ryan Fredericks,/* Fulham */  - Mend the Error on the Reference Link
2018-07-28T17:08:40+00:00,852388722,851665851,1,Timmy96,Ryan Fredericks,Expand Information on Ryan Fredericks' article
2018-07-27T16:20:25+00:00,852249621,847586236,1,Timmy96,Max Clark (footballer),Update the latest information on Max Clark's article
2018-07-27T11:15:54+00:00,852214499,844181179,1,Timmy96,Teddy Chevalier,Expand Information on Teddy Chevalier's article
2018-07-26T11:18:20+00:00,852062420,851906884,1,Timmy96,Miloš Degenek,Update the latest information on Milos Degenek from his time at Japan and Australia during the World Cup
2018-07-07T21:50:48+00:00,849280829,844949346,1,Timmy96,Kevin Mbabu,Expand Information on Kevin Mbabu's article
2018-06-29T22:43:18+00:00,848123222,846968858,1,Timmy96,Elliott Moore,Update Information on Elliot Moore's article
2018-06-25T21:19:15+00:00,847508696,846140201,1,Timmy96,Kévin Bru,Expand Information on Kévin Bru's article
2018-06-23T17:04:42+00:00,847204088,847135618,1,Timmy96,Hiroki Sakai,"/* International Career */ - Change ""after Manager"" to ""under a new management of [[Javier Aguirre]]."""
2018-06-19T21:20:40+00:00,846615935,846383242,1,Timmy96,Hiroki Sakai,Expand Information on Hiroki Sakai's article. It took me weeks to add everything about his career.
2018-06-08T22:13:45+00:00,845038571,840596727,1,Timmy96,Benjamin Whiteman,Expand Information on Benjamin Whiteman's article
2018-06-07T22:04:50+00:00,844893269,843077244,1,Timmy96,Víctor Ibarbo,Expand Information on Victor Ibarbo's article
2018-05-31T15:38:29+00:00,843803385,835314187,1,Timmy96,Anton Walkes,Expand Information on Anton Walkes' article
2018-05-31T12:14:08+00:00,843779711,843398139,1,Timmy96,Dean Henderson,/* Loan to Shrewsbury Town */  - Update the latest information on Dean Henderson's article
2018-05-26T22:45:36+00:00,843106056,843100407,1,Timmy96,Dean Henderson,Expand Information on Dean Henderson's article
2018-05-25T17:44:43+00:00,842934004,836970820,1,Timmy96,Samuel Mensiro,Expand Information on Samuel Mensiro's article
2018-05-18T22:02:41+00:00,841911556,840389792,1,Timmy96,Kevin Luckassen,Update the latest information on Kevin Luckassen 's article
2018-05-13T16:58:50+00:00,841031711,839956623,1,Timmy96,Tommy Elphick,Update the latest information on Tommy Elphick's article
2018-05-12T21:59:45+00:00,840908153,840389735,1,Timmy96,Raheem Hanley,Expand Information on Raheem Hanley's article
2018-05-12T20:16:24+00:00,840892662,840345858,1,Timmy96,Johnnie Jackson,Update Information on Johnnie Jackson's article
2018-05-12T14:46:36+00:00,840842059,819389495,1,Timmy96,Karim Matmour,Expand Information on Karim Matmour's article
2018-05-06T21:32:26+00:00,839964482,825188540,1,Timmy96,Thomas Eisfeld,Expand Information on Thomas Eisfeld's article
2018-05-04T20:14:54+00:00,839654186,838686881,1,Timmy96,Lawrence Vigouroux,Expand Information on Lawrence Vigouroux's article
2018-04-29T22:06:18+00:00,838882630,838714792,1,Timmy96,Marcus Edwards,Expand Information on Marcus Edwards' article
2018-04-22T20:35:35+00:00,837752262,836189144,1,Timmy96,Adam Henley,Expand Information on Adam Henley's article
2018-04-11T19:47:59+00:00,835954959,835868936,1,Timmy96,DC Studios,Reversing the changes made from [[Special:Contributions/189.130.78.16|189.130.78.16]].
2018-04-06T21:54:49+00:00,835153751,828095167,1,Timmy96,Seán Kavanagh,Update Information on Sean Kavanagh's article
2018-04-01T21:02:44+00:00,833663115,833437333,1,Timmy96,DC Studios,Revert biased information and article. It's must be included because it has all the relevant information people would read.
2018-03-30T22:11:12+00:00,833328956,830692436,1,Timmy96,Jordan Thorniley,Expand Information on Jordan Thorniley's article
2018-03-30T19:05:34+00:00,833303929,826808143,1,Timmy96,Collins Tanor,Expand Information on Collins Tanor's article
2018-03-25T16:48:50+00:00,832376829,825228300,1,Timmy96,Sascha Riether,"Expand Information on Sascha Riether's article. From now, I will be editing Wikipedia occassionally, as I suffer a lot of time constraint in my life."
2018-03-10T00:02:01+00:00,829657762,825314180,1,Timmy96,Ryan Ledson,Expand Information on Ryan Ledson's article
2018-02-28T22:50:48+00:00,828163876,826668068,1,Timmy96,"Mark Hudson (footballer, born 1982)",Expand Information on Mark Hudson's article
2018-02-23T21:41:44+00:00,827290757,826789977,1,Timmy96,Miloš Degenek,Expand Information on Milos Degenek's article
2018-02-18T11:25:51+00:00,826308533,825221496,1,Timmy96,Johan Hammar,/* Career */  - Update on Johan Hammar's article so far
2018-02-17T22:48:26+00:00,826223076,824163248,1,Timmy96,Gabriel Somi,Expand Information on Gabriel Somi's article
2018-02-16T22:42:46+00:00,826053107,825581459,1,Timmy96,Harry Charsley,Expand Information on Harry Charsley's article
2018-02-14T22:09:24+00:00,825701402,825701304,1,Timmy96,Antonee Robinson,/* Everton */ - Correct change [Everton F.C. Reserves and Academy|Everton U23s]] to [[Everton F.C. Reserves and Academy|Everton U23s]]
2018-02-14T22:08:40+00:00,825701304,825345829,1,Timmy96,Antonee Robinson,Expand Information on Antonee Robinson's article
2018-02-11T00:36:33+00:00,825019422,824350692,1,Timmy96,Gregory van der Wiel,Expand Information on Gregory Van Der Wiel's article
2018-02-04T21:16:35+00:00,824021368,820188462,1,Timmy96,Cameron Brannagan,Expand Information on Cameron Brannagan's artcile
2018-02-04T00:07:10+00:00,823877740,821975305,1,Timmy96,"Jack Price (footballer, born 1992)",Expand Information on Jack Price's article
2018-02-03T17:38:58+00:00,823825396,821612727,1,Timmy96,Shay Facey,Expand Information on Shay Facey's article
2018-02-01T21:44:09+00:00,823540827,822066170,1,Timmy96,Aaron Ramsdale,Update Aaron Ramsdale's article
2018-01-27T21:44:04+00:00,822680061,821585266,1,Timmy96,Isaac Buckley-Ricketts,Expand Information on Isaac Buckley-Ricketts' article
2018-01-26T22:59:53+00:00,822535324,822369314,1,Timmy96,Quincy Promes,Expand Information on Quincy Promes' article.
2018-01-19T23:10:30+00:00,821352952,819368124,1,Timmy96,Harry Toffolo,Expand Information on Harry Toffolo's article
2018-01-13T22:54:00+00:00,820258416,817460311,1,Timmy96,Érico Sousa,Expand Information on Erico Sousa's article
2018-01-12T22:09:38+00:00,820067655,819542249,1,Timmy96,Liam Walsh (footballer),Expand Information on Liam Walsh's article
2018-01-11T20:43:24+00:00,819886331,818961168,1,Timmy96,Matty Pearson,Update on his Matty Pearson's career
2018-01-09T21:54:21+00:00,819531364,819005805,1,Timmy96,Mallik Wilks,Expand Information on Mallik Wilks' article
2018-01-07T22:51:38+00:00,819181711,818246070,1,Timmy96,Dominik Kaiser,Add the Honour Section that Dominik Kaiser has achieved
2018-01-07T22:50:02+00:00,819181270,815971348,1,Timmy96,Diego Demme,Expand Information on Diego Demme's article
2018-01-05T23:33:10+00:00,818850566,818850472,1,Timmy96,"James Baxendale (footballer, born 1992)",/* Mansfield Town */  - Move down a space
2018-01-05T23:32:30+00:00,818850472,818237264,1,Timmy96,"James Baxendale (footballer, born 1992)",Expand Information on James Baxendale's article
2018-01-04T21:55:00+00:00,818666812,817237131,1,Timmy96,Kevin Toner,Expand Information on Kevin Toner's article
2018-01-01T22:27:01+00:00,818151687,815971045,1,Timmy96,Dominik Kaiser,Expand Information on Dominik Kaiser's article
2017-12-29T23:37:19+00:00,817686528,815970846,1,Timmy96,Lukas Klostermann,Expand Information on Lukas Klostermann's article
2017-12-26T19:43:38+00:00,817188866,816746289,1,Timmy96,Ignasi Miquel,Expand Informaton on Ignasi Miquel's article
2017-12-26T12:43:32+00:00,817143625,814791930,1,Timmy96,Elliott Moore,Expand Information on Elliot Moore's article
2017-12-25T00:13:05+00:00,816956671,816388846,1,Timmy96,Marvin Compper,Expand Information on Marvin Compper's article
2017-12-19T22:08:37+00:00,816197321,814139291,1,Timmy96,Tobi Adebayo-Rowling,Expand Information on Tobi Adebayo-Rowling's article
2017-12-17T22:12:22+00:00,815894220,815708245,1,Timmy96,Wout Brama,Expand Information on Wout Brama's article
2017-12-09T15:32:16+00:00,814561849,801863139,1,Timmy96,Rob Hunt (footballer),Expand Information on Rob Hunt's article
2017-12-06T22:28:49+00:00,814103756,810651728,1,Timmy96,Ibou Touray,Expand Information on Ibou Touray's article
2017-12-03T21:24:38+00:00,813516952,811793150,1,Timmy96,Thomas Lam,Updating Information on Thomas Lam's article
2017-12-03T19:15:35+00:00,813442860,809480413,1,Timmy96,Dominik Kohr,Expand Information on Dominik Kohr's article
2017-12-02T20:49:18+00:00,813273052,803053736,1,Timmy96,Rachid Bouaouzan,Expand Information on Rachid Bouaouzan's article
2017-11-30T21:43:23+00:00,812954652,811582339,1,Timmy96,Michael Ledger,Expand Information on Michael Ledger's article
2017-11-28T21:52:51+00:00,812617170,799411746,1,Timmy96,Osei Sankofa,Expand Information on Osei Sankofa's article
2017-11-17T11:10:42+00:00,810778777,808994754,1,Timmy96,Thomas Meunier,Expand Information on Thomas Meunier's article
2017-11-14T22:47:42+00:00,810384643,810383454,1,Timmy96,Ji Dong-won,/* Sunderland */ - Change the Quote format
2017-11-14T22:38:43+00:00,810383454,808323793,1,Timmy96,Ji Dong-won,Expand Information on Ji Dong-won's article
2017-11-10T23:59:12+00:00,809723267,809568728,1,Timmy96,Ezekiel Henty,Expanding and Concluding Information on Ezekiel Henty's article
2017-11-09T23:31:15+00:00,809568728,807667452,1,Timmy96,Ezekiel Henty,Expand Information on Ezekiel Henty's article. Expect to finish tomorrow
2017-11-08T23:02:49+00:00,809412364,801941043,1,Timmy96,Chris Hussey,Expand Information on Chris Hussey's article
2017-11-04T22:28:52+00:00,808749453,803914491,1,Timmy96,Kyle Howkins,Expand Information on Kyle Howkins' article
2017-11-04T20:20:44+00:00,808732949,806406588,1,Timmy96,Jonah Ayunga,Expand Information on Jonah Ayunga's article
2017-11-04T16:42:31+00:00,808707495,808703723,1,Timmy96,Kieran Dowell,Expand Information on Kieran Dowell's article
2017-11-04T00:00:33+00:00,808614293,808176433,1,Timmy96,Evan Horwood,Expand Information on Evan Horwood's article
2017-10-30T15:58:31+00:00,807873051,804201145,1,Timmy96,Connor Ogilvie,Expand Information on Conor Ogilvie's article
2017-10-30T13:49:29+00:00,807852869,805953074,1,Timmy96,Marc Bola,Update Information on Marc Bola's article
2017-10-28T22:16:20+00:00,807586091,792218163,1,Timmy96,Maximilian Beister,Expand Information on Maximilian Beister's article
2017-10-25T21:29:06+00:00,807094107,802023238,1,Timmy96,Josh Emmanuel,Update on Josh Emmanuel's article
2017-10-24T21:31:23+00:00,806904957,806795104,1,Timmy96,Joss Labadie,Expanding and Concluding Information on Joss Labadie's article
2017-10-23T21:36:13+00:00,806740377,806560472,1,Timmy96,Joss Labadie,Update Information on Joss Labadie's article. Part 2.
2017-10-22T20:35:56+00:00,806560472,804233344,1,Timmy96,Joss Labadie,Expand Information on Joss Labadie's article. Part 1.
2017-10-22T16:21:22+00:00,806526604,805770954,1,Timmy96,Tom Cleverley,Update Information on Tom Cleverley's article
2017-10-21T20:04:18+00:00,806402165,803110962,1,Timmy96,Jesse Joronen,Update Information on Jesse Joronen's article.
2017-10-18T17:29:34+00:00,805948067,802381371,1,Timmy96,Atsuto Uchida,Expand Information on Atsuto Uchida
2017-10-17T10:23:17+00:00,805742623,804992564,1,Timmy96,Lasse Vigen Christensen,Expand Lasse Vigen Christensen's article
2017-10-15T10:34:04+00:00,805431820,799228978,1,Timmy96,Sebastian Mielitz,Expand Information on Sebastain Mielitz' article
2017-10-08T22:18:19+00:00,804421516,801380432,1,Timmy96,Jordan Botaka,Expand Information on Jordan Botaka's article
2017-10-07T22:10:40+00:00,804272283,801999074,1,Timmy96,Erwin Hoffer,Expand Information on Erwin Hoffer's article
2017-10-01T21:29:41+00:00,803333229,803180568,1,Timmy96,Grétar Steinsson,Expanding and Concluding Information on Gretar Steinsson's article
2017-10-01T00:09:10+00:00,803180568,788391053,1,Timmy96,Grétar Steinsson,Expand Information on Grétar Rafn Steinsson's article. I have not finish yet.
2017-09-28T21:08:52+00:00,802848068,797096960,1,Timmy96,Pablo Chavarría,Update article of Pablo Chavarria's article
2017-09-24T00:25:39+00:00,802098752,795434732,1,Timmy96,Abel Tamata,Expand Information on Abel Tamata's article
2017-09-23T19:24:03+00:00,802063338,800881548,1,Timmy96,Stephen Dawson,Expand Information on Stephen Dawson's article
2017-09-17T19:37:59+00:00,801118314,801118162,1,Timmy96,"Michael Brown (footballer, born 1977)",/* Fulham */ Changing from www.fulhamfc.com/news/2007/january/05/brown-appointed-captain to http://www.fulhamfc.com/news/2007/january/05/brown-appointed-captain
2017-09-17T19:36:58+00:00,801118162,800952463,1,Timmy96,"Michael Brown (footballer, born 1977)",Adding information using the Fulham Football Club Website.
2017-09-17T18:14:11+00:00,801106747,798043540,1,Timmy96,Rens van Eijden,Expand Information on Rens van Eijden's article
2017-09-10T21:30:17+00:00,799963491,798701075,1,Timmy96,Gastón Ramírez,Update on Gaston Ramirez's article
2017-09-07T21:26:39+00:00,799460745,796480520,1,Timmy96,Tom Cairney,Expand Information on Tom Cairney's article
2017-09-03T21:02:20+00:00,798792059,798582485,1,Timmy96,Björn Engels,Expand Information on Bjorn Engels' article
2017-09-02T23:35:55+00:00,798621173,795816359,1,Timmy96,Jason Euell,Expand Information on Jason Euell's article
2017-08-31T20:52:42+00:00,798253316,792269931,1,Timmy96,Connor Mahoney,Expand Information on Connor Mahoney's article
2017-08-30T21:27:51+00:00,798079941,798022447,1,Timmy96,Giedrius Arlauskis,Update on Giedrius Arlauskis' article
2017-08-29T21:58:24+00:00,797910508,796151127,1,Timmy96,Harry Bunn,Expand Information on Harry Bunn's article
2017-08-25T21:55:16+00:00,797256645,793543353,1,Timmy96,Courtney Duffus,Expand Information on Courtney Duffus' article
2017-08-24T20:50:00+00:00,797078668,790097060,1,Timmy96,Joel Ekstrand,Expand Information on Joel Ekstrand's article
2017-08-18T22:27:29+00:00,796161951,795192728,1,Timmy96,Solly March,Expand Information on Solly March's article
2017-08-16T21:20:38+00:00,795849004,785673803,1,Timmy96,Jonathan Benteke,Expand Information on Jonathan Benteke's article
2017-08-15T21:29:07+00:00,795689914,784963187,1,Timmy96,Rene Krhin,Expand Information on Rene Krhin's article
2017-08-12T19:49:00+00:00,795215447,795195875,1,Timmy96,Filip Lesniak,Expand Information on Filip Lesniak's article
2017-08-11T21:06:34+00:00,795076034,793069008,1,Timmy96,Claude Dielna,Expand Information on Claude Dielna's article
2017-08-10T21:20:09+00:00,794921106,788435880,1,Timmy96,Joshua John,Expand Information on Joshua John's article
2017-08-06T20:39:58+00:00,794246434,794078835,1,Timmy96,Hope Akpan,Expand Information on Hope Akpan's article
2022-03-14T07:16:11+00:00,1077038719,1076793415,1,VietnamJ25,Wikipedia:WikiProject Football/Members,/* Active members */
2022-03-14T07:09:24+00:00,1077037915,1076771136,1,VietnamJ25,User talk:VietnamJ25,
2022-03-12T21:28:15+00:00,1076775325,1076153516,1,VietnamJ25,Ben Brereton Díaz,/* Personal life */
2022-03-12T21:22:59+00:00,1076774623,1072018974,1,VietnamJ25,Denis Odoi,/* Fulham */
2022-03-12T21:06:51+00:00,1076772478,1076734037,1,VietnamJ25,Chris Maguire,/* Lincoln City */
2022-03-12T20:41:59+00:00,1076768279,1075426245,1,VietnamJ25,"James Collins (footballer, born 1990)",
2022-03-12T20:33:32+00:00,1076766884,1076393805,1,VietnamJ25,Adam Armstrong (footballer),/* Blackburn Rovers */
2022-03-12T20:28:38+00:00,1076766090,1073914655,1,VietnamJ25,"John Swift (footballer, born 1995)",/* Reading */
2022-03-12T20:11:39+00:00,1076763485,1072075791,1,VietnamJ25,Nathaniel Chalobah,
2022-03-12T19:48:01+00:00,1076759839,1068436030,1,VietnamJ25,Demy de Zeeuw,
2022-03-12T19:41:59+00:00,1076758954,1072769390,1,VietnamJ25,Cy Goddard,
2022-03-12T17:27:48+00:00,1076735999,1076205181,1,VietnamJ25,Andre Gray,/* Queens Park Rangers */
2022-03-12T17:16:18+00:00,1076733943,1073513062,1,VietnamJ25,Blair Turgott,/* Östersund */
2022-03-12T16:41:04+00:00,1076726942,1075925385,1,VietnamJ25,Hwang Ui-jo,/* Bordeaux */
2022-03-12T16:25:32+00:00,1076724139,1076517689,1,VietnamJ25,Neco Williams,
2022-03-12T16:02:26+00:00,1076719857,1075264417,1,VietnamJ25,Stephen Dobbie,
2022-03-12T16:01:33+00:00,1076719705,1058230291,1,VietnamJ25,Mame Biram Diouf,
2022-03-12T15:46:15+00:00,1076716845,1052935581,1,VietnamJ25,Jack Grimmer,
2022-03-12T15:37:02+00:00,1076715082,1076713075,1,VietnamJ25,Steve Cook,
2022-03-12T15:25:37+00:00,1076713075,1071301271,1,VietnamJ25,Steve Cook,
2022-03-12T15:07:21+00:00,1076710122,1073663058,1,VietnamJ25,Luciano Narsingh,
2022-03-12T15:06:28+00:00,1076710002,1061313418,1,VietnamJ25,Ryo Miyaichi,
2022-03-12T15:04:41+00:00,1076709703,1070713890,1,VietnamJ25,Chuks Aneke,
2022-03-01T15:55:41+00:00,1074686287,1074024574,1,VietnamJ25,Denzel Dumfries,/* Inter Milan */
2022-03-01T15:49:15+00:00,1074685353,1073957128,1,VietnamJ25,Eiji Kawashima,
2022-03-01T15:39:06+00:00,1074684051,1073626466,1,VietnamJ25,Yuto Nagatomo,
2022-03-01T15:37:37+00:00,1074683862,1070332185,1,VietnamJ25,Joshua Brenet,
2022-03-01T15:36:32+00:00,1074683726,1073957471,1,VietnamJ25,Hiroki Sakai,
2022-03-01T15:35:35+00:00,1074683604,1073682560,1,VietnamJ25,Ado Onaiwu,
2022-03-01T15:34:24+00:00,1074683448,1065151339,1,VietnamJ25,Musashi Suzuki,
2022-02-22T07:19:51+00:00,1073343684,1072852092,1,VietnamJ25,Massimo Bruno,
2022-02-18T23:10:56+00:00,1072678066,1067805402,1,VietnamJ25,List of Fulham F.C. players (25–99 appearances),
2019-07-04T02:53:28+00:00,904724957,901143083,0,Dl2000,Aaron Ramsdale,ordinals not normally used for dates ([[WP:DATESNO]])
2020-12-30T09:02:28+00:00,997172618,997169262,0,Kosack,Adam Armstrong (footballer),Reverted 1 edit by [[Special:Contributions/87.196.72.15|87.196.72.15]] ([[User talk:87.196.72.15|talk]]): Unsourced
2018-09-30T00:56:24+00:00,861786844,857985190,0,InternetArchiveBot,Abdoulay Diaby,Rescuing 2 sources and tagging 0 as dead. #IABot (v2.0beta9)
