timestamp,revid,parentid,sock,user,page,message
2021-09-04T22:22:41+00:00,1042419284,1042417928,1,Islamisperfect,Islamic views on sin,Just fixing it since there’s errors
2021-09-04T22:12:55+00:00,1042417928,1036115838,1,Islamisperfect,Islamic views on sin,Rape as a major sin
2021-09-05T15:29:33+00:00,1042551995,1042551742,1,Iloveallahonpy,Shirk (Islam),Or Mocking god (blasphemy
2021-09-05T15:27:43+00:00,1042551724,1040004503,1,Iloveallahonpy,Shirk (Islam),Shirk is anything to with blasphemy
2021-08-22T03:25:17+00:00,1040004503,1033475866,0,Maxeto0910,Shirk (Islam),Per WP:HOWTOSD
