timestamp,revid,parentid,sock,user,page,message
2023-05-09T15:36:24+00:00,1153993511,1118695352,1,Timmy96,User:Timmy96,
2023-05-09T15:35:17+00:00,1153993354,1153959048,1,Timmy96,User talk:Timmy96,
2023-05-09T11:01:31+00:00,1153958711,1153958216,1,Timmy96,User talk:Timmy96,/* May 2023 */ Reply
2023-05-09T10:51:08+00:00,1153957301,1118897143,1,Timmy96,User talk:Timmy96,
2022-10-29T14:50:12+00:00,1118889502,1118889435,1,Timmy96,User talk:Timmy96,
2022-10-29T14:49:45+00:00,1118889435,1118888078,1,Timmy96,User talk:Timmy96,/* The Inactive and Balancer */
2022-10-29T14:38:48+00:00,1118888078,1118886087,1,Timmy96,User talk:Timmy96,/* The beginning */ - Add further details
2022-10-29T14:22:31+00:00,1118886087,1118695395,1,Timmy96,User talk:Timmy96,
2022-10-28T08:23:41+00:00,1118680502,1118680404,1,Timmy96,User talk:Timmy96,/* The Downfall */
2022-10-28T08:23:00+00:00,1118680404,1118680302,1,Timmy96,User talk:Timmy96,/* 2022 */
2022-10-28T08:22:08+00:00,1118680302,1118674552,1,Timmy96,User talk:Timmy96,
2022-06-20T11:18:00+00:00,1094040175,1094038040,1,Timmy96,User talk:Timmy96,
2022-03-23T15:03:06+00:00,1078828696,1078808455,1,Timmy96,User talk:Timmy96,/* 2022 */ Reply
2022-03-23T12:38:19+00:00,1078807668,1078805458,1,Timmy96,User talk:Timmy96,/* 2022 */ Reply
2022-03-23T12:11:48+00:00,1078804647,1078803867,1,Timmy96,User talk:Timmy96,/* 2022 */ Reply
2022-03-23T11:49:39+00:00,1078802408,1077090948,1,Timmy96,User talk:Timmy96,/* 2022 */
2022-03-14T13:54:27+00:00,1077090948,1077088547,1,Timmy96,User talk:Timmy96,
2022-03-06T13:42:50+00:00,1075567718,1075567616,1,Timmy96,User talk:Timmy96,/* March 2022 */
2022-03-06T13:42:00+00:00,1075567616,1075187383,1,Timmy96,User talk:Timmy96,
2021-12-30T11:46:27+00:00,1062767940,1062767701,1,Timmy96,User talk:Timmy96,/* December 2021 */
2021-12-30T11:44:28+00:00,1062767701,1062655594,1,Timmy96,User talk:Timmy96,
2021-12-29T19:23:22+00:00,1062655594,1062625639,1,Timmy96,User talk:Timmy96,
2021-12-29T15:43:13+00:00,1062625639,1062256468,1,Timmy96,User talk:Timmy96,
2021-12-22T21:37:02+00:00,1061627506,1056841641,1,Timmy96,"Juan Castillo (footballer, born 2000)","Expand Information on Juan Castillo's article. First time back editing and I edited this article because I wonder if this article would be quickly be reverted, which has affected me personality. [[User:Struway2|Struway2]], I know you would be feeling surprise with this expansion of this article but at least, I helped you."
2021-12-11T01:00:26+00:00,1059697282,1058206498,1,Timmy96,User talk:Timmy96,/* 2021 */
2021-11-14T12:40:12+00:00,1055194753,1055193958,1,Timmy96,User talk:Struway2,/* About my Wikipedia edits */  - Provided the wrong link and it has been amended.
2021-11-14T12:32:55+00:00,1055193958,1055193541,1,Timmy96,User talk:Struway2,/* About my Wikipedia edits */
2021-11-14T12:28:39+00:00,1055193541,1051708413,1,Timmy96,User talk:Struway2,/* About my Wikipedia edits */ new section
2021-11-14T11:59:18+00:00,1055190871,1055046816,1,Timmy96,User talk:Timmy96,/* Blocked from certain articles */  - Request for the blocking to be overturned.
2021-11-13T14:46:08+00:00,1055046816,1055043898,1,Timmy96,User talk:Timmy96,
2021-11-12T20:12:12+00:00,1054924540,1054924300,1,Timmy96,Massimo Bruno,"Update stats on his new club, Bursaspor."
2021-11-12T20:10:24+00:00,1054924300,1052227461,1,Timmy96,Massimo Bruno,Improved article on Massimo Bruno. All I can say is that I gave it my all if this article have been reverted.
2021-11-12T20:10:15+00:00,1054924260,1052877066,1,Timmy96,Kelvin Etuhu,Improved article on Kelvin Etuhu. All I can say is that I gave it my all if this article have been reverted.
2021-11-12T20:10:00+00:00,1054924217,1052160380,1,Timmy96,Willo Flood,Improved article on Willo Flood. All I can say is that I gave it my all if this article have been reverted.
2021-11-12T20:09:45+00:00,1054924184,1052158565,1,Timmy96,Rory Loy,Improved article on Rory Loy. All I can say is that I gave it my all if this article have been reverted.
2021-11-12T20:09:31+00:00,1054924147,1052375618,1,Timmy96,Jon Daly (footballer),Improved article on Jon Daly. All I can say is that I gave it my all if this article have been reverted.
2021-11-12T20:08:44+00:00,1054924042,1051499670,1,Timmy96,Michael Nelson (footballer),Expand Information on Michael Nelson's article.
2021-10-28T20:48:20+00:00,1052378823,1052364948,1,Timmy96,User talk:Timmy96,/* October 2021 */
2021-10-28T16:25:00+00:00,1052337259,1052275791,1,Timmy96,User talk:Timmy96,/* October 2021 */
2021-10-27T23:22:45+00:00,1052207402,1052161258,1,Timmy96,User talk:Timmy96,/* October 2021 */  - Statement about my Wikipedia edit.
2021-10-27T15:54:54+00:00,1052135874,1052134474,1,Timmy96,Kelvin Etuhu,/* Manchester City */  - Another Minor Change
2021-10-27T15:45:52+00:00,1052134474,1052126189,1,Timmy96,Kelvin Etuhu,/* Manchester City */  - Minor Change
2021-10-27T14:55:53+00:00,1052126414,1052123388,1,Timmy96,Willo Flood,Revert the information back that User contributions for 82.132.213.74 made changes on Willo Flood's article.
2021-10-27T14:54:34+00:00,1052126189,1052123372,1,Timmy96,Kelvin Etuhu,Revert the information back that User contributions for 82.132.213.74 made changes on Kelvin Etuhu's article.
2021-10-27T14:54:03+00:00,1052126101,1052123321,1,Timmy96,Massimo Bruno,Revert the information back that User contributions for 82.132.213.74 made changes on Massimo Bruno's article.
2021-10-27T14:52:44+00:00,1052125849,1052123297,1,Timmy96,Rory Loy,Revert the information back that User contributions for 82.132.213.74 made changes on Rory Loy's article.
2021-10-27T14:52:09+00:00,1052125756,1052123266,1,Timmy96,Jon Daly (footballer),Revert the information back that User contributions for 82.132.213.74 made changes on Jon Daly's article.
2021-10-27T12:06:41+00:00,1052103429,1052102446,1,Timmy96,Willo Flood,/* Dundee United (fourth spell) */  - Minor Change
2021-10-27T09:20:19+00:00,1052086760,1052081823,1,Timmy96,Wikipedia talk:WikiProject Football,/* User:Timmy96 */  - Responding to [[User:Dubrain]]'s claim.
2021-10-27T09:07:24+00:00,1052085584,1052055713,1,Timmy96,Jon Daly (footballer),Revert the information back that User contributions for 82.132.214.69 made changes on Jon Daly's article. I can do this all day and don't try to remove something that I worked. Nobody cared about updating this article until I did.
2021-10-27T09:06:35+00:00,1052085506,1052055872,1,Timmy96,Rory Loy,Revert the information back that User contributions for 82.132.214.69 made changes on Rory Loy's article. I can do this all day and don't try to remove something that I worked. Nobody cared about updating this article until I did.
2021-10-27T09:04:50+00:00,1052085351,1052055879,1,Timmy96,Massimo Bruno,Revert the information back that User contributions for 82.132.214.69 made changes on Massimo Bruno's article. I can do this all day and don't try to remove something that I worked. Nobody cared about updating this article until I did.
2021-10-27T09:03:46+00:00,1052085256,1052055899,1,Timmy96,Willo Flood,Revert the information back that User contributions for 82.132.214.69 made changes on Willo Flood's article. I can do this all day and don't try to remove something that I worked. Nobody cared about updating this article until I did.
2021-10-27T09:02:54+00:00,1052085167,1052075934,1,Timmy96,Kelvin Etuhu,Revert the information back that User contributions for 82.132.214.69 made changes on Kelvin Etuhu's article. I can do this all day and don't try to remove something that I worked. Nobody cared about updating this article until I did.
2021-10-24T09:31:19+00:00,1051569032,1051483201,1,Timmy96,Kelvin Etuhu,Minor Changes
2021-10-23T19:37:37+00:00,1051483201,1045059614,1,Timmy96,Kelvin Etuhu,Update Information on Kelvin Etuhu's article.  My first edit of this article in nine years and wanted to make sure to update it.
2021-10-23T14:21:36+00:00,1051436638,1051429425,1,Timmy96,Jon Daly (footballer),Revert the information back that [[User contributions for 51.6.138.2451.6.138.24|]] made changes. I can do this all day and don't try to remove something that I worked. Nobody cared about updating this article until I did.
2021-10-22T18:44:21+00:00,1051312542,1051089328,1,Timmy96,Jon Daly (footballer),"Nice try, [[user:Dubrain]]. Reverting back to my old edits."
2021-10-16T16:03:38+00:00,1050231835,1049445696,1,Timmy96,Jon Daly (footballer),Expand Information on Jon Daly's article. I wasn't planning to edit this article but I was motivated to update his article after I edited Willo Flood's article.
2021-10-10T20:46:02+00:00,1049263578,1049223570,1,Timmy96,Rory Loy,Reverting back to my old edits.
2021-10-10T20:45:19+00:00,1049263499,1049223948,1,Timmy96,Massimo Bruno,Reverting back to my old edits.
2021-10-10T20:43:38+00:00,1049263334,1049223415,1,Timmy96,Willo Flood,Reverting back to my old edits.
2021-10-08T07:47:20+00:00,1048835593,1045444891,1,Timmy96,Willo Flood,Expand Information on Willo Flood's article. My first edit of this article in seven years and wanted to make sure to update it. This proves my past edits has comeback to haunt me.
2021-09-30T07:18:30+00:00,1047322885,1024209867,1,Timmy96,Rory Loy,Expand Information on Rory Loy's article. My first edit of this article in seven years and wanted to make sure to update it
2021-09-24T07:54:54+00:00,1046164410,1046157772,1,Timmy96,Massimo Bruno,/* Personal life */  - Minor Setback
2021-09-24T07:08:04+00:00,1046157772,1030981241,1,Timmy96,Massimo Bruno,Expand Information on Massimo Bruno's article. I was supposed to finish editing this article last week but had lots of plans that I ended up finishing it on 24 September 2021.
2021-09-11T17:12:50+00:00,1043728978,1043181705,1,Timmy96,Denzel Dumfries,"Expand Information on Denzel Dumfries' article. Although many users who will be unhappy that I expanded lots of information, at least, I succeeded on something: reduce time wasting on anyone trying to expand this article. This article has been tough to edit because it took longer for me to edit than expected."
2021-09-04T13:06:09+00:00,1042337955,1042225461,1,Timmy96,Takehiro Tomiyasu,Update Information on Takehiro Tomiyasu's article. I regularly update on his article and need to focus on someone else. I would edit in the future if his article is not update to date.
2021-09-04T12:51:16+00:00,1042336102,1032805042,1,Timmy96,"Andrew Taylor (footballer, born 1986)",Update Information on Andrew Taylor's article. Making improvements because I was not happy with myself that I added unreliable sources as reference when I should have used The Bolton News.
2021-08-31T08:13:58+00:00,1041571175,1038124456,1,Timmy96,Daichi Kamada,Update Information on Daichi Kamada's article
2021-08-27T20:13:41+00:00,1040975679,1040975408,1,Timmy96,Emmanuel Culio,Minor Change
2021-08-27T20:11:36+00:00,1040975408,1013061968,1,Timmy96,Emmanuel Culio,Update Information on Emmanuel Culio's article
2021-08-20T20:06:54+00:00,1039795949,1039794772,1,Timmy96,Maya Yoshida,/* Personal life */  - Minor Setback
2021-08-20T19:59:46+00:00,1039794772,1037447201,1,Timmy96,Maya Yoshida,Update Information on Maya Yoshida's article.
2021-08-13T22:02:30+00:00,1038656516,1038656103,1,Timmy96,Takehiro Tomiyasu,/* Style of play */  - Minor Change
2021-08-13T21:58:31+00:00,1038656103,1038517411,1,Timmy96,Takehiro Tomiyasu,Update Information on Takehiro Tomiyasu's article. It feels so good to edit Wikipedia.
2021-08-10T20:06:48+00:00,1038147935,1034089495,1,Timmy96,Gaku Shibasaki,Update Information on Gaku Shibasaki's article.
2021-08-07T19:28:15+00:00,1037635008,1037604051,1,Timmy96,Julio Arca,"Update Information on Julio Arca's article. I am done running away from this article, trying to avoid because I forgot to update the article."
2021-08-07T18:15:14+00:00,1037625353,1035708597,1,Timmy96,Ludvig Öhman,/* Falkenbergs */  - Add Links on his Ludvig Öhman's career.
2021-08-07T17:47:15+00:00,1037621550,1037607477,1,Timmy96,Jamie Ashdown,"Update Information on Jamie Ashdown's article. Well, I am back now from my break and don't expect people to miss me. Will edit Wikipedia now and then."
2021-06-27T20:19:52+00:00,1030748255,1030440064,1,Timmy96,DC Studios,Reverting the Undid revision by User contributions for 2600:1004:B07F:C183:5558:B14:EA65:CBB4
2021-06-27T19:52:19+00:00,1030742521,1027957561,1,Timmy96,Leroy Fer,"Expand Information on Leroy Fer's article. Following this, I will take a break for a while before returning to edit again."
2021-06-18T21:43:40+00:00,1029261781,1028511319,1,Timmy96,Eljero Elia,"Update Information on Eljero Elia's article. My first edit of this article in five years and wanted to make sure to update it. It took me thirteen days to finally finish editing this article and was supposed to finish it on 13 June 2021. Following this, I will be editing articles once a week."
2021-06-05T20:28:25+00:00,1027052005,1025142220,1,Timmy96,Luc Castaignos,Expand Information on Luc Castaignos' article
2021-05-28T21:00:22+00:00,1025668293,1023306151,1,Timmy96,Elliot Grandin,Expand Information on Elliot Grandin's article. Finally made amends with the article I messed up nine years ago.
2021-05-25T08:22:10+00:00,1025019209,1024698172,1,Timmy96,Mohammed Abu,"Made Changes after doing some evaluation. Please reconsider looking at this article again after I worked really hard on something, [[User:GiantSnowman]]. I feel like my effort was for nothing if this was reverted back."
2021-05-25T08:22:09+00:00,1025019213,1024733730,1,Timmy96,Gregory van der Wiel,"Made Changes after doing some evaluation. Please reconsider looking at this article again after I worked really hard on something, [[User:GiantSnowman]].  I feel like my effort was for nothing if this was reverted back."
2021-05-24T15:30:53+00:00,1024882704,1024723344,1,Timmy96,Demy de Zeeuw,Update Information on Demy De Zeeuw's article.
2021-05-24T09:43:40+00:00,1024832368,1024724367,1,Timmy96,User talk:Timmy96,/* Level of detail */  - Updating my User Talk Page.
2021-05-23T17:47:56+00:00,1024703793,1024703343,1,Timmy96,User talk:GiantSnowman,/* This is User talk:Timmy96. */ new section
2021-05-23T17:25:09+00:00,1024699381,1024698362,1,Timmy96,User talk:Timmy96,Updating my User Talk Page.
2021-05-23T17:17:17+00:00,1024698064,1019111206,1,Timmy96,Mohammed Abu,"Revert the information back that [[User:GiantSnowman]] made changes. Just wanna say we will never be on the same page on how we edit Wikipedia. If you want me to leave this article alone, I want [[User:Struway2]] to edit this article because I provide him the references and he makes the changes."
2021-05-23T17:12:40+00:00,1024697257,1024493676,1,Timmy96,Gregory van der Wiel,"Revert the information back that [[User:GiantSnowman]] made changes. Just wanna say we will never be on the same page on how we edit Wikipedia. If you want me to leave this article alone, I want [[User:Struway2]] to edit this article because I provide him the references and he makes the changes."
2021-05-23T17:08:38+00:00,1024696509,1019510002,1,Timmy96,Demy de Zeeuw,pdate Information on Demy de Zeeuw's article. My first edit of this article in seven years and wanted to make sure to update it. I also thought it was impossible to edit but I gave it a try and did it.
2021-05-22T11:04:11+00:00,1024478361,1020489181,1,Timmy96,Gregory van der Wiel,Update Information on Gregory Van Der Wiel's article. I did this article while editing [[Demy De Zeeuw]] and felt I should have expanded further. I will try to finish updating Demy De Zeeiw's article by tomorrow.
2021-05-16T15:25:26+00:00,1023468149,1014475059,1,Timmy96,Orlando Engelaar,Update Information on Orlando Engelaar's article. My first edit of this article in seven years and wanted to make sure to update it. I also thought it was impossible to edit but I gave it a try and did it.
2021-05-13T16:43:28+00:00,1022982377,1002868448,1,Timmy96,Cedric van der Gun,Expand Information on Cedric Van Der Gun's article. Finally made amends with the article I messed up nine years ago. Another challenging article I ever edited because I thought it was impossible to edit but I gave it a try and did it.
2021-05-08T19:01:26+00:00,1022145537,985348360,1,Timmy96,André Bahia,Update Information on André Bahia. I wasn't planning on editing him until I edited [[Ron Vlaar]]. It motivated me to update his article.
2021-05-08T08:57:43+00:00,1022073281,1022007374,1,Timmy96,Ron Vlaar,Update Information on Ron Vlaar's article
2021-05-07T20:54:37+00:00,1022000656,1019399986,1,Timmy96,Ron Vlaar,Update Information on Ron Vlaar's article. My first edit of this article in five years and wanted to make sure to update it. I also thought it was impossible to edit but I gave it a try and did it.
2021-04-30T21:27:00+00:00,1020758770,1020568154,1,Timmy96,Joe Thompson (footballer),Update Information on Joe Thompson's article. My first edit of this article in five years and wanted to make sure to update it.
2021-04-30T21:24:01+00:00,1020758339,1003968174,1,Timmy96,Donal McDermott,Expand Information on Donal McDermott's article
2021-04-24T19:59:13+00:00,1019680463,1007524663,1,Timmy96,Jack Saville,Update Information on Jack Saville's article. My first edit of this article in five years and wanted to make sure to update it
2021-04-23T16:47:07+00:00,1019491184,1019089114,1,Timmy96,Julián Speroni,Update Information on Julián Speroni's article. My first edit of this article in six years and wanted to make sure to update it.
2021-04-16T18:31:55+00:00,1018194409,1007788022,1,Timmy96,Isaiah Osbourne,Expand Information on Isaiah Osbourne's article. Fulfilled my promise that I finally edited this article after I said this on 19 February 2021.
2021-04-13T15:31:06+00:00,1017580010,1012831571,1,Timmy96,Marek Jankulovski,Expand Information on Marek Jankulovski's article. Finally made amends with the article I messed up nine years ago. Another challenging article I ever edited because I used [[la Repubblica]] to find my sources. I also thought it was impossible to edit but I gave it a try and did it.
2021-04-09T16:14:35+00:00,1016887027,1003983969,1,Timmy96,Ross Wallace,Expand Information on Ross Wallace's article
2021-04-05T18:27:22+00:00,1016162318,1003802068,1,Timmy96,Stephen Arthurworrey,Update Information on Stephen Arthurworrey's article. My first edit of this article in five years and wanted to make sure to update it.
2021-04-05T15:18:53+00:00,1016130766,984429434,1,Timmy96,"Mark Bradley (footballer, born 1988)","Update Information on [[Mark Bradley (footballer, born 1988)|Mark Bradley]]'s article. My first edit of this article in six years and wanted to make sure to update it."
2021-04-05T15:09:17+00:00,1016129215,1012719321,1,Timmy96,Fitz Hall,Expand Information on Fitz Hall's article
2021-03-31T20:22:01+00:00,1015321909,1011887243,1,Timmy96,Tore Reginiussen,Update Information on Tore Reginiussen's article
2021-03-31T12:11:03+00:00,1015246419,1014918917,1,Timmy96,Hólmar Örn Eyjólfsson,Update Information on Hólmar Örn Eyjólfsson's article. My first edit of this article in four years and wanted to make sure to update it. I do admit I should have done better when I first edited the player.
2021-03-27T10:08:49+00:00,1014481292,1014476422,1,Timmy96,Wikipedia talk:WikiProject Football,/* Timmy96 */  - Responding to [[User:GiantSnowman|Giant]][[User talk:GiantSnowman|Snowman]]'s question
2021-03-27T10:02:19+00:00,1014480493,1010014418,1,Timmy96,Rachid Bouaouzan,Expand Information on Rachid Bouaouzan's article. My first edit of this article in three years and wanted to make sure to update it.
2021-03-27T09:47:59+00:00,1014479086,989035014,1,Timmy96,Marcus Nilsson (footballer),Expand Information on Marcus Nilsson. My first edit of this article in four years and wanted to make sure to update it.
2021-03-27T09:44:45+00:00,1014478762,1013389488,1,Timmy96,Joel Ekstrand,Expand Information on Joel Ekstrand's article. My first of this article in three years and wanted to make sure to update it.
2021-03-23T09:30:09+00:00,1013759490,990970015,1,Timmy96,Ludvig Öhman,Update Information on Ludvig Öhman's article. My first edit of this article in four years and wanted to make sure to update it.
2021-03-22T21:34:12+00:00,1013678799,1013659231,1,Timmy96,Wikipedia talk:WikiProject Football,/* Timmy96 */
2021-03-20T14:55:32+00:00,1013188843,1013187134,1,Timmy96,Wikipedia talk:WikiProject Football,/* Timmy96 */
2021-03-20T14:38:39+00:00,1013186653,1013168667,1,Timmy96,Mohammed Abu,"Revert the information back that [[User:GiantSnowman]] made changes. I can accept the criticism of my sentence structure, but can't accept the removal of the references that I added."
2021-03-20T10:13:52+00:00,1013156941,1004158605,1,Timmy96,Mohammed Abu,Expand Information on Mohammed Abu's article. Finally made amends with the article I messed up nine years ago.
2021-03-20T10:12:44+00:00,1013156698,1011078968,1,Timmy96,Peter Ramage,Expand Information on Peter Ramage's article
2021-03-13T16:50:39+00:00,1011924174,1004217488,1,Timmy96,Jonathan Zebina,Expand Information on Jonathan Zebina's article. Finally made amends with the article I messed up nine years ago. Another challenging article I ever edited because I used [[la Repubblica]] to find my sources. I also thought it was impossible to edit but I gave it a try and did it.
2021-03-07T20:16:34+00:00,1010873771,1007288382,1,Timmy96,Karim Matmour,Update Information on Karim Matmour's article. My first edit of this article in three years and wanted to make sure to update it.
2021-03-07T20:06:03+00:00,1010872142,994055671,1,Timmy96,Sascha Riether,Update Information on Sascha Riether's article. My first edit of this article in three years and wanted to make sure to update it.
2021-03-04T16:55:32+00:00,1010268781,1003089632,1,Timmy96,Georg Niedermeier,"Update Information on Georg Niedermeier's article. I was shocked and unhappy that User 51.19.0.25 removed references that I worked hard to find. I can accept the criticism of my sentence structure, but can't accept the removal of the references that I added."
2021-03-04T16:39:59+00:00,1010265880,1003913981,1,Timmy96,Daniel Schwaab,Update Information on Daniel Schwaab's article. My first edit of this article in four years and wanted to make sure to update it
2021-03-02T10:14:42+00:00,1009799130,1007787775,1,Timmy96,Younes Kaboul,Expand Information on Younès Kaboul's article
2021-02-26T21:07:12+00:00,1009123998,1004687992,1,Timmy96,Nicolas Isimat-Mirin,Expand Information on Nicolas Isimat-Mirin's article
2021-02-26T21:04:44+00:00,1009123663,993199714,1,Timmy96,Bradley Garmston,Update Information on Bradley Garmston's article. My first edit of this article in five years and wanted to make sure to update it.
2021-02-26T21:02:58+00:00,1009123407,1003795208,1,Timmy96,Josh Lelan,Update Information on Josh Lelan's article. My first edit of this article in five years and wanted to make sure to update it.
2021-02-20T22:50:32+00:00,1007978303,1004484642,1,Timmy96,Felipe Santana,Update Information on Felipe Santana's article. My first edit of this article in four years and wanted to make sure to update it.
2021-02-19T08:31:50+00:00,1007666267,989934390,1,Timmy96,Isaac Osbourne,"Update Information on Isaac Osbourne's article. My first edit of this article in six years and wanted to make sure to update it. One day, I will edit his brother, [[Isaiah Osbourne]]."
2021-02-19T08:29:55+00:00,1007666052,1003952038,1,Timmy96,"Naldo (footballer, born 1982)",Update Information on Naldo's article. My first edit of this article in four years and wanted to make sure to update it.
2021-02-12T15:16:00+00:00,1006374261,977425597,1,Timmy96,Julien Gorius,Update Information on Julien Gorius' article. My first edit of this article in four years and wanted to make sure to update it
2021-02-08T20:23:43+00:00,1005658541,1001963218,1,Timmy96,Emir Bajrami,Update Information on Emir Bajrami's article. My first edit of this article in four years and wanted to make sure to update it
2021-02-06T16:08:42+00:00,1005221367,1005097210,1,Timmy96,Nadjim Abdou,Update Information on Jimmy Abdou's article. I was motivated to update his article after I edited Ali Ahamada's article. The one I expanded was his international career.
2021-02-05T19:59:13+00:00,1005061012,1005029159,1,Timmy96,Sam Cosgrove,"Re-editing Sam Cosgrove's article. Revert the information because I felt the information that was removed should return. Also, I decided to include <br> on every citation if there's more than one."
2021-02-05T19:24:05+00:00,1005054825,997522067,1,Timmy96,Ali Ahamada,Expand Information on Ali Ahamada's article
2021-01-31T20:21:29+00:00,1004036333,1004021097,1,Timmy96,Sam Cosgrove,"Literally Expand Information on Sam Cosgrove's article. [[User:Mattythewhite]], [[User:GiantSnowman]] and [[User:Struway2]], you may be annoyed with my edits which I have been since yesterday, but I have done three of you a favour to expand Sam Cosgrove's article. I feel like I save you time."
2021-01-30T20:58:46+00:00,1003818063,1003139903,1,Timmy96,Diego Poyet,Expand Information on Diego Poyet's article. My first edit of this article in six years and wanted to make sure to update it
2021-01-29T21:31:50+00:00,1003619756,1001731232,1,Timmy96,Jürgen Locadia,Expand Information on Jürgen Locadia's article
2021-01-29T21:27:53+00:00,1003619167,1001268889,1,Timmy96,Eirik Johansen,Expand Information on Eirik Johansen's article. My first edit of this article in six years and wanted to make sure to update it
2021-01-23T09:18:48+00:00,1002204103,954127607,1,Timmy96,Jérome Polenz,Expand Information on Jérome Polenz's article
2021-01-20T17:54:06+00:00,1001656025,998442226,1,Timmy96,Mohamed Buya Turay,Expand Information on Mohamed Buya Turay's article.
2021-01-16T20:33:21+00:00,1000807277,990673482,1,Timmy96,Jakub Sokolík,Update Information on Jakub Sokolík's article. My first edit of this article in five years and wanted to make sure to update it
