timestamp,revid,parentid,sock,user,page,message
2018-01-01T04:12:51+00:00,818038868,818031150,1,DavidStats,Wikipedia:Articles for deletion/Covenant Christian Coalition,/* Covenant Christian Coalition */
2018-01-01T02:08:30+00:00,818025114,817984563,1,DavidStats,Wikipedia:Articles for deletion/Covenant Christian Coalition,/* Covenant Christian Coalition */
2015-06-09T14:45:40+00:00,666191931,666007172,1,DavidStats,Protestantism by country,Updated statistic for 2015 (with reference).  Was still using an estimate from 2004.
2015-06-09T14:37:08+00:00,666190999,665977527,1,DavidStats,Protestantism,Updated statistic bringing it in line with 2015 estimates.
2015-05-29T18:57:36+00:00,664599542,664599153,1,DavidStats,Christianity by country,Added noteslist.
2015-05-29T18:54:34+00:00,664599153,664597282,1,DavidStats,Christianity by country,
2015-05-29T18:38:29+00:00,664597282,664236802,1,DavidStats,Christianity by country,Updated statistic.  2.2 is from 2010.  Also updated some of the sources.
2015-05-29T16:22:27+00:00,664580469,664481647,1,DavidStats,Protestantism by country,Updated sources and figure to 2.4 billion.  All sources agree Christians make up 33% of world population.  World Factbook and GordonConwell.edu specify further.
2015-05-29T16:19:28+00:00,664580115,664338146,1,DavidStats,Protestantism,/* Spread and demographics */ Updated sources to include correct figure of 2.4 billion.
2015-05-28T22:03:02+00:00,664479219,0,1,DavidStats,User talk:DavidStats,[[WP:AES|←]]Created page with 'Welcome to my Talk page!  Collaborate with DavidStats here.'
2015-05-28T22:01:43+00:00,664479086,664135266,1,DavidStats,Protestantism by country,Undid revision 664135266 by [[Special:Contributions/Ernio48|Ernio48]] ([[User talk:Ernio48|talk]]) - Well your note and stat are outdated.  A good edit would be to update with a correct figure rather than use an incorrect figure based on an outdated note.
2015-05-28T21:57:26+00:00,664478592,0,1,DavidStats,User:DavidStats,[[WP:AES|←]]Created page with 'DavidStats User Page'
2017-12-31T05:11:01+00:00,817892806,817888307,1,Bertrand188,User talk:Bertrand188,/* Covenant Christian Coalition */
2017-12-31T03:18:29+00:00,817881105,799097911,1,Bertrand188,Church of Christ in the Sudan Among the Tiv,/* Interfaith relations */
2017-12-31T03:16:56+00:00,817880926,799735675,1,Bertrand188,United Reformed Church in Congo,
2017-12-31T03:15:54+00:00,817880802,803048350,1,Bertrand188,United Reformed Churches in North America,
2017-12-31T03:13:22+00:00,817880498,816703583,1,Bertrand188,United Methodist Church,/* Ecumenical relations */
2017-12-31T03:08:02+00:00,817879991,739172474,1,Bertrand188,United Evangelical Lutheran Churches in India,
2017-12-31T03:05:54+00:00,817879798,799289594,1,Bertrand188,United Church in Zambia,
2017-12-31T03:04:24+00:00,817879602,707007879,1,Bertrand188,United Church in Solomon Islands,/* Interchurch relationships */
2017-12-31T03:03:27+00:00,817879494,749520300,1,Bertrand188,United Church in Jamaica and the Cayman Islands,/* Interchurch organisations */
2017-12-31T03:01:19+00:00,817879214,799221624,1,Bertrand188,Union of Welsh Independents,/* Interchurch relations */
2017-12-31T02:59:22+00:00,817878975,803250707,1,Bertrand188,Union of Christian Evangelical Baptist Churches of Moldova,
2017-12-31T02:55:29+00:00,817878483,766247286,1,Bertrand188,Toraja Mamasa Church,
2017-12-31T02:54:34+00:00,817878355,766245769,1,Bertrand188,Toraja Church,
2017-12-31T02:53:46+00:00,817878254,809045971,1,Bertrand188,Wesleyan Church,
2017-12-31T02:52:06+00:00,817878045,787537441,1,Bertrand188,Protestant Church in Sabah,
2017-12-31T02:50:07+00:00,817877784,727853581,1,Bertrand188,Presbyterian Church of Korea (TongHap),
2017-12-31T02:46:34+00:00,817877349,795942565,1,Bertrand188,Church of the Lord (Aladura),/* Affiliations */
2017-12-31T02:42:22+00:00,817876830,812463426,1,Bertrand188,Brethren Church,/* Affiliations */
2017-12-31T02:38:09+00:00,817876330,807748036,1,Bertrand188,Seventh Day Baptists,/* Organizational structure and offices */
2017-12-31T02:36:28+00:00,817876111,817729811,1,Bertrand188,Seventh-day Adventist Church,/* Ecumenical activity */
2017-12-31T02:32:11+00:00,817875538,804998453,1,Bertrand188,Samavesam of Telugu Baptist Churches,
2017-12-31T02:29:17+00:00,817875145,0,1,Bertrand188,User talk:Bertrand188,[[WP:AES|←]]Created page with 'My talk page.'
2017-12-31T02:29:05+00:00,817875118,0,1,Bertrand188,User:Bertrand188,[[WP:AES|←]]Created page with 'Bertrand188's user page...'
2017-12-30T05:17:54+00:00,817723880,784590984,1,Creole54,Methodist Church in India,
2017-12-30T05:16:53+00:00,817723766,817723708,1,Creole54,Methodist Church Ghana,
2017-12-30T05:16:21+00:00,817723708,784590806,1,Creole54,Methodist Church Ghana,
2017-12-30T05:12:32+00:00,817723295,799487058,1,Creole54,Maohi Protestant Church,
2017-12-30T05:11:27+00:00,817723172,783237252,1,Creole54,Manipur Baptist Convention,
2017-12-30T05:10:08+00:00,817723039,816883494,1,Creole54,Mar Thoma Syrian Church,/* Ecumenical relations */
2017-12-30T05:08:07+00:00,817722845,808058693,1,Creole54,Malagasy Lutheran Church,
2017-12-30T05:06:56+00:00,817722734,796679688,1,Creole54,Lutheran Church of Christ in Nigeria,
2017-12-30T05:06:27+00:00,817722687,808161191,1,Creole54,Lutheran Church of Central Africa,
2017-12-30T05:05:45+00:00,817722619,816597918,1,Creole54,Lutheran Church of Australia,
2017-12-30T05:05:01+00:00,817722531,814157213,1,Creole54,Lutheran Church – Missouri Synod,
2017-12-30T05:03:19+00:00,817722345,682118514,1,Creole54,Lutheran Church in the Philippines,
2017-12-30T05:02:12+00:00,817722230,817235768,1,Creole54,Lutheran Church – Canada,
2017-12-30T04:43:13+00:00,817720223,782673172,1,Creole54,Korean Presbyterian Church Abroad,
2017-12-30T04:40:44+00:00,817719939,727929574,1,Creole54,Karo Batak Protestant Church,
2017-12-30T04:39:23+00:00,817719793,814741907,1,Creole54,Javanese Christian Church,
2017-12-30T04:36:00+00:00,817719409,810430126,1,Creole54,International Pentecostal Holiness Church,
2017-12-30T04:34:52+00:00,817719280,813411435,1,Creole54,Foursquare Church,
2017-12-30T04:33:44+00:00,817719136,817483028,1,Creole54,International Churches of Christ,
2017-12-30T04:32:37+00:00,817719017,766092042,1,Creole54,Indonesian Protestant Church in Gorontalo,
2017-12-30T04:31:45+00:00,817718922,778055740,1,Creole54,Indonesian Protestant Church in Buol Toli-Toli,
2017-12-30T04:30:34+00:00,817718755,763727495,1,Creole54,Indonesian Christian Church Synod,/* Ecumenical Commitment */
2017-12-30T04:29:16+00:00,817718637,657473353,1,Creole54,Independent Presbyterian Church of Brazil,
2017-12-30T04:28:40+00:00,817718571,808027548,1,Creole54,Independent Evangelical-Lutheran Church,
2017-12-30T04:27:16+00:00,817718444,726591711,1,Creole54,Gutnius Lutheran Church,
2017-12-30T04:26:29+00:00,817718363,806582555,1,Creole54,Great Commission church movement,
2017-12-30T04:19:18+00:00,817717526,817304388,1,Creole54,Free Methodist Church,
2017-12-30T04:18:05+00:00,817717374,805908921,1,Creole54,Free Church of Scotland (since 1900),
2017-12-30T04:16:46+00:00,817717217,816298677,1,Creole54,Fellowship of Independent Evangelical Churches,
2017-12-25T05:47:21+00:00,816982250,794249062,1,Creole54,Baptist Convention of Hong Kong,/* Affiliations */
2017-12-25T05:44:54+00:00,816982079,790591117,1,Creole54,Baptist Church of Mizoram,/*  Affiliates/Association */
2017-12-25T05:43:41+00:00,816981991,816403696,1,Creole54,Australian Baptist Ministries,/* Affiliations */
2017-12-25T05:34:44+00:00,816981319,789985497,1,Creole54,Associate Reformed Presbyterian Church of Mexico,/* Interchurch organisations */
2017-12-25T05:33:34+00:00,816981241,804967967,1,Creole54,Associate Reformed Presbyterian Church,
2017-12-25T05:30:22+00:00,816980989,808427603,1,Creole54,Apostolic Faith Mission of South Africa,
2017-12-14T22:27:42+00:00,815452351,814856091,1,Creole54,Christianity in India,/* Denominations */
2017-12-14T22:26:50+00:00,815452217,815452176,1,Creole54,Church of South India,
2017-12-14T22:26:35+00:00,815452176,814825774,1,Creole54,Church of South India,The citation used explicitly says 3.8 million so resolved mismatch.
2017-11-22T16:01:09+00:00,811585199,811585142,1,Creole54,List of the largest Protestant denominations,/* Transdenominational bodies */
2017-11-22T16:00:49+00:00,811585142,811503537,1,Creole54,List of the largest Protestant denominations,/* Lists of the largest Protestant bodies */
2016-06-29T21:34:44+00:00,727574762,716902466,1,Creole54,Postdenominationalism,
2016-06-29T21:28:13+00:00,727573944,725873078,1,Creole54,Ecumenism,/* Councils of churches */
2016-06-29T21:08:21+00:00,727571321,0,1,Creole54,User:Creole54,[[WP:AES|←]]Created page with 'Welcome to the talk page for Creole54!'
2017-12-31T16:07:47+00:00,817957156,817957087,1,Elder-ado,Wikipedia:Articles for deletion/Covenant Christian Coalition,/* Covenant Christian Coalition */
2017-12-31T16:07:09+00:00,817957087,817957046,1,Elder-ado,Wikipedia:Articles for deletion/Covenant Christian Coalition,/* Covenant Christian Coalition */
2017-12-31T15:43:40+00:00,817954505,817940971,1,Elder-ado,Wikipedia:Articles for deletion/Covenant Christian Coalition,
2017-12-31T15:14:05+00:00,817951202,0,1,Elder-ado,User talk:Elder-ado,[[WP:AES|←]]Created blank page
2017-12-31T15:12:58+00:00,817951022,0,1,Elder-ado,User:Elder-ado,[[WP:AES|←]]Created blank page
2017-12-30T05:56:40+00:00,817727957,736557782,1,Fightorflight7,Presbyterian Church of Africa,
2017-12-30T05:55:45+00:00,817727853,816430340,1,Fightorflight7,Presbyterian Church in Taiwan,
2017-12-30T05:55:12+00:00,817727789,760798206,1,Fightorflight7,Presbyterian Church in Sudan,
2017-12-30T05:54:32+00:00,817727730,800110871,1,Fightorflight7,Presbyterian Church in Rwanda,/* General */
2017-12-30T05:53:54+00:00,817727666,676875400,1,Fightorflight7,Presbyterian Church in Myanmar,
2017-12-30T05:53:20+00:00,817727608,749254453,1,Fightorflight7,Presbyterian Church in Korea (BaekSeok),
2017-12-30T05:52:44+00:00,817727545,816476119,1,Fightorflight7,Kosin Presbyterian Church in Korea,
2017-12-30T05:51:01+00:00,817727394,799078710,1,Fightorflight7,Presbyterian Church in Korea (Daeshin),
2017-12-30T05:50:21+00:00,817727329,810205322,1,Fightorflight7,Presbyterian Church in Ireland,
2017-12-30T05:49:38+00:00,817727244,813958331,1,Fightorflight7,Presbyterian Church in Canada,
2017-12-30T05:48:41+00:00,817727151,815093042,1,Fightorflight7,Presbyterian Church in Cameroon,/* External relations */
2017-12-30T05:47:59+00:00,817727084,817726958,1,Fightorflight7,Presbyterian Church in America,
2017-12-30T05:46:33+00:00,817726958,817609098,1,Fightorflight7,Presbyterian Church in America,
2017-12-30T05:45:48+00:00,817726884,734377106,1,Fightorflight7,People's Church of Africa,
2017-12-30T05:44:49+00:00,817726798,815031723,1,Fightorflight7,Pentecostal Church of God,
2017-12-30T05:43:58+00:00,817726701,730808243,1,Fightorflight7,Pasundan Christian Church,
2017-12-30T05:42:16+00:00,817726522,810593566,1,Fightorflight7,Orthodox Presbyterian Church,
2017-12-30T05:41:35+00:00,817726440,803269055,1,Fightorflight7,Orissa Baptist Evangelistic Crusade,
2017-12-30T05:40:25+00:00,817726293,787963423,1,Fightorflight7,Open Bible Churches,
2017-12-30T05:38:58+00:00,817726132,800197134,1,Fightorflight7,North Bank Baptist Christian Association,
2017-12-30T05:38:20+00:00,817726053,816747003,1,Fightorflight7,North American Lutheran Church,/* Relations with other churches */
2017-12-30T05:35:31+00:00,817725745,807806517,1,Fightorflight7,New Apostolic Church,
2017-12-30T05:32:16+00:00,817725387,816873027,1,Fightorflight7,National Presbyterian Church in Mexico,
2017-12-30T05:29:03+00:00,817725035,817724925,1,Fightorflight7,"National Baptist Convention of America International, Inc.",
2017-12-30T05:28:01+00:00,817724925,809237902,1,Fightorflight7,"National Baptist Convention of America International, Inc.",
2017-12-30T05:26:24+00:00,817724730,753244527,1,Fightorflight7,Myanmar Baptist Convention,
2017-12-30T05:25:34+00:00,817724639,817039133,1,Fightorflight7,Moravian Church,/* Ecumenical relations */
2017-12-30T05:24:11+00:00,817724505,811537225,1,Fightorflight7,Missionary Church,
2017-12-30T05:23:14+00:00,817724417,705090567,1,Fightorflight7,Methodist Church of Fiji and Rotuma,/* Church history and affiliation */
2017-12-30T05:20:34+00:00,817724154,757229965,1,Fightorflight7,Methodist Church in Malaysia,
2017-12-30T05:19:33+00:00,817724059,765814052,1,Fightorflight7,Methodist Church in Indonesia,
2017-12-03T22:00:02+00:00,813522718,810400010,1,Fightorflight7,List of parachurch organizations,/* International */
2017-11-27T17:50:19+00:00,812402501,809937945,1,Fightorflight7,Ecumenism,Added entry to Ecumenical institutes and offices
2017-11-27T17:27:54+00:00,812399407,808955774,1,Fightorflight7,List of religious organizations,/* Protestant */
2017-11-27T17:22:48+00:00,812398709,810752350,1,Fightorflight7,List of Christian denominations,/* Interdenominational organizations */
2017-02-08T15:20:21+00:00,764370935,0,1,Fightorflight7,User talk:Fightorflight7,"[[WP:AES|←]]Created page with 'The User Talk Page For ME, FightorFlight7'"
2017-02-08T14:52:16+00:00,764367325,764367306,1,Fightorflight7,User:Fightorflight7,
2017-02-08T14:52:06+00:00,764367306,0,1,Fightorflight7,User:Fightorflight7,"[[WP:AES|←]]Created page with 'Welcome to the User Page for me, FightorFlight7 _____________________'"
2017-12-31T02:26:52+00:00,817874923,797764154,1,FreeinSA,Reformed Evangelical Anglican Church of South Africa,
2017-12-31T02:25:31+00:00,817874793,799084738,1,FreeinSA,Reformed Church of East Africa,
2017-12-31T02:24:44+00:00,817874736,817874717,1,FreeinSA,Reformed Church of Christ in Nigeria,/* Ecumenical organisations */
2017-12-31T02:24:31+00:00,817874717,799904673,1,FreeinSA,Reformed Church of Christ in Nigeria,/* Ecumenical organisations */
2017-12-31T02:23:47+00:00,817874652,740478836,1,FreeinSA,Reformed Church in Zimbabwe,
2017-12-31T02:23:02+00:00,817874572,767875189,1,FreeinSA,Reformed Church in Zambia,
2017-12-31T02:21:46+00:00,817874437,799082072,1,FreeinSA,Reformed Church in Sub-Carpathia/ Reformed Church in Transcarpathia,/* Interchurch relations */
2017-12-31T02:20:24+00:00,817874266,762509834,1,FreeinSA,Reformed Church in Mozambique,
2017-12-31T02:19:27+00:00,817874164,797186124,1,FreeinSA,Reformed Church in Hungary,
2017-12-31T02:18:15+00:00,817874027,808372921,1,FreeinSA,Reformed Church in America,
2017-12-31T02:16:12+00:00,817873843,797465798,1,FreeinSA,Reformed Churches in the Netherlands (Liberated),
2017-12-31T02:14:47+00:00,817873742,812003254,1,FreeinSA,Reformed Churches in South Africa,
2017-12-31T02:12:35+00:00,817873516,805109137,1,FreeinSA,Reformed Christian Church in Slovakia,/* Interchurch relations */
2017-12-31T02:07:14+00:00,817873073,815914684,1,FreeinSA,Province of the Episcopal Church of South Sudan,/* Anglican realignment */
2017-12-31T02:05:49+00:00,817872941,803775115,1,FreeinSA,Province of the Anglican Church of the Congo,/* Anglican realignment */
2017-12-31T02:04:44+00:00,817872845,785820437,1,FreeinSA,Anglican Church of Rwanda,/* Ecumenical relations */
2017-12-31T02:03:22+00:00,817872702,803157261,1,FreeinSA,Province of the Anglican Church of Burundi,/* Ecumenical relations */
2017-12-31T02:01:51+00:00,817872546,768820237,1,FreeinSA,Christian Evangelical Church in Timor,/* Interchurch relations */
2017-12-31T02:01:11+00:00,817872461,770404862,1,FreeinSA,Protestant Church of Maluku,
2017-12-31T01:57:25+00:00,817872090,739953309,1,FreeinSA,Protestant Church of Algeria,
2017-12-31T01:55:55+00:00,817871946,780444285,1,FreeinSA,Protestant Church in Western Indonesia,
2017-12-31T01:54:43+00:00,817871826,575539895,1,FreeinSA,Protestant Church in Southeast Sulawesi,
2017-12-31T01:53:53+00:00,817871749,766093986,1,FreeinSA,Protestant Christian Church in Bali,
2017-12-31T01:53:18+00:00,817871687,756328104,1,FreeinSA,Presbyterian Reformed Church of Mexico,/* Statistics */
2017-12-31T01:52:32+00:00,817871620,814167790,1,FreeinSA,Presbyterian Church of Vanuatu,
2017-12-31T01:51:31+00:00,817871518,817871491,1,FreeinSA,Presbyterian Church of Trinidad and Tobago,/* Present day */
2017-12-31T01:51:16+00:00,817871491,808762164,1,FreeinSA,Presbyterian Church of Trinidad and Tobago,/* Present day */
2017-12-31T01:50:15+00:00,817871370,817321949,1,FreeinSA,Presbyterian Church of the Philippines,
2017-12-31T01:48:06+00:00,817871167,813927257,1,FreeinSA,Presbyterian Church of Pakistan,
2017-12-31T01:42:08+00:00,817870599,802371113,1,FreeinSA,Presbyterian Church of Nigeria,/* Interchurch organisations */
2017-12-31T01:40:57+00:00,817870469,793117936,1,FreeinSA,Presbyterian Church of India,
2017-12-31T01:38:16+00:00,817870153,816430160,1,FreeinSA,Presbyterian Church of Ghana,
2017-12-31T01:36:49+00:00,817869941,808326740,1,FreeinSA,Presbyterian Church of East Africa,
2017-12-31T01:35:12+00:00,817869690,813736817,1,FreeinSA,Presbyterian Church of Brazil,
2017-12-31T01:31:22+00:00,817869215,804993006,1,FreeinSA,Presbyterian Church of Australia,
2017-12-31T01:25:43+00:00,817868616,803043167,1,FreeinSA,Presbyterian Church of Aotearoa New Zealand,/* International connections */
2017-12-31T01:24:51+00:00,817868516,817249459,1,FreeinSA,Presbyterian Church of Angola,
2017-12-25T06:22:02+00:00,816985068,794159330,1,FreeinSA,Christian Church of Southern Sumatra,
2017-12-25T05:27:26+00:00,816980780,790596679,1,FreeinSA,Anglican Church of Tanzania,/* Ecumenical relations */
2017-12-25T05:16:51+00:00,816979880,673114893,1,FreeinSA,All-Ukrainian Union of Churches of Evangelical Christian Baptists,
2017-12-25T04:03:52+00:00,816974192,739418384,1,FreeinSA,Africa Inland Church Sudan,
2017-12-25T04:02:00+00:00,816974060,808160755,1,FreeinSA,"African Baptist Assembly of Malawi, Inc.",Added link.
2017-12-22T04:25:21+00:00,816561868,816560558,1,FreeinSA,Homosexuality and Baptist churches,/* Liberal position */
2017-12-22T04:22:20+00:00,816561583,813340129,1,FreeinSA,"National Baptist Convention, USA, Inc.",/* Same-sex marriage and LGBT issues */ Added some more citations and removed dead link.
2017-12-22T04:10:59+00:00,816560558,813530625,1,FreeinSA,Homosexuality and Baptist churches,/* Positions of churches */
2017-12-21T14:48:40+00:00,816467277,815739356,1,FreeinSA,List of Christian denominations affirming LGBT people,/* Africa and Asia */
2017-12-21T14:39:07+00:00,816466210,814826540,1,FreeinSA,Homosexuality and the Anglican Communion,/* Anglican Church of Southern Africa */
2017-12-20T17:54:02+00:00,816330849,0,1,FreeinSA,User talk:FreeinSA,[[WP:AES|←]]Created page with 'Hello!'
2017-12-20T17:53:41+00:00,816330788,0,1,FreeinSA,User:FreeinSA,[[WP:AES|←]]Created page with 'Hello!'
2017-12-20T17:52:51+00:00,816330682,808801135,1,FreeinSA,Anglican Church of Southern Africa,Canon law makes no mention of what was previously stated as was affirmed by the September 2016 Provincial Synod meeting.
2017-12-31T19:41:56+00:00,817981911,817980046,1,Kigozi_Af,Wikipedia:Articles for deletion/Covenant Christian Coalition,/* Covenant Christian Coalition */
2017-12-31T19:24:25+00:00,817980046,817979606,1,Kigozi_Af,Wikipedia:Articles for deletion/Covenant Christian Coalition,/* Covenant Christian Coalition */
2017-12-31T18:12:23+00:00,817972501,817957156,1,Kigozi_Af,Wikipedia:Articles for deletion/Covenant Christian Coalition,/* Covenant Christian Coalition */
2017-12-30T03:24:47+00:00,817711339,816664836,1,ThomasTheTrain1,Elim Pentecostal Church,/* Organisation */
2017-12-30T03:23:46+00:00,817711216,815745740,1,ThomasTheTrain1,ECO: A Covenant Order of Evangelical Presbyterians,
2017-12-30T03:21:53+00:00,817710990,766246764,1,ThomasTheTrain1,East Java Christian Church,/* Recent activities */
2017-12-30T03:20:59+00:00,817710911,816229750,1,ThomasTheTrain1,Dutch Reformed Church in South Africa (NHK),/* Statistics */
2017-12-30T03:19:33+00:00,817710754,817568817,1,ThomasTheTrain1,Czechoslovak Hussite Church,/* Relations with other churches */
2017-12-30T03:18:40+00:00,817710649,804094235,1,ThomasTheTrain1,Cumberland Presbyterian Church,
2017-12-30T03:17:22+00:00,817710490,809968458,1,ThomasTheTrain1,Council of Baptist Churches in Northeast India,
2017-12-30T03:08:37+00:00,817709476,802603678,1,ThomasTheTrain1,Convention of Philippine Baptist Churches,
2017-12-30T03:07:51+00:00,817709406,817292406,1,ThomasTheTrain1,Convention of Baptist Churches of Northern Circars,
2017-12-30T03:05:08+00:00,817709122,812532698,1,ThomasTheTrain1,Church of Uganda,/* Ecumenical relations */
2017-12-30T03:02:45+00:00,817708871,794346078,1,ThomasTheTrain1,Church of the Province of West Africa,/* Ecumenical relations */
2017-12-30T03:01:28+00:00,817708732,807006445,1,ThomasTheTrain1,Church of the Province of the Indian Ocean,/* Anglican realignment */
2017-12-30T02:59:45+00:00,817708540,806347482,1,ThomasTheTrain1,Church of the Nazarene,
2017-12-30T02:57:39+00:00,817708333,811763627,1,ThomasTheTrain1,Church of the Brethren,
2017-12-30T02:56:30+00:00,817708215,813155364,1,ThomasTheTrain1,Church of Pakistan,
2017-12-30T02:55:20+00:00,817708091,808393874,1,ThomasTheTrain1,Church of North India,
2017-12-30T02:54:04+00:00,817707971,814565525,1,ThomasTheTrain1,Church of Nigeria,/* Ecumenical relations */
2017-12-30T02:52:47+00:00,817707848,813340489,1,ThomasTheTrain1,Church of Jesus Christ in Madagascar,
2017-12-30T02:50:23+00:00,817707575,813339375,1,ThomasTheTrain1,"Church of God (Cleveland, Tennessee)",
2017-12-30T02:48:45+00:00,817707398,807759475,1,ThomasTheTrain1,"Church of God (Anderson, Indiana)",
2017-12-30T02:46:52+00:00,817707193,761521378,1,ThomasTheTrain1,Church of Christ in Thailand,/* Theology */
2017-12-30T02:45:15+00:00,817707005,780852530,1,ThomasTheTrain1,Church of Christ in the Congo,
2017-12-30T02:43:31+00:00,817706817,808160660,1,ThomasTheTrain1,Church of Central Africa Presbyterian,/* History */
2017-12-30T02:40:53+00:00,817706545,799789547,1,ThomasTheTrain1,Christian Reformed Church of Nigeria,
2017-12-30T02:39:29+00:00,817706395,809794026,1,ThomasTheTrain1,Christian Reformed Church in North America,/* Ecumenical partnerships */
2017-12-30T02:38:04+00:00,817706248,811698774,1,ThomasTheTrain1,Christian Reformed Churches,
2017-12-30T02:36:59+00:00,817706139,773710756,1,ThomasTheTrain1,Protestant Church in Indonesia,
2017-12-30T02:34:52+00:00,817705919,766244945,1,ThomasTheTrain1,Simalungun Protestant Christian Church,/* Church Co-operation */
2017-12-30T02:32:56+00:00,817705677,654423909,1,ThomasTheTrain1,Christian Protestant Angkola Church,
2017-12-30T02:18:03+00:00,817704082,794168189,1,ThomasTheTrain1,Christian Methodist Episcopal Church,/* Ecumenical activity */
2017-12-29T04:06:30+00:00,817555781,766092298,1,ThomasTheTrain1,Christian Evangelical Church in Sangihe-Talaud,
2017-12-29T04:04:48+00:00,817555584,814828701,1,ThomasTheTrain1,Christian Evangelical Church in Minahasa,
2017-12-29T03:58:14+00:00,817554860,765923397,1,ThomasTheTrain1,Christian Church in Luwuk Banggai,
2017-12-25T06:15:43+00:00,816984524,794004518,1,ThomasTheTrain1,Chinese Baptist Convention,
2017-12-25T06:14:10+00:00,816984375,793493958,1,ThomasTheTrain1,Central Sulawesi Christian Church,
2017-12-25T06:09:02+00:00,816983896,808486942,1,ThomasTheTrain1,National Evangelical Presbyterian Church of Guatemala,
2017-12-25T06:05:07+00:00,816983554,782484158,1,ThomasTheTrain1,Canadian and American Reformed Churches,
2017-12-25T06:00:55+00:00,816983167,791980744,1,ThomasTheTrain1,Borneo Evangelical Church,
2017-12-25T05:58:47+00:00,816983023,810195287,1,ThomasTheTrain1,Batak Christian Protestant Church,Added an assoc. in infobox.
2017-12-25T05:56:55+00:00,816982910,0,1,ThomasTheTrain1,User talk:ThomasTheTrain1,[[WP:AES|←]]Created page with 'Welcome to my talk page!'
2017-12-25T05:56:09+00:00,816982857,0,1,ThomasTheTrain1,User:ThomasTheTrain1,[[WP:AES|←]]Created page with '<Content Below>'
2017-12-25T05:55:38+00:00,816982823,808436626,1,ThomasTheTrain1,Basel Christian Church of Malaysia,
2017-12-30T04:13:03+00:00,817716819,817297665,1,UberStats,Three-Self Patriotic Movement,
2017-12-30T04:10:59+00:00,817716586,789923225,1,UberStats,Evangelical Reformed Church in Angola,/* Doctrine */
2017-12-30T04:10:14+00:00,817716514,802323814,1,UberStats,Evangelical Presbyterian Church of Togo,
2017-12-30T04:08:38+00:00,817716347,802323790,1,UberStats,Evangelical Presbyterian Church of Ivory Coast,
2017-12-30T04:07:42+00:00,817716250,796564346,1,UberStats,Lesotho Evangelical Church in Southern Africa,
2017-12-30T04:05:45+00:00,817716021,809833821,1,UberStats,Igreja Presbiteriana de Moçambique,
2017-12-30T04:04:29+00:00,817715907,739952295,1,UberStats,Evangelical Presbyterian Church in South Africa,
2017-12-30T04:02:51+00:00,817715723,815970126,1,UberStats,"Evangelical Presbyterian Church, Ghana",
2017-12-30T04:00:07+00:00,817715408,817276406,1,UberStats,Evangelical Presbyterian Church (United States),
2017-12-30T03:58:33+00:00,817715263,817715237,1,UberStats,Evangelical Lutheran Synod,
2017-12-30T03:58:16+00:00,817715237,806474717,1,UberStats,Evangelical Lutheran Synod,
2017-12-30T03:56:42+00:00,817715061,784476556,1,UberStats,Evangelical Lutheran Church of Papua New Guinea,
2017-12-30T03:55:31+00:00,817714945,739952239,1,UberStats,Evangelical Lutheran Church of Ghana,
2017-12-30T03:54:52+00:00,817714868,816538566,1,UberStats,Evangelical Lutheran Church of Latvia,
2017-12-30T03:54:10+00:00,817714770,739951711,1,UberStats,Evangelical Lutheran Church of Brazil,
2017-12-30T03:53:18+00:00,817714668,794895648,1,UberStats,Evangelical Lutheran Church in Zimbabwe,
2017-12-30T03:52:15+00:00,817714546,768217990,1,UberStats,Evangelical Lutheran Church in the Republic of Namibia,
2017-12-30T03:51:32+00:00,817714466,809851527,1,UberStats,Evangelical Lutheran Church in Tanzania,
2017-12-30T03:50:59+00:00,817714415,761510446,1,UberStats,Evangelical Lutheran Church in Southern Africa,
2017-12-30T03:50:22+00:00,817714338,793929775,1,UberStats,"Evangelical Lutheran Church in Russia, Ukraine, Kazakhstan and Central Asia",
