timestamp,revid,parentid,sock,user,page,message
2018-06-11T10:55:26+00:00,845374846,845374524,1,Rc_curiousbrewery,User talk:Rc curiousbrewery,added further reasoning to request for account to be unblocked
2018-06-11T10:51:58+00:00,845374524,845374093,1,Rc_curiousbrewery,User talk:Rc curiousbrewery,unblock-spamun new username and reason
2018-06-11T10:47:28+00:00,845374093,845373841,1,Rc_curiousbrewery,User talk:Rc curiousbrewery,/* Proposed deletion of Curious Brewery */  added response to [[User:Bri]] to ensure Curious Brewery is not deleted.
2018-06-11T10:43:05+00:00,845373616,845355193,1,Rc_curiousbrewery,User talk:2Joules,Added commentary around Curious Brewery
2018-06-11T10:37:03+00:00,845373015,845370396,1,Rc_curiousbrewery,User talk:Rc curiousbrewery,added commentary around COI and Curious Brewery being false along with request for support to ensure curious brewery is not deleted
2018-06-11T10:27:43+00:00,845371516,845370397,1,Rc_curiousbrewery,Wikipedia:Articles for deletion/Curious Brewery,added comment regarding why not to delete page as page does not fail [[WP:NCORP]]
2018-06-11T11:01:47+00:00,845375514,845375455,1,56248315_sandbox,User talk:56248315 sandbox,
2018-06-11T11:01:14+00:00,845375455,0,1,56248315_sandbox,User talk:56248315 sandbox,[[WP:AES|←]]Created page with '{{unblock|unaware of why account is currently blocked}}'
2018-06-11T07:15:38+00:00,845355193,844038468,0,SoWhy,User talk:2Joules,Notifying about declined speedy deletion
2018-06-11T10:37:03+00:00,845373015,845370396,0,Rc curiousbrewery,User talk:Rc curiousbrewery,added commentary around COI and Curious Brewery being false along with request for support to ensure curious brewery is not deleted
2018-06-11T10:43:13+00:00,845373631,845371516,0,2Joules,Wikipedia:Articles for deletion/Curious Brewery,
2018-06-11T10:47:28+00:00,845374093,845373841,0,Rc curiousbrewery,User talk:Rc curiousbrewery,/* Proposed deletion of Curious Brewery */  added response to [[User:Bri]] to ensure Curious Brewery is not deleted.
2018-06-11T10:51:58+00:00,845374524,845374093,0,Rc curiousbrewery,User talk:Rc curiousbrewery,unblock-spamun new username and reason
2018-06-11T10:15:08+00:00,845370396,845369716,0,2Joules,User talk:Rc curiousbrewery,Notification: listing at [[WP:AFD|articles for deletion]] of [[Curious Brewery]]. ([[WP:TW|TW]])
2018-06-10T00:52:10+00:00,845183194,842311635,0,Bri,User talk:Rc curiousbrewery,Proposed deletion of [[Curious Brewery]]
