timestamp,revid,parentid,sock,user,page,message
2020-12-22T02:12:22+00:00,995632572,995630123,1,Yeetboi6969,Kinderwood,"Added upcoming episodes, and show details"
2020-12-22T01:54:54+00:00,995629861,995626103,1,Yeetboi6969,Kinderwood,This is a warning to whom ever owns this page.
2020-12-23T22:28:08+00:00,995982989,995978962,1,Yeetboi69696969,Kinderwood,
2020-12-23T06:19:39+00:00,995852743,995830706,0,172.250.44.165,Kinderwood,"/* Characters */  No need for dash. Anyway, can someone add a views column in the episode list?"
2020-12-22T17:20:12+00:00,995741609,995739296,0,DogetimeeAKABlueyFan,Kinderwood,
2020-12-22T02:12:28+00:00,995632593,995632572,0,ClueBot NG,Kinderwood,"Reverting possible vandalism by [[Special:Contribs/Yeetboi6969|Yeetboi6969]] to version by Igarnish. [[WP:CBFP|Report False Positive?]] Thanks, [[WP:CBNG|ClueBot NG]]. (3851305) (Bot)"
2020-12-23T03:05:55+00:00,995830706,995830651,0,RJFJR,Kinderwood,remove {{cleanup|date=December 2020|reason=Fix reference error.}}
2020-12-22T21:25:22+00:00,995781787,995762300,0,Robert McClenon,Kinderwood,"Added tags to the page using [[Wikipedia:Page Curation|Page Curation]] (cleanup, citation style)"
