timestamp,revid,parentid,sock,user,page,message
2016-02-08T15:39:52+00:00,703938543,703754724,1,Chamath237,User talk:Chamath237,/* Orphaned non-free image File:PEO TV logo.png */
2015-04-21T07:05:16+00:00,657441065,518250610,1,Chamath237,File:EUSL logo2.png,Chamath237 uploaded a new version of [[File:EUSL logo2.png]]
2015-04-21T07:03:20+00:00,657440928,652072785,1,Chamath237,Sabaragamuwa University of Sri Lanka,
2015-04-21T07:02:55+00:00,657440904,518742015,1,Chamath237,File:Logo-SUSL.png,Chamath237 uploaded a new version of [[File:Logo-SUSL.png]]
2015-04-21T06:55:03+00:00,657440257,657202994,1,Chamath237,Template:Telecommunications in Sri Lanka,
2015-04-21T06:53:42+00:00,657440142,640494123,1,Chamath237,File:University of Sri Jayewardenepura crest.png,Chamath237 uploaded a new version of [[File:University of Sri Jayewardenepura crest.png]]
2015-04-20T08:59:09+00:00,657302509,629167692,1,Chamath237,File:Sri Lanka Army Logo.png,Chamath237 uploaded a new version of [[File:Sri Lanka Army Logo.png]]
2015-04-20T07:47:31+00:00,657296960,656806400,1,Chamath237,List of government gazettes,
2015-04-20T07:08:04+00:00,657294018,657293996,1,Chamath237,Road signs in Sri Lanka,/* Expressways */
2015-04-20T07:07:49+00:00,657293996,656099826,1,Chamath237,Road signs in Sri Lanka,/* Other signs useful for drivers */
2015-04-20T07:00:29+00:00,657293340,657112323,1,Chamath237,User talk:Samee,/* Move 'Airtel (Sri Lanka)' to 'airtel Sri Lanka' */ new section
2015-04-16T04:19:20+00:00,656706782,656333362,1,Chamath237,Maithripala Sirisena,
2015-04-16T04:15:46+00:00,656706543,656676062,1,Chamath237,List of current heads of state and government,/* Member states and observers of the United Nations */
2015-04-16T04:13:07+00:00,656706362,655045585,1,Chamath237,First Sirisena cabinet,/* Cabinet members */
2015-04-16T04:10:21+00:00,656706145,645985176,1,Chamath237,Template:Sri Lankan security forces,
2015-04-16T04:07:12+00:00,656705917,655486344,1,Chamath237,Inspector General of Police (Sri Lanka),
2015-04-16T04:05:25+00:00,656705771,650468419,1,Chamath237,Sri Lanka Police,
2015-04-16T03:56:48+00:00,656705076,656705011,1,Chamath237,Ministry of Public Security (Sri Lanka),/* Ministers */
2015-04-16T03:56:06+00:00,656705011,656704517,1,Chamath237,Ministry of Public Security (Sri Lanka),
2015-04-16T03:52:26+00:00,656704745,647238762,1,Chamath237,John Amaratunga,
2015-04-16T03:50:28+00:00,656704593,0,1,Chamath237,Minister of Public Order and Christian Religious Affairs,[[WP:AES|←]]Redirected page to [[Ministry of Public Order and Christian Religious Affairs#Ministers]]
2015-04-16T03:49:07+00:00,656704517,656704432,1,Chamath237,Ministry of Public Security (Sri Lanka),/* Secretaries */
2015-04-16T03:47:59+00:00,656704432,656703767,1,Chamath237,Ministry of Public Security (Sri Lanka),/* Ministers */
2015-04-16T03:47:19+00:00,656704387,656704169,1,Chamath237,"Minister of Public Security, Christian Religious Affairs and Disaster Management",[[WP:AES|←]]Redirected page to [[Ministry of Public Order and Christian Religious Affairs#Ministers]]
2015-04-16T03:47:08+00:00,656704368,656704061,1,Chamath237,Minister of Law and Order,[[WP:AES|←]]Redirected page to [[Ministry of Public Order and Christian Religious Affairs#Ministers]]
2015-04-16T03:46:38+00:00,656704327,656704028,1,Chamath237,Minister of Law & Order,[[WP:AES|←]]Redirected page to [[Ministry of Public Order and Christian Religious Affairs#Ministers]]
2015-04-16T03:46:23+00:00,656704314,644009162,1,Chamath237,"Minister of Public Order, Disaster Management and Christian Affairs",[[WP:AES|←]]Redirected page to [[Ministry of Public Order and Christian Religious Affairs#Ministers]]
2015-04-16T03:45:49+00:00,656704259,644008059,1,Chamath237,Ministry of Law and Order,[[WP:AES|←]]Redirected page to [[Ministry of Public Order and Christian Religious Affairs]]
2015-04-16T03:45:29+00:00,656704229,644015979,1,Chamath237,"Ministry of Public Security, Christian Religious Affairs and Disaster Management",[[WP:AES|←]]Redirected page to [[Ministry of Public Order and Christian Religious Affairs]]
2015-04-16T03:44:44+00:00,656704169,644015964,1,Chamath237,"Minister of Public Security, Christian Religious Affairs and Disaster Management",[[WP:AES|←]]Redirected page to [[Ministry of Public Order and Christian Religious Affairs#List of ministers]]
2015-04-16T03:43:30+00:00,656704061,644015961,1,Chamath237,Minister of Law and Order,[[WP:AES|←]]Redirected page to [[Ministry of Public Order and Christian Religious Affairs#List of ministers]]
2015-04-16T03:43:09+00:00,656704028,644015958,1,Chamath237,Minister of Law & Order,[[WP:AES|←]]Redirected page to [[Ministry of Public Order and Christian Religious Affairs#Officials]]
2015-04-16T03:42:32+00:00,656703972,644015943,1,Chamath237,Ministry of Law & Order,[[WP:AES|←]]Redirected page to [[Ministry of Public Order and Christian Religious Affairs]]
2015-04-16T03:42:09+00:00,656703925,644015939,1,Chamath237,Ministry of Law & Order (Sri Lanka),[[WP:AES|←]]Redirected page to [[Ministry of Public Order and Christian Religious Affairs]]
2015-04-16T03:40:52+00:00,656703774,0,1,Chamath237,"Talk:Ministry of Public Order, Disaster Management and Christian Affairs","Chamath237 moved page [[Talk:Ministry of Public Order, Disaster Management and Christian Affairs]] to [[Talk:Ministry of Public Order and Christian Religious Affairs]]"
2015-04-16T03:40:51+00:00,656703770,644008062,1,Chamath237,Talk:Ministry of Public Security (Sri Lanka),"Chamath237 moved page [[Talk:Ministry of Public Order, Disaster Management and Christian Affairs]] to [[Talk:Ministry of Public Order and Christian Religious Affairs]]"
2015-04-16T03:40:50+00:00,656703768,0,1,Chamath237,"Ministry of Public Order, Disaster Management and Christian Affairs","Chamath237 moved page [[Ministry of Public Order, Disaster Management and Christian Affairs]] to [[Ministry of Public Order and Christian Religious Affairs]]"
2015-04-16T03:40:50+00:00,656703767,646452440,1,Chamath237,Ministry of Public Security (Sri Lanka),"Chamath237 moved page [[Ministry of Public Order, Disaster Management and Christian Affairs]] to [[Ministry of Public Order and Christian Religious Affairs]]"
2015-04-10T12:45:15+00:00,655825198,655312258,1,Chamath237,List of time zones by country,
2015-04-10T12:40:20+00:00,655824719,654383734,1,Chamath237,List of time zone abbreviations,
2015-04-10T12:38:43+00:00,655824598,0,1,Chamath237,Talk:Sri Lanka Time,Chamath237 moved page [[Talk:Sri Lanka Time]] to [[Talk:Sri Lanka Standard Time]]
2015-04-10T12:38:42+00:00,655824597,221224863,1,Chamath237,Talk:Sri Lanka Standard Time,Chamath237 moved page [[Talk:Sri Lanka Time]] to [[Talk:Sri Lanka Standard Time]]
2015-04-10T12:38:41+00:00,655824593,0,1,Chamath237,Sri Lanka Time,Chamath237 moved page [[Sri Lanka Time]] to [[Sri Lanka Standard Time]] over redirect
2015-04-10T12:38:40+00:00,655824592,630437498,1,Chamath237,Sri Lanka Standard Time,Chamath237 moved page [[Sri Lanka Time]] to [[Sri Lanka Standard Time]] over redirect
2015-04-08T05:27:52+00:00,655459118,641627568,1,Chamath237,Template:Sri Lankan elections,
2015-04-08T05:23:36+00:00,655458745,655457435,1,Chamath237,List of next general elections,/* Asia */
2015-04-08T05:21:20+00:00,655458544,655457757,1,Chamath237,Commonwealth of Nations,/* Elections */
2015-04-08T05:12:00+00:00,655457757,654920108,1,Chamath237,Commonwealth of Nations,/* Elections */
2015-04-08T05:07:59+00:00,655457435,653937686,1,Chamath237,List of next general elections,/* Asia */
2015-04-08T04:50:01+00:00,655455966,655455666,1,Chamath237,Template:Foreign relations of Sri Lanka,
2015-04-08T04:46:55+00:00,655455666,634198175,1,Chamath237,Template:Foreign relations of Sri Lanka,
2015-04-08T04:36:42+00:00,655454824,650436844,1,Chamath237,Mahinda Rajapaksa,/* Election defeat */
2015-04-06T14:40:43+00:00,655193728,655173367,1,Chamath237,Mattala Rajapaksa International Airport,/* Airlines and destinations */
2015-04-06T14:28:30+00:00,655192299,655190115,1,Chamath237,List of SriLankan Airlines destinations,
2015-04-06T14:16:04+00:00,655190751,655189090,1,Chamath237,Bandaranaike International Airport,/* Passenger */
2015-04-06T14:11:27+00:00,655190115,655183657,1,Chamath237,List of SriLankan Airlines destinations,/* List */
2015-04-06T14:03:00+00:00,655189090,655183605,1,Chamath237,Bandaranaike International Airport,/* Passenger */
2015-04-06T13:59:49+00:00,655188698,655020610,1,Chamath237,Kualanamu International Airport,/* Passenger airlines */
2015-04-06T13:57:52+00:00,655188465,655174802,1,Chamath237,Dubai International Airport,/* Passenger flights */
2015-04-06T13:57:14+00:00,655188386,655187730,1,Chamath237,Mihin Lanka destinations,
2015-04-06T13:50:52+00:00,655187730,654765337,1,Chamath237,Mihin Lanka destinations,
2015-04-06T13:38:06+00:00,655186270,655023132,1,Chamath237,Netaji Subhas Chandra Bose International Airport,/* Passenger */
2015-04-06T13:33:13+00:00,655185602,654855928,1,Chamath237,Lal Bahadur Shastri Airport,/* Airlines and destinations */
2015-04-06T13:32:23+00:00,655185515,653716484,1,Chamath237,Gaya Airport,/* Airlines and destinations */
2015-04-06T13:30:46+00:00,655185337,655166971,1,Chamath237,Sharjah International Airport,/* Passenger airlines */
2015-04-06T13:29:40+00:00,655185211,653716703,1,Chamath237,Seychelles International Airport,/* Airlines and destinations */
2015-04-06T13:28:14+00:00,655185039,654883967,1,Chamath237,Madurai Airport,/* Airlines and destinations */
2015-04-06T13:26:30+00:00,655184819,655028459,1,Chamath237,Allama Iqbal International Airport,/* Passenger */
2015-04-06T13:23:48+00:00,655184519,654848926,1,Chamath237,Soekarno–Hatta International Airport,/* Passenger terminals */
2015-04-06T13:21:41+00:00,655184329,655132878,1,Chamath237,Hazrat Shahjalal International Airport,/* Passenger */
2015-03-09T12:01:06+00:00,650596679,650596145,1,Chamath237,Template:2015 Cricket World Cup knockout stage bracket,
2015-03-09T12:00:15+00:00,650596597,650596429,1,Chamath237,2015 Cricket World Cup,/* Quarter-finals */
2015-03-09T11:58:07+00:00,650596395,650596266,1,Chamath237,2015 Cricket World Cup knockout stage,/* Quarter-finals */
2015-03-09T11:56:38+00:00,650596266,650595393,1,Chamath237,2015 Cricket World Cup knockout stage,/* Quarter-finals */
2015-03-09T11:55:10+00:00,650596145,650435847,1,Chamath237,Template:2015 Cricket World Cup knockout stage bracket,
2015-03-01T11:13:13+00:00,649362424,649358779,1,Chamath237,2015 Cricket World Cup,/* Broadcasting rights */
2015-02-13T04:39:02+00:00,646903367,646903069,1,Chamath237,List of hospitals in Sri Lanka,/* Private Hospitals */
2015-02-13T04:35:25+00:00,646903069,646903031,1,Chamath237,List of hospitals in Sri Lanka,/* Private Hospitals */
2015-02-13T04:34:53+00:00,646903031,646902598,1,Chamath237,List of hospitals in Sri Lanka,/* Private hospitals */
2015-02-13T04:29:20+00:00,646902598,643342978,1,Chamath237,List of hospitals in Sri Lanka,/* Private Hospitals */
2015-02-13T04:23:18+00:00,646902120,646902002,1,Chamath237,Nawaloka Hospital,
2015-02-13T04:21:52+00:00,646902002,643344901,1,Chamath237,Nawaloka Hospital,
2015-02-13T04:05:34+00:00,646900682,646900442,1,Chamath237,Western Hospital,
2015-02-13T04:02:29+00:00,646900446,0,1,Chamath237,"Talk:Western Hospital (Western Infirmary), Sri Lanka","Chamath237 moved page [[Talk:Western Hospital (Western Infirmary), Sri Lanka]] to [[Talk:Western Hospital]]"
2015-02-13T04:02:29+00:00,646900445,645258359,1,Chamath237,Talk:Western Hospital,"Chamath237 moved page [[Talk:Western Hospital (Western Infirmary), Sri Lanka]] to [[Talk:Western Hospital]]"
2015-02-13T04:02:28+00:00,646900443,0,1,Chamath237,"Western Hospital (Western Infirmary), Sri Lanka","Chamath237 moved page [[Western Hospital (Western Infirmary), Sri Lanka]] to [[Western Hospital]]"
2015-02-13T04:02:28+00:00,646900442,645419372,1,Chamath237,Western Hospital,"Chamath237 moved page [[Western Hospital (Western Infirmary), Sri Lanka]] to [[Western Hospital]]"
2015-02-13T03:50:32+00:00,646899326,584008103,1,Chamath237,File:Lanka Hospitals logo.png,Chamath237 uploaded a new version of [[File:Lanka Hospitals logo.png]]
2015-02-13T03:07:58+00:00,646894758,642894500,1,Chamath237,Prime Minister of Sri Lanka,
2015-02-13T03:04:08+00:00,646894304,646460312,1,Chamath237,President of Sri Lanka,
2015-02-12T06:17:18+00:00,646761453,639479269,1,Chamath237,Sri Lanka Navy,
2015-02-12T06:16:09+00:00,646761335,646172662,1,Chamath237,Sri Lanka Air Force,
2015-02-12T06:14:07+00:00,646761134,645924455,1,Chamath237,Sri Lanka Army,
2015-02-12T06:09:52+00:00,646760673,645863252,1,Chamath237,Sri Lanka Police,
2015-02-10T06:27:29+00:00,646460312,646459894,1,Chamath237,President of Sri Lanka,
2015-02-10T06:27:11+00:00,646460290,645102799,1,Chamath237,Excellency,/* Sri Lanka */
2015-02-10T06:22:29+00:00,646459894,646459547,1,Chamath237,President of Sri Lanka,/* External links */
2015-02-10T06:17:35+00:00,646459547,646459342,1,Chamath237,President of Sri Lanka,
2015-02-10T06:13:49+00:00,646459342,646455738,1,Chamath237,President of Sri Lanka,
2015-02-10T05:59:15+00:00,646458365,643488585,1,Chamath237,List of prime ministers of Sri Lanka,
2015-02-10T05:46:30+00:00,646457403,646456742,1,Chamath237,List of presidents of Sri Lanka,Sirisena is a Sri Lanka Freedom Party member and he is the new chairperson of SLFP
2015-02-10T05:39:10+00:00,646456742,645792169,1,Chamath237,List of presidents of Sri Lanka,
2015-02-10T05:27:33+00:00,646455738,645791963,1,Chamath237,President of Sri Lanka,
2015-02-10T05:25:18+00:00,646455531,639773621,1,Chamath237,Ministry of Resettlement,
2015-02-10T05:16:11+00:00,646454725,646449721,1,Chamath237,Ministry of Health (Sri Lanka),/* Ministers */
2015-02-10T05:14:27+00:00,646454583,646448112,1,Chamath237,Minister of Foreign Affairs (Sri Lanka),/* List of Foreign Ministers */
2015-02-10T05:12:22+00:00,646454403,646454375,1,Chamath237,Ministry of Power and Energy,/* Ministers of Power and Energy */
2015-02-10T05:12:01+00:00,646454375,642975544,1,Chamath237,Ministry of Power and Energy,/* Ministers of Power and Energy */
2015-02-10T05:09:24+00:00,646454178,642426722,1,Chamath237,Ministry of Home Affairs (Sri Lanka),/* Ministers */
2015-02-10T05:08:21+00:00,646454072,642703618,1,Chamath237,Ministry of Plantation Industries,/* List of Plantation Industries Ministers */
2015-02-10T05:07:57+00:00,646454034,642701331,1,Chamath237,Ministry of Mass Media and Information,/* List of Mass Media & Information Ministers */
2015-02-10T05:06:45+00:00,646453945,642205326,1,Chamath237,"Ministry of Buddha Sasana, Religious and Cultural Affairs",/* List of Buddhasasana and Religious Affairs Ministers */
2015-02-10T05:05:59+00:00,646453890,646453850,1,Chamath237,"Ministry of Women, Child Affairs and Social Empowerment",
2015-02-10T05:05:33+00:00,646453850,643250739,1,Chamath237,"Ministry of Women, Child Affairs and Social Empowerment",/* List of ministers */
2015-02-10T05:04:47+00:00,646453797,642561993,1,Chamath237,"Ministry of Highways, Ports & Shipping",/* Officials */
2015-02-10T05:00:38+00:00,646453495,643511799,1,Chamath237,"Ministry of Social Empowerment, Welfare and Kandyan Heritage",/* List of Social Services Ministers */
2015-02-10T05:00:32+00:00,646453489,643546522,1,Chamath237,Ministry of Muslim Religious Affairs,/* List of Muslim Religious Affairs Ministers */
2015-02-10T04:59:28+00:00,646453408,643344009,1,Chamath237,Ministry of Water Supply (Sri Lanka),/* List of ministers */
2015-02-10T04:59:05+00:00,646453384,643486921,1,Chamath237,Ministry of Tourism and Lands,/* List of ministers */
2015-02-10T04:58:16+00:00,646453322,646453299,1,Chamath237,Ministry of Tourism (Sri Lanka),/* List of Tourism Ministers */
2015-02-10T04:57:55+00:00,646453299,643651714,1,Chamath237,Ministry of Tourism (Sri Lanka),/* List of Tourism Ministers */
2015-02-10T04:56:49+00:00,646453218,643342784,1,Chamath237,Ministry of Irrigation and Water Resources Management,/* List of ministers */
2015-02-10T04:51:52+00:00,646452829,644987200,1,Chamath237,Ministry of Transport and Highways,/* Ministers */
2015-02-10T04:50:08+00:00,646452679,646451487,1,Chamath237,Ministry of Environment (Sri Lanka),/* List of Mahaweli Development and Environment Ministers */
2015-02-10T04:47:47+00:00,646452486,646451620,1,Chamath237,Ministry of Economic Development (Sri Lanka),/* List of Economic Development Ministers */
2015-02-10T04:47:13+00:00,646452440,644987266,1,Chamath237,Ministry of Public Security (Sri Lanka),/* Ministers */
2015-02-10T04:45:00+00:00,646452254,646451864,1,Chamath237,Ministry of Foreign Employment Promotion and Welfare,/* List of ministers */
2015-02-10T04:44:28+00:00,646452206,643313215,1,Chamath237,Ministry of Industries (Sri Lanka),
2015-02-10T04:40:33+00:00,646451864,642241339,1,Chamath237,Ministry of Foreign Employment Promotion and Welfare,/* List of ministers */
2015-02-10T04:37:57+00:00,646451620,643312859,1,Chamath237,Ministry of Economic Development (Sri Lanka),
2015-02-10T04:36:15+00:00,646451487,639760438,1,Chamath237,Ministry of Environment (Sri Lanka),
2015-02-10T04:16:48+00:00,646449721,645791759,1,Chamath237,Ministry of Health (Sri Lanka),
2015-02-10T04:15:23+00:00,646449562,639765274,1,Chamath237,Ministry of Indigenous Medicine,[[WP:AES|←]]Redirected page to [[Ministry of Health and Indigenous Medicine]]
2015-02-10T04:12:54+00:00,646449295,646448276,1,Chamath237,Template:Ministries of Sri Lanka,
2015-02-10T04:09:58+00:00,646448983,637996056,1,Chamath237,Template:Sri Lankan health ministers,
2015-02-10T04:02:38+00:00,646448276,643538639,1,Chamath237,Template:Ministries of Sri Lanka,
2015-02-10T04:01:06+00:00,646448112,646447599,1,Chamath237,Minister of Foreign Affairs (Sri Lanka),
2015-02-10T03:59:32+00:00,646447982,645014047,1,Chamath237,Foreign Secretary (Sri Lanka),[[WP:AES|←]]Redirected page to [[Ministry of Foreign Affairs (Sri Lanka)#Permanent Secretaries]]
2015-02-10T03:57:54+00:00,646447842,593616629,1,Chamath237,Sri Lankan Foreign Minister,[[WP:AES|←]]Redirected page to [[Minister of External Affairs (Sri Lanka)]]
2015-02-10T03:57:20+00:00,646447793,564650237,1,Chamath237,"Ministry of Foreign Affairs, Sri Lanka",[[WP:AES|←]]Redirected page to [[Ministry of Foreign Affairs (Sri Lanka)]]
2015-02-10T03:56:57+00:00,646447762,564650256,1,Chamath237,"Ministry of Foreign Affairs, Sri lanka",[[WP:AES|←]]Redirected page to [[Ministry of Foreign Affairs (Sri Lanka)]]
2015-02-10T03:56:42+00:00,646447739,564650268,1,Chamath237,Ministry of Foreign Affairs of Sri Lanka,[[WP:AES|←]]Redirected page to [[Ministry of Foreign Affairs (Sri Lanka)]]
2015-02-10T03:55:42+00:00,646447649,593613094,1,Chamath237,Minister of Foreign Affairs of Sri Lanka,[[WP:AES|←]]Redirected page to [[Minister of External Affairs (Sri Lanka)]]
2015-02-10T03:55:02+00:00,646447599,645491738,1,Chamath237,Minister of Foreign Affairs (Sri Lanka),
2015-02-10T03:52:07+00:00,646447353,593613117,1,Chamath237,Minister of External Affairs of Sri Lanka,[[WP:AES|←]]Redirected page to [[Minister of External Affairs (Sri Lanka)]]
2015-02-10T03:51:16+00:00,646447272,646446917,1,Chamath237,Ministry of Foreign Affairs (Sri Lanka),
2015-02-10T03:47:31+00:00,646446920,0,1,Chamath237,Talk:Ministry of External Affairs (Sri Lanka),Chamath237 moved page [[Talk:Ministry of External Affairs (Sri Lanka)]] to [[Talk:Ministry of Foreign Affairs (Sri Lanka)]] over redirect
2015-02-10T03:47:30+00:00,646446919,564648346,1,Chamath237,Talk:Ministry of Foreign Affairs (Sri Lanka),Chamath237 moved page [[Talk:Ministry of External Affairs (Sri Lanka)]] to [[Talk:Ministry of Foreign Affairs (Sri Lanka)]] over redirect
2015-02-10T03:47:30+00:00,646446918,0,1,Chamath237,Ministry of External Affairs (Sri Lanka),Chamath237 moved page [[Ministry of External Affairs (Sri Lanka)]] to [[Ministry of Foreign Affairs (Sri Lanka)]] over redirect
2015-02-10T03:47:29+00:00,646446917,645014158,1,Chamath237,Ministry of Foreign Affairs (Sri Lanka),Chamath237 moved page [[Ministry of External Affairs (Sri Lanka)]] to [[Ministry of Foreign Affairs (Sri Lanka)]] over redirect
2015-01-19T12:55:44+00:00,643198523,642558197,1,Chamath237,List of Thai Airways International destinations,
2015-01-19T12:54:32+00:00,643198442,642558255,1,Chamath237,Suvarnabhumi Airport,/* Passenger */
2015-01-18T17:31:04+00:00,643072720,642532804,1,Chamath237,List of mobile network operators in Asia and Oceania,/* Sri Lanka */
2015-01-18T17:16:20+00:00,643070722,642797525,1,Chamath237,List of banks in Asia,
2015-01-16T09:25:46+00:00,642739108,642351528,1,Chamath237,Bandaranaike International Airport,/* Airlines and destinations */
2015-01-16T09:16:43+00:00,642737372,642737004,1,Chamath237,"Ministry of Women, Child Affairs and Social Empowerment",
2015-01-16T09:14:53+00:00,642737004,642735391,1,Chamath237,"Ministry of Women, Child Affairs and Social Empowerment",
2015-01-16T09:10:49+00:00,642736299,642698190,1,Chamath237,Chandrani Bandara Jayasinghe,
2015-01-16T09:10:07+00:00,642736166,642213378,1,Chamath237,Ministry of Women’s Affairs (Sri Lanka),[[WP:AES|←]]Redirected page to [[Ministry of Women's Affairs (Sri Lanka)]]
2015-01-16T09:09:57+00:00,642736130,642204699,1,Chamath237,Minister of Child Development and Women’s Empowerment,[[WP:AES|←]]Redirected page to [[Ministry of Women's Affairs (Sri Lanka)#List of ministers]]
2015-01-16T09:09:36+00:00,642736064,642203950,1,Chamath237,Minister of Women’s Affairs (Sri Lanka),[[WP:AES|←]]Redirected page to [[Ministry of Women's Affairs (Sri Lanka)#List of ministers]]
2015-01-16T09:09:13+00:00,642735991,627152170,1,Chamath237,Minister of Child Development and Women's Affairs,[[WP:AES|←]]Redirected page to [[Ministry of Women's Affairs (Sri Lanka)#List of ministers]]
2015-01-16T09:08:37+00:00,642735865,625051407,1,Chamath237,Minister of Child Development and Women's Affairs (Sri Lanka),[[WP:AES|←]]Redirected page to [[Ministry of Women's Affairs (Sri Lanka)]]
2015-01-16T09:08:28+00:00,642735836,566569100,1,Chamath237,MCDWA,[[WP:AES|←]]Redirected page to [[Ministry of Women's Affairs (Sri Lanka)]]
2015-01-16T09:08:08+00:00,642735773,565866413,1,Chamath237,Ministry of Child Development and Women's Affairs (Sri Lanka),[[WP:AES|←]]Redirected page to [[Ministry of Women's Affairs (Sri Lanka)]]
2015-01-16T09:07:56+00:00,642735729,565866511,1,Chamath237,Ministry of Child Development & Women's Affairs,[[WP:AES|←]]Redirected page to [[Ministry of Women's Affairs (Sri Lanka)]]
2015-01-16T09:07:33+00:00,642735639,565866554,1,Chamath237,Ministry of Child Development & Women's Affairs (Sri Lanka),[[WP:AES|←]]Redirected page to [[Ministry of Women's Affairs (Sri Lanka)]]
2015-01-16T09:06:24+00:00,642735400,0,1,Chamath237,Talk:Ministry of Child Development and Women's Affairs,Chamath237 moved page [[Talk:Ministry of Child Development and Women's Affairs]] to [[Talk:Ministry of Women's Affairs (Sri Lanka)]]
2015-01-16T09:06:24+00:00,642735397,565866415,1,Chamath237,"Talk:Ministry of Women, Child Affairs and Social Empowerment",Chamath237 moved page [[Talk:Ministry of Child Development and Women's Affairs]] to [[Talk:Ministry of Women's Affairs (Sri Lanka)]]
2015-01-16T09:06:23+00:00,642735392,0,1,Chamath237,Ministry of Child Development and Women's Affairs,Chamath237 moved page [[Ministry of Child Development and Women's Affairs]] to [[Ministry of Women's Affairs (Sri Lanka)]]
2015-01-16T09:06:23+00:00,642735391,642734968,1,Chamath237,"Ministry of Women, Child Affairs and Social Empowerment",Chamath237 moved page [[Ministry of Child Development and Women's Affairs]] to [[Ministry of Women's Affairs (Sri Lanka)]]
2015-01-16T09:04:20+00:00,642734968,642734769,1,Chamath237,"Ministry of Women, Child Affairs and Social Empowerment",
2015-01-16T09:03:26+00:00,642734769,642734562,1,Chamath237,"Ministry of Women, Child Affairs and Social Empowerment",/* External links */
2015-01-16T09:02:29+00:00,642734562,642734212,1,Chamath237,"Ministry of Women, Child Affairs and Social Empowerment",/* List of ministers */
2015-01-16T09:00:55+00:00,642734212,642697482,1,Chamath237,"Ministry of Women, Child Affairs and Social Empowerment",
2015-01-16T08:56:08+00:00,642733417,642480164,1,Chamath237,Template:Sri Lankan defence ministers,
2015-01-16T08:55:03+00:00,642733240,642386285,1,Chamath237,Template:Ministries of Sri Lanka,
2015-01-16T08:49:45+00:00,642732380,642732216,1,Chamath237,User talk:AntanO,/* File:Wahlbezirkskarte Praesidentschaft Sri Lanka 2015.svg */
2015-01-16T08:48:47+00:00,642732216,641743246,1,Chamath237,User talk:AntanO,/* File:Wahlbezirkskarte Praesidentschaft Sri Lanka 2015.svg */ new section
2015-01-16T08:42:04+00:00,642731322,642720348,1,Chamath237,2015 Sri Lankan presidential election,
2015-01-15T05:03:16+00:00,642561079,642238771,1,Chamath237,Minister of Defence (Sri Lanka),/* List of Defence Ministers */
2015-01-15T04:57:19+00:00,642560390,593567127,1,Chamath237,Template:Sri Lankan security forces,
2015-01-15T04:55:01+00:00,642560094,642559279,1,Chamath237,Ministry of Defence (Sri Lanka),/* Senior officials */
2015-01-15T04:46:36+00:00,642559279,642558706,1,Chamath237,Ministry of Defence (Sri Lanka),
2015-01-15T04:42:09+00:00,642558924,587218870,1,Chamath237,Ministry of Defence & Urban Development,[[WP:AES|←]]Redirected page to [[Ministry of Defence (Sri Lanka)]]
2015-01-15T04:41:57+00:00,642558913,593563224,1,Chamath237,Minister of Defence and Urban Development,[[WP:AES|←]]Redirected page to [[Ministry of Defence (Sri Lanka)]]
2015-01-15T04:41:43+00:00,642558880,587218806,1,Chamath237,"Ministry of Defence, Public Security, Law and Order",[[WP:AES|←]]Redirected page to [[Ministry of Defence (Sri Lanka)]]
2015-01-15T04:41:27+00:00,642558854,587218775,1,Chamath237,Ministry of Defense (Sri Lanka),[[WP:AES|←]]Redirected page to [[Ministry of Defence (Sri Lanka)]]
2015-01-15T04:41:10+00:00,642558836,587218745,1,Chamath237,"Ministry of Defence, Public Security, Law and Order (Sri Lanka)",[[WP:AES|←]]Redirected page to [[Ministry of Defence (Sri Lanka)]]
