timestamp,revid,parentid,sock,user,page,message
2022-04-25T08:19:49+00:00,1084571050,1084569168,1,Pkraja1234,Economy of Andhra Pradesh,/* IT/ITeS-software industry */ [[Maple (software)]]
2022-04-25T08:16:26+00:00,1084570796,1084568716,1,Pkraja1234,Pulsus Group,/* History */ typo
2022-04-25T07:56:49+00:00,1084569168,1084557655,1,Pkraja1234,Economy of Andhra Pradesh,/* IT/ITeS-software industry */ It companies list Vizag
2022-04-25T07:51:26+00:00,1084568716,1083871025,1,Pkraja1234,Pulsus Group,/* History */todays update of group company
2022-04-25T05:37:32+00:00,1084557655,1084557228,1,Pkraja1234,Economy of Andhra Pradesh,/* Electronics */ Electronics policy envisages
2022-04-25T05:32:58+00:00,1084557228,1084072539,1,Pkraja1234,Economy of Andhra Pradesh,/* Electronics */ cluster
2022-04-22T11:57:52+00:00,1084074161,1084073865,1,Pkraja1234,List of Indian IT companies,file
2022-04-22T11:55:01+00:00,1084073865,1078203467,1,Pkraja1234,List of Indian IT companies,/* Other companies */ [[Pulsus Group]]
2022-04-22T11:43:01+00:00,1084072539,1084072426,1,Pkraja1234,Economy of Andhra Pradesh,/* Electronics */
2022-04-22T11:41:55+00:00,1084072426,1084072218,1,Pkraja1234,Economy of Andhra Pradesh,/* IT/ITeS-software industry */
2022-04-22T11:40:07+00:00,1084072218,1084071545,1,Pkraja1234,Economy of Andhra Pradesh,/* IT/ITeS-software industry */ Patra
2022-04-22T11:38:29+00:00,1084072060,0,1,Pkraja1234,User:Pkraja1234,Hi
2022-04-22T11:37:46+00:00,1084071975,1084065709,1,Pkraja1234,User talk:Mako001,/* Economy of Andhra Pradesh */ new section
2022-04-22T11:33:52+00:00,1084071545,1084069128,1,Pkraja1234,Economy of Andhra Pradesh,removed marketing words
2022-04-22T11:09:05+00:00,1084069004,1084068247,1,Pkraja1234,Economy of Andhra Pradesh,/* Electronics */
2022-04-22T11:02:47+00:00,1084068247,1084068207,1,Pkraja1234,Economy of Andhra Pradesh,/* Electronics */
2022-04-22T11:02:23+00:00,1084068207,1084067983,1,Pkraja1234,Economy of Andhra Pradesh,/* Industries */
2022-04-22T11:00:30+00:00,1084067983,1084067651,1,Pkraja1234,Economy of Andhra Pradesh,/* Electronics */ hub
2022-04-22T10:57:41+00:00,1084067651,1082519240,1,Pkraja1234,Economy of Andhra Pradesh,/* Industries */ Electronics is the key at AP
2023-07-02T06:02:27+00:00,1162975042,1162932082,1,Aivi2030,User talk:Aivi2030,unblock
2023-07-01T14:22:13+00:00,1162859718,1160632158,1,Aivi2030,Autistic Self Advocacy Network,/* See also */ link
2023-07-01T14:21:17+00:00,1162859598,1129415626,1,Aivi2030,Autism Network International,/* See also */ link
2023-07-01T13:22:33+00:00,1162852144,1162851241,1,Aivi2030,International Society of Addiction Medicine,updated
2023-07-01T13:14:20+00:00,1162851241,1156284288,1,Aivi2030,International Society of Addiction Medicine,society
2023-07-01T07:48:40+00:00,1162813847,1162209031,1,Aivi2030,Brown recluse spider,"As part of the haplogynae, brown recluses do not balloon, which limits their ability to widely disperse geographically."
2023-07-01T07:43:17+00:00,1162813159,1161814876,1,Aivi2030,Brown rat,"By the early to the middle part of the 19th century,"
2023-07-01T07:41:48+00:00,1162813035,1162513756,1,Aivi2030,Brown dwarf,Spanish astrophysicists Rafael Rebolo (head of the team)
2023-07-01T07:38:52+00:00,1162812626,1161635520,1,Aivi2030,Brownie (folklore),Bwbach's activities makes it much more closely resemble the Irish Phooka.
2023-07-01T07:36:06+00:00,1162812246,1162663447,1,Aivi2030,Brown,"By the statute of 1363, poor English people were required to wear russets."
2023-07-01T07:32:31+00:00,1162811849,1162523410,1,Aivi2030,Violetta (TV series),"same roof when Germán and Priscilla, the mother of Ludmila,"
2023-07-01T07:29:12+00:00,1162811556,1151609500,1,Aivi2030,Violet Evergarden,progress and that it will be a completely new work for the anime
2023-07-01T07:26:04+00:00,1162811338,1158534982,1,Aivi2030,Viola (plant),Solitary flowers end with long stalks with a pair of bracteoles.
2023-07-01T07:23:53+00:00,1162811189,1161874306,1,Aivi2030,Violet (color),"in turn from the Latin viola, the name of the violet flower."
2023-07-01T07:22:04+00:00,1162811063,1161570354,1,Aivi2030,"Orange County, Florida","Perry of Ocoee, whose body was found on November 3, 1920"
2023-07-01T07:20:15+00:00,1162810941,1160057359,1,Aivi2030,Orange Revolution,campaign publicly called for a protest on the dawn
2023-07-01T07:17:02+00:00,1162810687,1161466506,1,Aivi2030,Orange (colour),Orange carnelians were significantly used during the Indus Valley civilization
2023-07-01T07:14:34+00:00,1162810527,1162649933,1,Aivi2030,Orange Order,The sectarian attacks on them were so severe that the Grand Masters of the Orange
2023-07-01T07:11:57+00:00,1162810352,1160056766,1,Aivi2030,Orange Is the New Black,"Most of these inmates are interrogated, and several of them are charged and sentenced"
2023-07-01T07:09:45+00:00,1162810197,1162301648,1,Aivi2030,Orange S.A.,"September 1995, Michel Bon was appointed to run the France Télécom"
2023-07-01T06:21:23+00:00,1162803024,1159195688,1,Aivi2030,Lemon shark,Lemon sharks have roughly equal first and second dorsal fins where Bull sharks have uneven sizes.
2023-07-01T06:17:48+00:00,1162802594,1161426571,1,Aivi2030,Lemon Demon,"Demon's most-played song, the first to surpass"
2023-07-01T06:13:10+00:00,1162802037,1158836519,1,Aivi2030,Lemon balm,The essential oil is used as a perfume ingredient. It is used in toothpaste.
2023-07-01T06:10:52+00:00,1162801733,1160431277,1,Aivi2030,Lemonade,dispensed cups of soft drinks to Parisians.
2023-07-01T05:26:08+00:00,1162795032,1159124041,1,Aivi2030,Potato bread,"similar variations in ingredients, cooking methods, and other variables"
2023-07-01T05:24:55+00:00,1162794903,1159109683,1,Aivi2030,Potato Sack,new levels included braille code that referred to the latitude and
2023-07-01T05:21:57+00:00,1162794581,1161137766,1,Aivi2030,Potoooooooo,"second in two Newmarket races for 4-year-old colts,"
2023-07-01T05:14:21+00:00,1162793688,1159108556,1,Aivi2030,Potato cooking,"suitable for consumption, it is enough to put it back in the water"
2023-07-01T05:11:58+00:00,1162793399,1162208519,1,Aivi2030,Potato pancake,The British also brought potato pancakes to former colonies
2023-07-01T05:09:28+00:00,1162793147,1160951554,1,Aivi2030,Potato cannon,hundred pounds force per square inch
2023-05-15T06:29:36+00:00,1154874894,1154507844,1,Aravind_Pulsus,The Settlers (band),recognizable
2022-03-04T08:03:46+00:00,1075166143,1063490005,1,Aravind_Pulsus,Allied Academies,limited liability partnership
2023-05-31T05:12:18+00:00,1157817167,1147678163,1,Justice2022,Deerhoof,recorded on a 4-track tape
2023-05-31T05:10:17+00:00,1157816983,1155666535,1,Justice2022,Deer in mythology,"the Otherworld, or the fairy realm"
2023-05-31T05:08:22+00:00,1157816818,1157779890,1,Justice2022,"Deerfield, Illinois",Deerfield is a village in Lake
2023-05-31T05:06:51+00:00,1157816689,1157331991,1,Justice2022,Deerfield Academy,campus is decorated with spirited banners
2023-05-31T05:03:09+00:00,1157816412,1156601640,1,Justice2022,"Deer Lodge, Montana",Warm Springs and the former state tuberculosis
2023-05-31T05:01:35+00:00,1157816298,1154253721,1,Justice2022,"Deerfield Beach, Florida",It is the principal city of the Miami metropolitan area
2023-05-31T05:00:04+00:00,1157816120,1136964039,1,Justice2022,Depression (geology),beneath either the oceanic crust
2023-05-31T04:57:15+00:00,1157815760,1151954830,1,Justice2022,Depression Quest,foster a greater understanding of depression
2023-05-31T04:55:37+00:00,1157815572,1136375780,1,Justice2022,Depression and culture,result in feelings of lost individual
2023-05-31T04:54:06+00:00,1157815404,1151304259,1,Justice2022,Depression of 1920–1921,Gordon estimates 13% deflation
2023-05-30T04:47:47+00:00,1157663067,1150949816,1,Justice2022,Depression Cherry,between the autumn of 2013 and 2014
2023-05-30T04:44:28+00:00,1157662819,1134839657,1,Justice2022,Depression and immune function,with an increased risk of depression
2023-05-30T04:42:28+00:00,1157662687,1147309103,1,Justice2022,Depression in childhood and adolescence,third-wave CBT and interpersonal therapy
2023-05-30T04:35:08+00:00,1157662191,1156896516,1,Justice2022,Economic depression,where the slowdown of the economy follows
2023-05-30T04:32:26+00:00,1157662007,1145167562,1,Justice2022,Economics of English towns and trade in the Middle Ages,network of well-established towns
2023-05-30T04:30:44+00:00,1157661894,1156055487,1,Justice2022,Economics of fascism,important role in state intervention
2023-05-30T04:28:42+00:00,1157661757,1150385338,1,Justice2022,Economics of bitcoin,Pooler of the Eleventh Judicial Circuit Court of Florida
2023-05-30T04:22:49+00:00,1157661346,1151832981,1,Justice2022,Economics of Christmas,season starts from mid-November
2023-05-30T04:20:27+00:00,1157661199,1157328262,1,Justice2022,Economics of climate change mitigation,The economics of climate change mitigation is part of the economics
2023-05-30T04:18:35+00:00,1157661089,1156750784,1,Justice2022,Economic analysis of climate change,about the physical damages
2023-05-29T09:22:07+00:00,1157541605,1151319521,1,Justice2022,Economics of nuclear power plants,with the renewable generation when the capital cost
2023-05-29T09:18:52+00:00,1157541206,1151548108,1,Justice2022,Economies of scale,having to ship products uneconomic distances
2023-05-29T09:16:15+00:00,1157540880,1151172916,1,Justice2022,Signalling (economics),low-ability employees to obtain
2023-05-29T09:13:54+00:00,1157540691,1156486654,1,Justice2022,Signal (IPC),process during the execution of the signal
2023-05-29T09:11:55+00:00,1157540482,1156687851,1,Justice2022,Signal (South Korean TV series),from audiences and critics alike
2023-05-29T09:10:16+00:00,1157540283,1155828787,1,Justice2022,Signaling of the New York City Subway,custom-built for the New York City Transit Authority
2023-05-29T09:09:13+00:00,1157540197,1157493239,1,Justice2022,Signalling theory,whether the selection of signals
2023-05-29T09:06:32+00:00,1157539962,1153685995,1,Justice2022,Signal-to-noise ratio,"ratio of signal power to noise power,"
2023-05-29T08:51:04+00:00,1157538066,1154130940,1,Justice2022,Signal transduction,This leads to constitutive activation
2023-05-29T08:47:47+00:00,1157537765,1148725433,1,Justice2022,Signals intelligence,The use of radio-receiving equipment
2023-05-27T07:18:34+00:00,1157231864,1156083588,1,Justice2022,Signal (messaging app),telephone numbers as an identifier for users
2023-05-27T07:17:10+00:00,1157231737,1131786861,1,Justice2022,Signal,as examples of signals
2023-05-27T07:15:10+00:00,1157231584,1149025203,1,Justice2022,Traffic flow,distance covered per unit of time
2023-05-27T07:13:09+00:00,1157231417,1156287078,1,Justice2022,Traffic message channel,advice with a single 11-bit basic message code
2023-05-27T07:09:03+00:00,1157231035,1156095154,1,Justice2022,Traffic collision avoidance system,may present a threat to MAC
2023-05-27T07:07:36+00:00,1157230572,1151442060,1,Justice2022,Trafficking of children,categorized into four types of action
2023-05-27T07:06:31+00:00,1157230237,1153644543,1,Justice2022,Traffic enforcement camera,"also a red light camera, speed camera"
2023-05-27T07:05:09+00:00,1157229952,1157204693,1,Justice2022,Traffic (2000 film),taking on the title of drug czar.
2023-05-27T07:03:19+00:00,1157229796,1156315017,1,Justice2022,Traffic congestion,"otherwise, the normal flow might"
2023-05-27T07:01:40+00:00,1157229692,1156974654,1,Justice2022,Traffic light,control the flow of traffic
2023-05-26T05:24:44+00:00,1157084394,1156640240,1,Justice2022,Traffic collision,to the combined roadway
2023-05-26T05:22:24+00:00,1157084281,1156604552,1,Justice2022,Traffic,between vehicles and pedestrians
2023-05-26T05:20:42+00:00,1157084190,1154115012,1,Justice2022,Human trafficking,transnational criminal organizations
2023-05-26T05:18:32+00:00,1157084056,1154686334,1,Justice2022,Human sexuality,"women, and acts by triggering"
2023-05-26T05:15:54+00:00,1157083905,1156664796,1,Justice2022,Human evolution,from the uppermost Oligocene
2023-05-26T05:07:20+00:00,1157083282,1155569842,1,Justice2022,Human body,"physiologists, anatomists, and artists to assist them"
2023-05-26T05:02:27+00:00,1157082939,1153897611,1,Justice2022,Human papillomavirus infection,infection is caused by the human
2023-05-26T04:37:10+00:00,1157081106,1154829013,1,Justice2022,Temple Owls football,Temple single-game record
2023-05-26T04:35:35+00:00,1157080972,1156127197,1,Justice2022,Garni Temple,excavations at the site in the early
2023-05-26T04:34:17+00:00,1157080864,1139845809,1,Justice2022,Temple of Set,Petersen describes the Temple of Set
2023-05-25T12:14:51+00:00,1156953183,1156953147,1,Justice2022,User talk:Justice2022,/* Speedy deletion nomination of C20 of G20 */ Reply
2023-05-25T12:12:01+00:00,1156952827,1156709867,1,Justice2022,List of G20 summits,/* C20 summits */ link
2023-05-25T05:04:52+00:00,1156901452,1152561904,1,Justice2022,Temple of Artemis,blackened grape wood
2023-05-25T05:02:50+00:00,1156901140,1155552398,1,Justice2022,Temple menorah,"tomb walls, synagogue floors,"
2023-05-25T05:01:37+00:00,1156900923,1151470489,1,Justice2022,Temple University,faculty had also planned a no-confidence vote
2023-05-25T04:59:11+00:00,1156900490,1155556495,1,Justice2022,Temple in Jerusalem,both the First Temple and the Second Temple
2023-05-25T04:55:50+00:00,1156899949,1155230186,1,Justice2022,Temple Mount,15th-century Islamic scholar
2023-05-25T04:50:35+00:00,1156899174,1153403121,1,Justice2022,Temple,evidence of the use of sacred ground
2023-05-25T04:48:05+00:00,1156898807,1153811893,1,Justice2022,Architecture of Tamil Nadu,"complex architecture, a variety of sculptures,"
2023-05-25T04:45:09+00:00,1156898421,1140334744,1,Justice2022,Architecture of London,limited large-scale state planning
2023-05-25T04:43:53+00:00,1156898245,1149982598,1,Justice2022,Architecture of Russia,Findings from twentieth-century excavations
2023-05-25T04:41:31+00:00,1156897952,1126677053,1,Justice2022,Architecture of Mesopotamia,The advantages of plano-convex bricks
2023-05-24T05:27:42+00:00,1156702266,1155657840,1,Justice2022,Architecture of Africa,the walls of rock shelters
2023-05-24T05:26:15+00:00,1156702102,1155827611,1,Justice2022,Architecture of the Philippines,considered focal properties
2023-05-24T05:25:07+00:00,1156701977,1146359358,1,Justice2022,Architecture of cathedrals and great churches,bishop as an administrator
2023-05-24T05:21:02+00:00,1156701521,1155102908,1,Justice2022,Architecture in the United States,Spanish Colonial Revival styles
2023-05-24T05:15:23+00:00,1156700819,1154306617,1,Justice2022,Architecture of India,following a sea storm
2023-05-24T05:02:57+00:00,1156699247,1143021703,1,Justice2022,Coping (architecture),Coping may be made of stone
2023-05-24T05:01:38+00:00,1156699057,1129245838,1,Justice2022,Coping (joinery),The rails in the frame and panel
2023-05-24T04:59:56+00:00,1156698867,1090518995,1,Justice2022,Coping Mechanisms (Si Schroeder album),Lavender mist
2023-05-24T04:58:54+00:00,1156698719,1059739770,1,Justice2022,Coping planning,well-being that comprises healthy
2023-05-24T04:57:54+00:00,1156698602,1143494847,1,Justice2022,Coping Cat,See the publishers
2023-05-23T17:14:26+00:00,1156595884,1156595608,1,Justice2022,List of G20 summits,/* G20 Global Tech Summit Pre-Conferences held */
2023-05-23T17:12:48+00:00,1156595608,1154898810,1,Justice2022,List of G20 summits,/* Pre-Conferences held */
2023-05-23T05:19:38+00:00,1156499522,1145618085,1,Justice2022,Coping saw,combination with the so-called
2023-05-23T05:17:44+00:00,1156499336,1150812558,1,Justice2022,Coping Mechanism (album),"the ""Curious/Furious"" and it is visual on September"
2023-05-23T05:13:16+00:00,1156498813,1155568502,1,Justice2022,Coping,could be individuals purchasing tickets
2023-05-23T05:10:11+00:00,1156498471,1154909016,1,Justice2022,Emotional approach coping,the emotional approach to coping
2023-05-23T05:07:25+00:00,1156498122,1151884666,1,Justice2022,Emotional contagion,"feel happier, and frowning makes one feel worse"
2023-05-23T05:04:37+00:00,1156497778,1100422034,1,Justice2022,Emotional and behavioral disorders,In the early to mid-1800s
2023-05-23T05:03:00+00:00,1156497603,1155305698,1,Justice2022,Emotional dysregulation,at their place of employment
2023-05-23T05:01:19+00:00,1156497429,1154328210,1,Justice2022,Emotional labor,"decision-making in terms of the expression of emotion,"
2023-05-23T04:59:54+00:00,1156497268,1156415947,1,Justice2022,Emotional intelligence,Emotional Intelligence and Emancipation
2023-05-23T04:56:14+00:00,1156496777,1154839670,1,Justice2022,Emotional support animal,the COVID-19 pandemic
2023-05-20T16:37:54+00:00,1155977558,1155974049,1,Justice2022,Gedela Srinubabu,"Created by translating the page ""[[:te:Special:Redirect/revision/3903969|గేదెల శ్రీనుబాబు]]"""
2023-05-20T15:37:49+00:00,1155967813,0,1,Justice2022,Gedela Srinubabu,"Created by translating the page ""[[:te:Special:Redirect/revision/3903969|గేదెల శ్రీనుబాబు]]"""
2023-05-20T06:30:01+00:00,1155894641,1136215407,1,Justice2022,Emotionally focused therapy,emotional experiences moment-to-moment
2023-05-20T06:27:57+00:00,1155894418,1147263703,1,Justice2022,Emotional self-regulation,some form of emotional regulation
2023-05-20T06:26:29+00:00,1155894280,1152140332,1,Justice2022,School counselor,The Bahamas mandates school counseling
2023-05-20T06:25:04+00:00,1155894135,1155188804,1,Justice2022,School discipline,standards of school uniforms
2023-05-20T06:23:47+00:00,1155894006,1154760926,1,Justice2022,School bus,"Today, its successor company Navistar"
2023-05-20T06:21:59+00:00,1155893813,1155084380,1,Justice2022,School of Rock,Jones as a drummer
2023-05-20T06:18:49+00:00,1155893353,1155329946,1,Justice2022,School bullying,detail intensive school bullying
2023-05-20T06:17:47+00:00,1155893220,1155831961,1,Justice2022,School corporal punishment,student with an open hand
2023-05-20T06:15:52+00:00,1155892953,1155847851,1,Justice2022,Science education,separate pre-professional training
2023-05-20T06:14:29+00:00,1155892762,1152829740,1,Justice2022,Science and technology in the Philippines,describe scientific and technological progress
2023-05-20T06:13:43+00:00,1155892669,1147954979,1,Justice2022,Science and technology in Israel,complimented the country
2023-05-20T06:12:11+00:00,1155892464,1147735570,1,Justice2022,Science and technology studies,at the Massachusetts Institute of Technology
2023-05-20T06:11:09+00:00,1155892339,1151865728,1,Justice2022,Science fiction film,first in feature-length in the genre
2023-05-20T06:10:13+00:00,1155892233,1155544411,1,Justice2022,"Science, technology, engineering, and mathematics",regard to admitting foreign students
2023-05-20T06:05:16+00:00,1155891411,1154984273,1,Justice2022,Science fiction,Science fiction is what we point
2023-05-20T05:23:51+00:00,1155885625,1130272320,1,Justice2022,Engineering notation,engineering notation in the form of range
2023-05-20T05:22:38+00:00,1155885481,1136424187,1,Justice2022,Engineering controls,prevent exposure to hazardous
2023-05-20T05:20:18+00:00,1155885213,1122035648,1,Justice2022,Engineering fit,both group fit into three categories
2023-05-20T05:19:34+00:00,1155885133,1155302748,1,Justice2022,Engineering Societies' Building,and the American Institute of
2023-05-20T05:18:12+00:00,1155884977,1149008868,1,Justice2022,Engineering ethics,field of a system of moral principles
2023-05-20T05:17:30+00:00,1155884892,1148195243,1,Justice2022,Engineering management,engineering-driven enterprises
2023-05-20T05:15:54+00:00,1155884696,1148194941,1,Justice2022,Engineering drawing,Engineering drawings specify the requirements
2023-05-20T05:14:21+00:00,1155884508,1154050420,1,Justice2022,Engineering education,minimum of four years
2023-05-20T05:11:34+00:00,1155884159,1154797830,1,Justice2022,Diesel exhaust fluid,level in the exhaust gas
2023-05-20T05:10:11+00:00,1155883964,1148070524,1,Justice2022,Diesel particulate filter,particles during the combustion
2023-05-20T05:08:31+00:00,1155883780,1146869446,1,Justice2022,Dieselpunk,The term has since been applied
2023-05-20T05:07:12+00:00,1155883600,1143383706,1,Justice2022,Diesel exhaust,fuel combustion in the air
2023-05-20T05:05:48+00:00,1155883438,1152573348,1,Justice2022,Diesel multiple unit,diesel-mechanical multiple units
2023-05-20T05:05:00+00:00,1155883328,1154138540,1,Justice2022,Diesel locomotive,while low-power gasoline engines
2023-05-20T05:03:42+00:00,1155883147,1152594503,1,Justice2022,Diesel fuel,"gasoline, and fuel oil"
2023-05-20T05:01:55+00:00,1155882909,1155728490,1,Justice2022,Aircraft diesel engine,but were never widely adopted
2023-05-20T05:01:09+00:00,1155882803,1150194635,1,Justice2022,Aircraft design process,high-level configuration tradeoffs
2023-05-20T05:00:03+00:00,1155882649,1152062473,1,Justice2022,Aircraft flight control system,when moved backward or forwards
2023-05-20T04:58:47+00:00,1155882477,1151699731,1,Justice2022,Aircraft of the Battle of Britain,"fighter aircraft, and the Germans"
2023-05-20T04:57:44+00:00,1155882360,1154451289,1,Justice2022,Aircraft pilot,the automated and autonomous flight
2023-05-20T04:55:42+00:00,1155882093,1155749718,1,Justice2022,Aircraft in fiction,Made with the cooperation of the United States
2023-05-20T04:54:18+00:00,1155881918,1155177509,1,Justice2022,Aircraft hijacking,entry into the cockpit
2023-05-20T04:53:19+00:00,1155881776,1142985078,1,Justice2022,Aircraft engine,rocket-powered and in recent years
2023-05-20T04:52:12+00:00,1155881635,1155592444,1,Justice2022,Aircraft carrier,significantly increases the time
2023-05-20T04:51:12+00:00,1155881500,1154442301,1,Justice2022,Aircraft,from 1945 to the present day.
2023-05-20T04:49:12+00:00,1155881267,1144338949,1,Justice2022,Trainer aircraft,advantage that the pilot
2023-05-20T04:47:34+00:00,1155881050,1152173918,1,Justice2022,Train horn,electric-powered trains
2023-05-20T04:46:32+00:00,1155880940,1154323473,1,Justice2022,Train operating company,recent years a number of services
2023-05-20T04:45:10+00:00,1155880799,1155827460,1,Justice2022,Training Day,"premiered on February 2, 2017,"
2023-05-20T04:43:47+00:00,1155880661,1154910267,1,Justice2022,Train to Busan,American-produced adaptation
2023-05-20T04:41:51+00:00,1155880417,1154657817,1,Justice2022,Track gauge,the selection of the track gauge
2023-05-20T04:40:14+00:00,1155880170,1154706818,1,Justice2022,Train (band),American pop-rock band
2023-05-20T04:39:06+00:00,1155880029,1154845274,1,Justice2022,Train station,where the railway station
2023-05-20T04:37:48+00:00,1155879847,1154292967,1,Justice2022,Train,another 21st-century development
2023-05-20T04:36:02+00:00,1155879616,1072390241,1,Justice2022,"Railways Act, 1989","Railways Act, of 1989"
2023-05-20T04:33:03+00:00,1155879235,1153807130,1,Justice2022,Railways on the Isle of Wight,between 1862 and 1901 and modernized
2023-05-20T04:31:48+00:00,1155879087,1142628133,1,Justice2022,Railways in Guyana,Demerara-Essequibo Railway
2023-05-20T04:30:45+00:00,1155878945,1083827239,1,Justice2022,Railways of the Slovak Republic,The office of the Management Board
2023-05-20T04:29:36+00:00,1155878808,1114170503,1,Justice2022,Railways in Buckinghamshire,"power in addition, as products"
2023-05-20T04:28:34+00:00,1155878696,1124353833,1,Justice2022,Railways in Northallerton,"cubic yards (193,158 m3) of the earth"
2023-05-20T04:26:28+00:00,1155878428,1139068483,1,Justice2022,Railways in Adelaide,the operation of the network
2023-05-20T04:24:11+00:00,1155878127,1152002262,1,Justice2022,Railway platform height,large gaps between platforms and trains
2023-05-20T04:23:10+00:00,1155878004,1140013650,1,Justice2022,Railway electrification in Great Britain,over the coming years
2023-05-20T04:22:23+00:00,1155877888,1154359674,1,Justice2022,Railways in Sydney,Central Station is the major terminus
2023-05-20T04:21:31+00:00,1155877782,1152773075,1,Justice2022,Railway gun,"number of outriggers, stabilizers"
2023-05-20T04:19:46+00:00,1155877527,1155722878,1,Justice2022,Railways in Melbourne,were taken over by the Government.
2023-05-20T04:17:50+00:00,1155877252,1155409109,1,Justice2022,Railway signalling,specific to single-track railways
2023-05-20T04:16:17+00:00,1155877037,1152131481,1,Justice2022,Railway coupling,practice but were made more regularly
2023-05-20T04:14:35+00:00,1155876788,1152116921,1,Justice2022,Railway electrification,reliable than diesel
2023-05-20T04:13:11+00:00,1155876602,1154734372,1,Justice2022,Railway track,primitive curved tracks
2023-05-20T04:11:59+00:00,1155876469,1144700139,1,Justice2022,Petroleum politics,"measurement of an index,"
2023-05-20T04:10:32+00:00,1155876307,1147539726,1,Justice2022,Petroleum Warfare Department,have the plan to prevent their stocks
2023-05-19T13:12:33+00:00,1155732618,1153948072,1,Justice2022,Petroleum industry in Canada,Most of the Canadian petroleum
2023-05-19T13:11:09+00:00,1155732348,1151222565,1,Justice2022,Petroleum industry in Azerbaijan,"Azerbaijani government, is a fully state-owned"
2023-05-19T13:10:00+00:00,1155732110,1154996989,1,Justice2022,Petroleum in the United States,the world's largest crude oil
2023-05-19T13:08:31+00:00,1155731841,1141793937,1,Justice2022,Petroleum industry in Nigeria,encouragement of local content
2023-05-19T13:07:02+00:00,1155731561,1141136845,1,Justice2022,Petroleum jelly,limited by a better scientific understanding
2023-05-19T13:05:29+00:00,1155731268,1138972414,1,Justice2022,Petroleum reservoir,there is an economic benefit
2023-05-19T13:04:06+00:00,1155731059,1151574548,1,Justice2022,Petroleum industry,net sales on Research & Development
2023-05-19T13:02:00+00:00,1155730661,1155490316,1,Justice2022,Petroleum,both state-led wars and other conflicts
2023-05-19T12:59:52+00:00,1155730262,1154565977,1,Justice2022,Fuel (band),"550 imprints, which released"
2023-05-19T12:58:37+00:00,1155730020,1152906409,1,Justice2022,Fuel efficiency,effort to the result of a process
